Basic Info,Commitment,Hardware Req,How To Pass,Language,Level,User Ratings,description,institutions,instructors,ratings,reviews,scrape_date,subjects,title,url
Course 4 of 7 in the Advanced Machine Learning Specialization ,"6 weeks of study, 3-6 hours/week for base track, 6-9 with all the horrors of honors section",,Pass all graded assignments to complete the course.,English,Advanced,4.8 starsAverage User Rating 4.8See what learners said,"About this course: Welcome to the Reinforcement Learning course. 

Here you will find out about:

- foundations of RL methods: value/policy iteration, q-learning, policy gradient, etc.
--- with math & batteries included

- using deep neural networks for RL tasks
--- also known as ""the hype train""

- state of the art RL algorithms
--- and how to apply duct tape to them for practical problems.

- and, of course, teaching your neural network to play games
--- because that's what everyone thinks RL is about. We'll also use it for seq2seq and contextual bandits.

Jump in. It's gonna be fun!",Created by:  National Research University Higher School of Economics,"['Taught by:\xa0\xa0Pavel Shvechikov, Researcher at HSE and Sberbank AI Lab', 'Taught by:\xa0\xa0Alexander Panin, Lecturer']",Rated 4.8 out of 5 of 8 ratings,See all reviews,2018-05-30,"['Home', 'Data Science', 'Machine Learning']",Practical Reinforcement Learning,https://www.coursera.org/learn/practical-rl
,"Ten weeks of study, 3-5 hours/week",,Pass all graded assignments to complete the course.,"English, Subtitles: Chinese (Simplified)",Beginner,4.1 starsAverage User Rating 4.1See what learners said,"About this course: This course offers you basic but valuable techniques used by a good translator in the translation between English and Chinese. We’ll discuss what is translation, what is good translation, and learn about how to produce good translations.

All the examples used in this course are taken from the course instructor's own translations of various genres and topics of writing. These examples are elaborated on to show you how to understand the idea, style and tone of the writer, the historical and cultural context of the writing, as well as the explicit and implied meanings of words, the grammatical structures of sentences, and the logic of sentences and paragraphs in order to achieve faithfulness, expressiveness, and elegance in the translation.

After completing this course, you will know what makes a qualified professional translator and acquire the abilities and skills that such a translator needs",Created by:  Nanjing University,['Taught by:\xa0\xa0Yuan Yao'],Rated 4.1 out of 5 of 7 ratings,See all 4 reviews,2018-05-30,"['Home', 'Language Learning', 'Learning English']",Translation in Practice,https://www.coursera.org/learn/translation-in-practice
Course 9 of 10 in the Data Science Specialization ,,,Pass all graded assignments to complete the course.,English,,4.5 starsAverage User Rating 4.5See what learners said,"About this course: A data product is the production output from a statistical analysis. Data products automate complex analysis tasks or use technology to expand the utility of a data informed model, algorithm or inference. This course covers the basics of creating data products using Shiny, R packages, and interactive graphics. The course will focus on the statistical fundamentals of creating a data product that can be used to tell a story about data to a mass audience.",Created by:  Johns Hopkins University,"['Taught by:\xa0\xa0Brian Caffo, PhD, Professor, Biostatistics', 'Taught by:\xa0\xa0Jeff Leek, PhD, Associate Professor, Biostatistics', 'Taught by:\xa0\xa0Roger D. Peng, PhD, Associate Professor, Biostatistics']","Rated 4.5 out of 5 of 1,299 ratings",See all 272 reviews,2018-05-30,"['Home', 'Data Science', 'Data Analysis']",Developing Data Products,https://www.coursera.org/learn/data-products
Course 2 of 5 in the Trading Strategies in Emerging Markets Specialization ,The estimated workload for this course is 4 to 5 hours per week,,Pass all graded assignments to complete the course.,English,Intermediate,4.6 starsAverage User Rating 4.6See what learners said,"About this course: This course covers two of the seven trading strategies that work in emerging markets. The seven  include strategies based on momentum, momentum crashes, price reversal, persistence of earnings, quality of earnings, underlying business growth, behavioral biases and textual analysis of business reports about the company.

In the first part of the course, you will learn how to read an academic paper. What parts to pay attention to and what parts to skim through will be discussed here. For every strategy, first you will be introduced to the original research and then how to implement the strategy.

The first strategy, Piotroski F -score will be discussed in detail. You will be taught how to calculate the F - Score and how to use this score in a strategy. This is followed by the next strategy, Post earnings announcement drift (PEAD).",Created by:  Indian School of Business,"['Taught by:\xa0\xa0Prasanna Tantri, Senior Associate Director']",Rated 4.6 out of 5 of 185 ratings,See all 31 reviews,2018-05-30,"['Home', 'Business', 'Finance']",Trading Algorithms,https://www.coursera.org/learn/trading-algorithm
,,,Pass all graded assignments to complete the course.,English,Beginner,4.5 starsAverage User Rating 4.5See what learners said,"About this course: Population ageing is occurring in nearly every country around the world. This MOOC takes a multidisciplinary approach to explore the impact of living longer and takes into account the technological advancements, the built environment, economics and ethics to rethink what it means to 'age well' now and in the future.

Rethinking Ageing is a uniquely designed course to give you a broad overview of the many complex issues involved as we as individuals get older and on the macro-level for population ageing. You may already have a particular interest in one discipline, such as mental health and ageing or age-friendly design. We encourage you, though, to use this course to explore the other perspectives on population ageing as the modules build on each other.

View the MOOC promotional video here: http://tinyurl.com/j7lz8q8",Created by:  The University of Melbourne,"['Taught by:\xa0\xa0Rob Moodie, Co-Chair Hallmark Ageing Research Initiative', 'Taught by:\xa0\xa0Simon Biggs, Professor of Gerontology & Social Policy', 'Taught by:\xa0\xa0Rebecca Kippen, Senior Research Fellow', 'Taught by:\xa0\xa0Louisa Remedios, Director of Teaching and Learning', 'Taught by:\xa0\xa0Debra Virtue, Lecturer', 'Taught by:\xa0\xa0Eleanor Curran, Consultant Psychiatrist', 'Taught by:\xa0\xa0Fernando Sanchez, Chair of Health Informatics', 'Taught by:\xa0\xa0Alan Pert,  Director', 'Taught by:\xa0\xa0Clare Newton, Associate Professor', 'Taught by:\xa0\xa0Jack Barton, Urban Data and eResearch Facilitator', 'Taught by:\xa0\xa0Ian McDonald, Emeritus Professor', 'Taught by:\xa0\xa0Briony Dow', 'Taught by:\xa0\xa0Dominique Martin, Lecturer', 'Taught by:\xa0\xa0Tara Sklar, MOOC Project Coordinator; Co-Director of Ageing Programs; Research Fellow in Health Law']",Rated 4.5 out of 5 of 30 ratings,See all 9 reviews,2018-05-30,"['Home', 'Life Sciences', 'Medicine and Healthcare']",Rethinking Ageing:  Are we prepared to live longer?,https://www.coursera.org/learn/ageing
,,,Pass all graded assignments to complete the course.,English,,4.6 starsAverage User Rating 4.6See what learners said,"About this course: A chemistry course to cover selected topics covered in advanced high school chemistry courses, correlating to the standard topics as established by the American Chemical Society.

Prerequisites: Students should have a background in basic chemistry including nomenclature, reactions, stoichiometry, molarity and thermochemistry.",Created by:  University of Kentucky,"['Taught by:\xa0\xa0Dr. Allison Soult, Lecturer', 'Taught by:\xa0\xa0Dr. Kim Woodrum, Sr. Lecturer']",Rated 4.6 out of 5 of 310 ratings,See all 78 reviews,2018-05-30,"['Home', 'Physical Science and Engineering', 'Chemistry']",Advanced Chemistry,https://www.coursera.org/learn/advanced-chemistry
Course 4 of 5 in the C# Programming for Unity Game Development Specialization ,"5 weeks of study, 5-10 hours/week for the first 4 weeks (1-2 hours in the final week)",Development requirements for Windows and Mac at https://unity3d.com/unity/system-requirements,Pass all graded assignments to complete the course.,English,Intermediate,,"About this course: This course is the fourth course in the specialization about learning how to develop video games using the C# programming language and the Unity game engine on Windows or Mac. Why use C# and Unity instead of some other language and game engine? Well, C# is a really good language for learning how to program and then programming professionally. Also, the Unity game engine is very popular with indie game developers; Unity games were downloaded 16,000,000,000 times in 2016! Finally, C# is one of the programming languages you can use in the Unity environment.

This course assumes you have the prerequisite knowledge from the previous three courses in the specialization. You should make sure you have that knowledge, either by taking those previous courses or from personal experience, before tackling this course. The required prerequisite knowledge is listed in the ""Who this class is for"" section below. Throughout this course you'll build on your foundational C# and Unity knowledge by developing more robust games with better object-oriented designs using various data structures and design patterns.

Data structures and design patterns are both general programming and software architecture topics that span all software, not just games. Although we'll discuss these ideas in the game domain, they also apply if you're writing a web app in ASP.NET, building a tool using WinForms, or any other software you decide to build. 

Module 1: Explore a Dynamic Array data structure and learn the basics of algorithm analysis
Module 2: Learn about and use the common Linked List and Graph data structures
Module 3: Learn about and use several additional data structures: Stacks, Queues, and Trees
Module 4: Learn why design patterns are so useful and discover a number of design patterns useful in game development
Module 5: Complete final peer review",Created by:  University of Colorado System,"['Taught by:\xa0\xa0Dr. Tim ""Dr. T"" Chamillard, Associate Professor']",Rated 5 out of 5 of 4 ratings,,2018-05-30,"['Home', 'Computer Science', 'Software Development']",Data Structures and Design Patterns for Game Developers,https://www.coursera.org/learn/data-structures-design-patterns
Course 4 of 5 in the Machine Learning with TensorFlow on Google Cloud Platform Specialization ,"2 weeks of study, 5-7 hours per week",You'll need a desktop web browser to run this course's interactive labs via Qwiklabs.,Pass all graded assignments to complete the course.,English,Intermediate,4.9 starsAverage User Rating 4.9See what learners said,"About this course: Want to know how you can improve the accuracy of your machine learning models? What about how to find which data columns make the most useful features? Welcome to Feature Engineering on Google Cloud Platform where we will discuss the elements of good vs bad features and how you can preprocess and transform them for optimal use in your machine learning models.

In this course you will get hands-on practice choosing features and preprocessing them inside of Google Cloud Platform with interactive labs. Our instructors will walk you through the code solutions which will also be made public for your reference as you work on your own future ML projects.",Created by:  Google Cloud,,Rated 4.9 out of 5 of 21 ratings,See all reviews,2018-05-30,"['Home', 'Data Science', 'Machine Learning']",Feature Engineering,https://www.coursera.org/learn/feature-engineering
Course 3 of 5 in the Financial Reporting Specialization ,"8 weeks of study, 6-8 hours a week",,Pass all graded assignments to complete the course.,English,Intermediate,,"About this course: This course is the third course in the five-course Financial Reporting Specialization. This course begins with a discussion of current liabilities and contingencies and continues with long-term debt and bonds.  The course next explores accounting model for leases, both lessees and lessors, and a discussion on deferred tax assets and liabilities. Participants will learn the latest accounting standards including the new accounting model for leases effective for public companies in 2019 and private companies in 2020.",Created by:  University of Illinois at Urbana-Champaign,"['Taught by:\xa0\xa0John Hepp, Clinical Assistant Professor of Accountancy']",Rated 4.8 out of 5 of 5 ratings,,2018-05-30,"['Home', 'Business', 'Business Essentials']",Accounting Analysis II: Measurement and Disclosure of Liabilities,https://www.coursera.org/learn/accounting-analysis-2-liabilities
Course 3 of 7 in the Bioinformatics Specialization ,,,Pass all graded assignments to complete the course.,English,Beginner,4.7 starsAverage User Rating 4.7See what learners said,"About this course: Once we have sequenced genomes in the previous course, we would like to compare them to determine how species have evolved and what makes them different.

In the first half of the course, we will compare two short biological sequences, such as genes (i.e., short sequences of DNA) or proteins.  We will encounter a powerful algorithmic tool called dynamic programming that will help us determine the number of mutations that have separated the two genes/proteins.

In the second half of the course, we will ""zoom out"" to compare entire genomes, where we see large scale mutations called genome rearrangements, seismic events that have heaved around large blocks of DNA over millions of years of evolution.  Looking at the human and mouse genomes, we will ask ourselves: just as earthquakes are much more likely to occur along fault lines, are there locations in our genome that are ""fragile"" and more susceptible to be broken as part of genome rearrangements?  We will see how combinatorial algorithms will help us answer this question.

Finally, you will learn how to apply popular bioinformatics software tools to solve problems in sequence alignment, including BLAST.",Created by:  University of California San Diego,"['Taught by:\xa0\xa0Pavel  Pevzner, Professor', 'Taught by:\xa0\xa0Phillip Compeau, Visiting Researcher', 'Taught by:\xa0\xa0Nikolay Vyahhi, Visiting Scholar']",Rated 4.7 out of 5 of 62 ratings,See all 14 reviews,2018-05-30,"['Home', 'Life Sciences', 'Bioinformatics']","Comparing Genes, Proteins, and Genomes (Bioinformatics III)",https://www.coursera.org/learn/comparing-genomes
Course 2 of 5 in the Data Visualization with Tableau Specialization ,"4 weeks of study, 5-7 hours/week",,Pass all graded assignments to complete the course.,English,Beginner,4.5 starsAverage User Rating 4.5See what learners said,"About this course: In this course, you will analyze and apply essential design principles to your Tableau visualizations. This course assumes you understand the tools within Tableau and have some knowledge of the fundamental concepts of data visualization. You will define and examine the similarities and differences of exploratory and explanatory analysis as well as begin to ask the right questions about what’s needed in a visualization. You will assess how data and design work together, including how to choose the appropriate visual representation for your data, and the difference between effective and ineffective visuals. You will apply effective best practice design principles to your data visualizations and be able to illustrate examples of strategic use of contrast to highlight important elements. You will evaluate pre-attentive attributes and why they are important in visualizations. You will exam the importance of using the ""right"" amount of color and in the right place and be able to apply design principles to de-clutter your data visualization.","Created by:  University of California, Davis","['Taught by:\xa0\xa0Govind Acharya, Principal Analyst', 'Taught by:\xa0\xa0Hunter Whitney, Sr. Consultant, Author, Instructor']",Rated 4.5 out of 5 of 529 ratings,See all 91 reviews,2018-05-30,"['Home', 'Data Science', 'Data Analysis']",Essential Design Principles for Tableau,https://www.coursera.org/learn/dataviz-design
Course 3 of 4 in the Machine Learning Specialization ,"7 weeks of study, 5-8 hours/week",,Pass all graded assignments to complete the course.,English,,4.7 starsAverage User Rating 4.7See what learners said,"About this course: Case Studies: Analyzing Sentiment & Loan Default Prediction

In our case study on analyzing sentiment, you will create models that predict a class (positive/negative sentiment) from input features (text of the reviews, user profile information,...).  In our second case study for this course, loan default prediction, you will tackle financial data, and predict when a loan is likely to be risky or safe for the bank. These tasks are an examples of classification, one of the most widely used areas of machine learning, with a broad array of applications, including ad targeting, spam detection, medical diagnosis and image classification. 

In this course, you will create classifiers that provide state-of-the-art performance on a variety of tasks.  You will become familiar with  the most successful techniques, which are most widely used in practice, including logistic regression, decision trees and boosting.  In addition, you will be able to design and implement the underlying algorithms that can learn these models at scale, using stochastic gradient ascent.  You will implement these technique on real-world, large-scale machine learning tasks.  You will also address significant tasks you will face in real-world applications of ML, including handling missing data and measuring precision and recall to evaluate a classifier.  This course is hands-on, action-packed, and full of visualizations and illustrations of how these techniques will behave on real data.  We've also included optional content in every module, covering advanced topics for those who want to go even deeper! 

Learning Objectives: By the end of this course, you will be able to:
   -Describe the input and output of a classification model.
   -Tackle both binary and multiclass classification problems.
   -Implement a logistic regression model for large-scale classification.  
   -Create a non-linear model using decision trees.
   -Improve the performance of any model using boosting.
   -Scale your methods with stochastic gradient ascent.
   -Describe the underlying decision boundaries.  
   -Build a classification model to predict sentiment in a product review dataset.  
   -Analyze financial data to predict loan defaults.
   -Use techniques for handling missing data.
   -Evaluate your models using precision-recall metrics.
   -Implement these techniques in Python (or in the language of your choice, though Python is highly recommended).",Created by:  University of Washington,"['Taught by:\xa0\xa0Carlos Guestrin, Amazon Professor of Machine Learning', 'Taught by:\xa0\xa0Emily Fox, Amazon Professor of Machine Learning']","Rated 4.7 out of 5 of 2,182 ratings",See all 357 reviews,2018-05-30,"['Home', 'Data Science', 'Machine Learning']",Machine Learning: Classification,https://www.coursera.org/learn/ml-classification
Course 4 of 6 in the An Introduction to Programming the Internet of Things (IOT) Specialization ,,,Pass all graded assignments to complete the course.,English,,4.6 starsAverage User Rating 4.6See what learners said,"About this course: The Raspberry Pi is a small, affordable single-board computer that you will use to design and develop fun and practical IoT devices while learning programming and computer hardware. In addition, you will learn how to set up up the Raspberry Pi environment, get a Linux operating system running, and write and execute some basic Python code on the Raspberry Pi. You will also learn how to use Python-based IDE (integrated development environments) for the Raspberry Pi and how to trace and debug Python code on the device. Please note that this course does not include discussion forums.","Created by:  University of California, Irvine","['Taught by:\xa0\xa0Ian Harris, Professor']","Rated 4.6 out of 5 of 1,017 ratings",See all 185 reviews,2018-05-30,"['Home', 'Computer Science', 'Software Development']",The Raspberry Pi Platform and Python Programming for the Raspberry Pi,https://www.coursera.org/learn/raspberry-pi-platform
Course 3 of 4 in the Fundamentals of Computer Network Security Specialization ,,,Pass all graded assignments to complete the course.,English,Intermediate,4.1 starsAverage User Rating 4.1See what learners said,"About this course: In this MOOC, you will learn how to hack web apps with command injection vulnerabilities in a web site of your AWS Linux instance.   You will learn how to search valuable information on a typical Linux systems with LAMP services, and deposit and hide Trojans for future exploitation.  You will learn how to patch these web apps with input validation using regular expression. You will learn a security design pattern to avoid introducing injection vulnerabilities by input validation and replacing generic system calls with specific function calls.  You will learn how to hack web apps with SQL injection vulnerabilities and retrieve user profile information and passwords.  You will learn how to patch them with input validation and SQL parameter binding.  You will learn the hacking methodology, Nessus tool for scanning vulnerabilities, Kali Linux for penetration testing, and Metasploit Framework for gaining access to vulnerable Windows Systems, deploying keylogger, and perform Remote VNC server injection.  You will learn security in memory systems and virtual memory layout, and understand buffer overflow attacks and their defenses.  You will learn how to clone a Kali instance with AWS P2 GPU support and perform hashcat password cracking using dictionary attacks and known pattern mask attacks.",Created by:  University of Colorado System,"['Taught by:\xa0\xa0Edward Chow, Professor']",Rated 4.1 out of 5 of 14 ratings,See all reviews,2018-05-30,"['Home', 'Computer Science', 'Computer Security and Networks']",Hacking and Patching,https://www.coursera.org/learn/hacking-patching
,,No special hardware required.,Pass all graded assignments to complete the course.,English,Intermediate,4.8 starsAverage User Rating 4.8See what learners said,"About this course: This course introduces learners to a variety of infectious diseases using a patient-centered, story-based approach. Through illustrated, short videos, learners will follow the course of each patient’s illness, from initial presentation to resolution. Integrating the relevant microbiology, pathophysiology and immunology, this course aims to engage and entice the learner towards future studies in microbiology, immunology and infectious diseases. 

The patient-centered videos included in this course were created as part of the Re-imagining Medical Education initiative, led by Charles Prober MD, Senior Associate Dean of Medical Education at the Stanford School of Medicine. This initiative was the first of its kind to explore the collaborative creation of foundational medical education online content by inter-institutional teams of faculty. The content presented in this course was created by faculty from Stanford University School of Medicine, in collaboration with The University of Washington School of Medicine, Duke University School of Medicine, UCSF School of Medicine, and The University of Michigan Medical School. Support for this initiative was provided by the Robert Wood Johnson Foundation and the Burke Family Foundation.

PLEASE NOTE: Information provided in this course is for educational purposes only and is not intended to be used for diagnostic and/or treatment purposes.",Created by:  Stanford University,"['Taught by:\xa0\xa0Maya Adam, MD, Lecturer']",Rated 4.8 out of 5 of 466 ratings,See all 149 reviews,2018-05-30,"['Home', 'Life Sciences', 'Medicine and Healthcare']",Stories of Infection,https://www.coursera.org/learn/stories-of-infection
,视频，测验与同伴互评共12小时,,Pass all graded assignments to complete the course.,"English, Subtitles: Chinese (Simplified)",,4.2 starsAverage User Rating 4.2See what learners said,"About this course: 谈到中华传统文化，大家首先想到的莫过于以孔子思想为代表的儒学思想，但中华传统文化绝不止这些；谈到中医药，大家第一印象可能是针灸、按摩，因为她们已经走向全球，但中医药也远不止如此。医学、生物学飞速发展的21世纪，中医药学这一古老学科为什么还有生命力？她与现代医药学有何不同？为什么很多人觉得中医药知识体系不容易学习和掌握？因为：中医药学具有深厚的中华传统文化背景，如果不了解中华传统文化，就难以深入理解中医药学的思想和知识。
本课程就是希望通过剖析中医药与中华传统文化的密切联系，使大家了解中医药学的中华传统文化的背景，更容易理解中医药的思维特征、思想特色和知识体系。通过本课程的学习，不仅能掌握一些中医药的基本知识、中医药养生的原理和方法，还能从中医药的视角认识中华传统文化的精髓。",Created by:  Shanghai Jiao Tong University,"['Taught by:\xa0\xa0Peng Chongsheng, Associate Professor']",Rated 4.2 out of 5 of 105 ratings,See all 24 reviews,2018-05-30,"['Home', 'Life Sciences', 'Medicine and Healthcare']",中医药与中华传统文化 ,https://www.coursera.org/learn/zhong-yi-yao-wen-hua
