Basic Info,Commitment,Hardware Req,How To Pass,Language,Level,User Ratings,description,institutions,instructors,ratings,reviews,scrape_date,subjects,title,url
,,,Pass all graded assignments to complete the course.,"English, Subtitles: Spanish, Hindi, Japanese, Chinese (Simplified)",,4.9 starsAverage User Rating 4.9See what learners said,"About this course: Machine learning is the science of getting computers to act without being explicitly programmed. In the past decade, machine learning has given us self-driving cars, practical speech recognition, effective web search, and a vastly improved understanding of the human genome. Machine learning is so pervasive today that you probably use it dozens of times a day without knowing it. Many researchers also think it is the best way to make progress towards human-level AI. In this class, you will learn about the most effective machine learning techniques, and gain practice implementing them and getting them to work for yourself. More importantly, you'll learn about not only the theoretical underpinnings of learning, but also gain the practical know-how needed to quickly and powerfully apply these techniques to new problems. Finally, you'll learn about some of Silicon Valley's best practices in innovation as it pertains to machine learning and AI.

This course provides a broad introduction to machine learning, datamining, and statistical pattern recognition. Topics include: (i) Supervised learning (parametric/non-parametric algorithms, support vector machines, kernels, neural networks). (ii) Unsupervised learning (clustering, dimensionality reduction, recommender systems, deep learning). (iii) Best practices in machine learning (bias/variance theory; innovation process in machine learning and AI). The course will also draw from numerous case studies and applications, so that you'll also learn how to apply learning algorithms to building smart robots (perception, control), text understanding (web search, anti-spam), computer vision, medical informatics, audio, database mining, and other areas.",Created by:  Stanford University,"['Taught by:\xa0\xa0Andrew Ng, Co-founder, Coursera; Adjunct Professor, Stanford University; formerly head of Baidu AI Group/Google Brain']","Rated 4.9 out of 5 of 74,001 ratings","See all 18,573 reviews",2018-05-30,"['Home', 'Data Science', 'Machine Learning']",Machine Learning,https://www.coursera.org/learn/machine-learning
Course 1 of 6 in the Emerging Technologies: From Smartphones to IoT to Big Data Specialization ,,,Pass all graded assignments to complete the course.,"English, Subtitles: Vietnamese, Spanish, Chinese (Simplified)",,4.1 starsAverage User Rating 4.1See what learners said,"About this course: Smartphones are one of the most influential devices that we use in our everyday lives. Smartphones consist of the most advanced hardware and software technologies that exist in the world, all combined together into a miraculous single easy-to-use portable system.

These lectures focus on the specifications, hardware modules, and OS (Operating System) iOS & Android that enable smartphones to perform various features and functionalities. Since there are so many smartphone types, in the lectures, three smartphones were selected and compared. The lecture covers the specifications of the Samsung Galaxy S6 edge, LG G4, and the iPhone 6 plus, which are among the most popular recently released smartphones in the world!

With this new knowledge on Cellular Networks, Wi-Fi, Bluetooth, Platform, OS (Operating System), Chipsets, CPU (Central Processing Unit), GPU (Graphics Processing Unit), Display, Location & Navigation system, and new Wireless Charging systems, you will be able to analyze, design, and plan new smartphones for the future.",Created by:  Yonsei University,"['Taught by:\xa0\xa0Jong-Moon Chung, Professor, School of Electrical & Electronic Engineering']",Rated 4.1 out of 5 of 643 ratings,See all 140 reviews,2018-05-30,"['Home', 'Physical Science and Engineering', 'Electrical Engineering']",Smartphone Emerging Technologies,https://www.coursera.org/learn/smartphone-emerging-technologies
Course 1 of 4 in the Learn Mandarin Chinese Specialization ,"5 weeks, about 3 hours per week.",,Pass all graded assignments to complete the course.,"English, Subtitles: Chinese (Simplified)",Beginner,4.7 starsAverage User Rating 4.7See what learners said,"About this course: Mandarin Chinese 1: Chinese for beginners is a beginner's course of Mandarin Chinese. It uses lectures, short plays, interactive exercises and cultural tips to help learners build a fundamental capability of oral Chinese in real-life situations. At the end of the 5-week course, the learners will reach the following proficiency: 
♦ 150 words
♦ 20 language points
♦ handling 5 real-life situations
This is a beginners' course, therefore no prerequisite is required.",Created by:  Shanghai Jiao Tong University,"['Taught by:\xa0\xa0Wang Jun, Associate Professor', 'Taught by:\xa0\xa0An Na, Ph.D., Lecturer ']",Rated 4.7 out of 5 of 178 ratings,See all 51 reviews,2018-05-30,"['Home', 'Language Learning', 'Other Languages']",Mandarin Chinese 1: Chinese for Beginners,https://www.coursera.org/learn/mandarin-chinese-1
Course 4 of 5 in the Public Relations For Digital Media Specialization ,"4 weeks, 6-8 hours per week",,Pass all graded assignments to complete the course.,English,,4.6 starsAverage User Rating 4.6See what learners said,"About this course: Have you ever wondered why some videos go viral while others flop or how some companies have successfully leveraged Facebook and Twitter to reach out to their customers and clients? How are some companies able to effectively navigate the world of social media and build thriving online communities while others flounder, crash and burn? These questions along with many others concerning the use of, management and effects of social media in today's world will be covered in this course.

Embark on a journey into the realm of social media in public relations and explore the dynamics and management of social media and how it has changed public relations. We will examine the impact of digital influence, the relationship between traditional and social media as well as some of the pitfalls in the use of social media. You will also learn how to cultivate and manage relationships in social media, engage the online community, and plan and manage online content. We will also take a look at some ways of to measure and evaluate social media campaigns.  

Come, join me in this course and take the first step towards an exciting and rewarding career in social media.",Created by:  National University of Singapore,"['Taught by:\xa0\xa0Tracy Loh, Visiting Fellow']",Rated 4.6 out of 5 of 239 ratings,See all 59 reviews,2018-05-30,"['Home', 'Social Sciences', 'Governance and Society']",Social Media in Public Relations,https://www.coursera.org/learn/social-media-pr
Course 4 of 4 in the Solving Complex Problems Specialization ,,,Pass all graded assignments to complete the course.,English,Beginner,5.0 starsAverage User Rating 5.0See what learners said,"About this course: From the very start of the specialization, your assignments will be geared toward tackling a complex issue of your choice that you face in your career path, industry, or field. Each phase of the course builds up to a briefing paper that analyzes, evaluates, and attempts to solve a highly complex problem. Not only does this course teach you a skill set, but it puts you further down the road in understanding the problems of your chosen field. It advances your knowledge of your own field by teaching you to look at it in new ways. This is the CAPSTONE where the scaffolding of our problem solving and innovation skills will bear fruit in a series of preparatory assignments to make your briefing paper as effective as possible.",Created by:  Macquarie University,"['Taught by:\xa0\xa0Shawn Ross, Associate Professor', 'Taught by:\xa0\xa0David Baker, Associate Lecturer', 'Taught by:\xa0\xa0David Christian, Professor']",Rated 5 out of 5 of 2 ratings,See all reviews,2018-05-30,"['Home', 'Business', 'Leadership and Management']",Solving Complex Problems Capstone,https://www.coursera.org/learn/solving-complex-problems
,"7 weeks of study, 6-8 hours/week",,Pass all graded assignments to complete the course.,English,,4.8 starsAverage User Rating 4.8See what learners said,"About this course: While the human genome sequence has transformed our understanding of human biology, it isn’t just the sequence of your DNA that matters, but also how you use it! How are some genes activated and others are silenced? How is this controlled? The answer is epigenetics.  

Epigenetics has been a hot topic for research over the past decade as it has become clear that aberrant epigenetic control contributes to disease (particularly to cancer). Epigenetic alterations are heritable through cell division, and in some instances are able to behave similarly to mutations in terms of their stability. Importantly, unlike genetic mutations, epigenetic modifications are reversible and therefore have the potential to be manipulated therapeutically. It has also become clear in recent years that epigenetic modifications are sensitive to the environment (for example diet), which has sparked a large amount of public debate and research.

This course will give an introduction to the fundamentals of epigenetic control. We will examine epigenetic phenomena that are manifestations of epigenetic control in several organisms, with a focus on mammals. We will examine the interplay between epigenetic control and the environment and finally the role of aberrant epigenetic control in disease.

All necessary information will be covered in the lectures, and recommended and required readings will be provided. There are no additional required texts for this course. For those interested, additional information can be obtained in the following textbook.

Epigenetics. Allis, Jenuwein, Reinberg and Caparros. Cold Spring Harbour Laboratory Press. ISBN-13: 978-0879697242 | Edition: 1",Created by:  The University of Melbourne,"['Taught by:\xa0\xa0Dr. Marnie Blewitt, Head, Molecular Medicine Laboratory ']",Rated 4.8 out of 5 of 317 ratings,See all 81 reviews,2018-05-30,"['Home', 'Life Sciences', 'Biology']",Epigenetic Control of Gene Expression,https://www.coursera.org/learn/epigenetics
,,,,,,,,,,,,2018-05-30,,Sorry,https://www.coursera.org/learn/fake-news-facts-alternative-facts-michiganx-teachout-2x
Course 3 of 7 in the Global Challenges in Business Specialization ,,,Pass all graded assignments to complete the course.,English,,4.8 starsAverage User Rating 4.8See what learners said,"About this course: Starting in the late 1990s, “globalization” became a buzzword to describe the apparent integration of markets in the world economy. Many authors and pundits claimed that the world was converging towards a market-friendly democratic place, while gurus and consulting firms were not short of formulae and advice on how to make profits out of the global economy. Decades later, new realities show that globalization does not mean political, cultural, and economic convergence and that forces against it are strong.

This course seeks to help you understand the forces of globalization and how cross-cultural management and the relationship of a multinational organization to various host countries is becoming more and more critical in today’s global economy. This course begins with the discussion of these issues and global relationships and delves into a deeper understanding of business strategy in today’s global business marketplace.

Upon successful completion of this course, you will be able to:
•	Understand how we got here and why it matters
•	Understand the complexities of the current globalization (not all countries are the same)
•	Evaluate the effects of international trade regulations on international business
•	Evaluate when and why should we operate as multinationals

This course is part of the iMBA offered by the University of Illinois, a flexible, fully-accredited online MBA at an incredibly competitive price. For more information, please see the Resource page in this course and onlinemba.illinois.edu.",Created by:  University of Illinois at Urbana-Champaign,"['Taught by:\xa0\xa0Marcelo Bucheli, Associate Professor']",Rated 4.8 out of 5 of 16 ratings,See all reviews,2018-05-30,"['Home', 'Business', 'Business Strategy']",Global Strategy I: How The Global Economy Works,https://www.coursera.org/learn/global-strategy
,2-3 hours/week,,Pass all graded assignments to complete the course.,English,Beginner,4.4 starsAverage User Rating 4.4See what learners said,"About this course: Archaeoastronomy is the “science of stars and stones”.  It is an interdisciplinary science in between architecture, archaeology, and astronomy. It studies the relationships between the ancient monuments and the sky, in order to gain a better understanding of the ideas of the architects of the past and of their religious and symbolic world. The course provides the first complete, easy introduction to this fascinating discipline.
During the course, many spectacular ancient sites of archaeology – such as Stonehenge in England, Giza and Karnak in Egypt, Chichen Itzá in the Yucatan, Macchu Picchu in Peru and the Pantheon in Rome – will be visited and the fascinating events occurring there in special days of the year (such as solstices, equinoxes, or the day of the foundation of Rome) will be shown and explained. The course also provides the necessary background on Astronomy with the naked eye and a general introduction to the role of Astronomy in religion and in the management of power among ancient cultures.",Created by:  Politecnico di Milano,"['Taught by:\xa0\xa0Giulio Magli, Full Professor']",Rated 4.4 out of 5 of 272 ratings,See all 77 reviews,2018-05-30,"['Home', 'Physical Science and Engineering', 'Physics and Astronomy']",Archaeoastronomy,https://www.coursera.org/learn/archaeoastronomy
Course 1 of 4 in the Inspirational Leadership: Leading with Sense Specialization ,"3 weeks, 2-4 hours/week",,Pass all graded assignments to complete the course.,"English, Subtitles: Vietnamese, Greek, French",,4.5 starsAverage User Rating 4.5See what learners said,"About this course: When taking this course, you will raise your own self-awareness and gain self-confidence for a better leadership. 
You will discover a new approach to leadership based on trust and sense. 
The “Savoir-Relier” leadership, a new approach of leadership, taught to HEC MBA’s student and top executives, enables better team leadership and encourages relationships between people in spite of their differences of opinion. 

You will develop relational skills, self-knowledge and self-awareness on the way to unfold your own leadership style. You’ll learn the skills of The Savoir-Relier (SR) methodology for better connecting with yourself or others by going through the following 4 steps for successful leadership: Introspection, Conversation, Resilience and Responsibility toward Value Creation. 
In this first MOOC of the ""Inspirational Leadership"" specialization, you will practice the first two steps of the method for successful leadership: Introspection and Conversation. You will get to know yourself better during the Introspection part and get a chance to improve your communication skills in order to better interact with others. You will meet people like you who will share their stories and their experience with Savoir-Relier and why it is so inspiring for them in their life. Together, you’ll develop greater self-awareness by developing a leadership self-portrait and going through fun activities to increase your empathy and communication.

Leaders from different organizations and participants of the HEC Paris Leadership Certificate, the program from which this course and specialization are inspired, will share with you their insights about what it takes to become a great leader and what they are able to achieve now that they apply The Savoir-Relier methodology. 

This course is part of the specialization “Inspirational Leadership: Leading with Sense”. In the next courses, you'll go through the second two steps of leadership: Resilience and Responsibility toward Value Creation.",Created by:  HEC Paris,"['Taught by:\xa0\xa0Valérie Gauthier, Associate Professor, HEC Paris ']",Rated 4.5 out of 5 of 856 ratings,See all 203 reviews,2018-05-30,"['Home', 'Business', 'Leadership and Management']",Building Your Leadership Skills,https://www.coursera.org/learn/leadership-skills
,3 hours/week,,Pass all graded assignments to complete the course.,English,Beginner,4.8 starsAverage User Rating 4.8See what learners said,"About this course: Learn how theatre and globalization have affected each other over the past century, and how to conduct your own research on global theatre histories.",Created by:  Ludwig-Maximilians-Universität München (LMU),"['Taught by:\xa0\xa0Christopher Balme, Professor']",Rated 4.8 out of 5 of 48 ratings,See all 12 reviews,2018-05-30,"['Home', 'Arts and Humanities', 'Music and Art']",Theatre and Globalization,https://www.coursera.org/learn/global-theatre
,"4 weeks, 2-3 hours",,Pass all graded assignments to complete the course.,English,Beginner,4.1 starsAverage User Rating 4.1See what learners said,"About this course: This course presents the principles of evolution and ecology for citizens and students interested in studying biology and environmental sciences. It discusses major ideas and results. Recent advances have energised these fields with evidence that has implications beyond their boundaries: ideas, mechanisms, and processes that should form part of the toolkit of all biologists and educated citizens.

Major topics covered by the course include fundamental principles of ecology, how organisms interact with each other and their environment, evolutionary processes, population dynamics, communities, energy flow and ecosystems, human influences on ecosystems, and the integration and scaling of ecological processes through systems ecology.
 
This course will also review major ecological concepts, identify the techniques used by ecologists, provide an overview of local and global environmental issues, and examine individual, group and governmental activities important for protecting natural ecosystems. The course has been designed to provide information, to direct the student toward pertinent literature, to identify problems and issues, to utilise research methodology for the study of ecology and evolution, and to consider appropriate solutions and analytical techniques. 

Needed Learner Background: general biology and a good understanding of English.

This course has the following expectations and results:
1) covers the theoretical and practical issues involved in ecology and evolution,
2) conducting surveys and inventories in ecology, 
3) analyzing the information gathered, 
4) and applying their analysis to ecological and conservation problems.",Created by:  National Research Tomsk State University,"['Taught by:\xa0\xa0Roberto Cazzolla Gatti, Ph.D., Associate Professor in Ecology and Biodiversity']",Rated 4.1 out of 5 of 42 ratings,See all 12 reviews,2018-05-30,"['Home', 'Life Sciences', 'Biology']",Ecology: from cells to Gaia,https://www.coursera.org/learn/ecology
,"11 weeks of study, 2-3 hours a week",,Pass all graded assignments to complete the course.,English,Beginner,4.8 starsAverage User Rating 4.8See what learners said,"About this course: This course weds business strategy with the principles of macroeconomics. It offers valuable a powerful toolbox together with cases and lessons across all major functions of business, management, from finance, operations management, and marketing to human resource management, organizational behavior, statistics, and, of course, business strategy.","Created by:  University of California, Irvine","['Taught by:\xa0\xa0Dr. Peter Navarro, Professor']",Rated 4.8 out of 5 of 11 ratings,See all 2 reviews,2018-05-30,"['Home', 'Business', 'Business Strategy']",Strategic Business Management - Macroeconomics,https://www.coursera.org/learn/strategic-business-management-macroeconomics
,,,Pass all graded assignments to complete the course.,English,Beginner,4.1 starsAverage User Rating 4.1See what learners said,"About this course: This course presents some important vignettes of a complex, highly diverse India that is also witnessing unprecedented changes since its formal independence in 1947 from Great Britain. The lectures revolve around social dimensions of change, the continuing influence of ancient texts on contemporary India, political democracy, economic transition from the state to the market, gender relations, India's economic globalisation and changing world view.

While one of the objectives is to capture the multifaceted process of change, the course also critically examines some of the tensions inherent in these changes. For example, how does gender inequality play itself out in a changing Indian society, how do the modernist conceptions of art entailing market valuation challenge the more socio-centric values found in South India, what are the politics linguistic identities, and how might India address its myriad development challenges such as poverty and unemployment.

No specific prior knowledge is required. However, it would be helpful if students are aware of the socio political dynamics at play in contemporary India and keep themselves abreast with current affairs and debates in the country to fully appreciate the various dimensions and contours if the subject matter in the course.

This course is taught in English.

View the MOOC promotional video here: http://tinyurl.com/hx8mhxb",Created by:  The University of Melbourne,"[""Taught by:\xa0\xa0Anthony D'Costa, Professor""]",Rated 4.1 out of 5 of 29 ratings,See all 8 reviews,2018-05-30,"['Home', 'Social Sciences', 'Governance and Society']",Contemporary India ,https://www.coursera.org/learn/india
,,,Pass all graded assignments to complete the course.,English,Beginner,4.8 starsAverage User Rating 4.8See what learners said,"About this course: This course assumes no prior knowledge in law, business or engineering.  However, students with backgrounds in all three areas will find useful concepts or ideas in the course on how to protect business innovations using patents.  The approach taken in this course is practical and commercial rather than theoretical. A combination of lectures and case studies help to illustrate the concepts and make the course more interesting.   

After completing this course, students should be able to understand how patents are issued and protect innovations, including: What is a patent? What do they protect? How do we get a patent? Where are patents valid? How much do they cost?  

In addition to basic concepts the course also deals with advanced topics such as: software patents, business process patents, patenting life, patent trolls and multiple case examples of large and small companies using patents and patent lawsuits. 

We also expect you to have fun in this course.  So go forth and enjoy!",Created by:  The Hong Kong University of Science and Technology,"['Taught by:\xa0\xa0 Theodore Henry King CLARK, Associate Professor']",Rated 4.8 out of 5 of 17 ratings,See all 2 reviews,2018-05-30,"['Home', 'Business', 'Business Strategy']",Protecting Business Innovations via Patent,https://www.coursera.org/learn/protect-business-innovations-patent
Course 1 of 5 in the Cybersecurity Specialization ,"7 weeks of study, 5-8 hours/week",,Pass all graded assignments to complete the course.,English,,4.5 starsAverage User Rating 4.5See what learners said,"About this course: This course focuses on how to design and build secure systems with a human-centric focus. We will look at basic principles of human-computer interaction, and apply these insights to the design of secure systems with the goal of developing security measures that respect human performance and their goals within a system.","Created by:  University of Maryland, College Park","['Taught by:\xa0\xa0Jennifer Golbeck, Director']",Rated 4.5 out of 5 of 988 ratings,See all 250 reviews,2018-05-30,"['Home', 'Computer Science', 'Computer Security and Networks']",Usable Security,https://www.coursera.org/learn/usable-security
