Basic Info,Commitment,Hardware Req,How To Pass,Language,Level,User Ratings,description,institutions,instructors,ratings,reviews,scrape_date,subjects,title,url
,"3 weeks of study ,1-3 hours/week",,Pass all graded assignments to complete the course.,English,Beginner,3.8 starsAverage User Rating 3.8See what learners said,"About this course: What will you learn?

Embedded Systems are so ubiquitous that some of us take them for granted: we find them in smartphones, GPS systems, airplanes and so on. But have you ever wondered how these devices actually work? If so, you're in the right place! 

In this course, you'll learn about the characteristics of embedded systems: the possibilities, dangers, complications and recipes for success. We'll discuss all of this in the framework of a flourishing embedded systems field: the Internet of Things, where billions of intercommunicating devices could enable unprecedented, innovative products and services. If you'd like to learn how to create similarly innovative products, then this is the course for you!

At the end of the course, you'll be able to:
- make the right choice for your own project when it comes to the target market, parallel executions, time and the lifecycle of your system
- hack, avoid failure and promote success 
- decide whether to buy or to build components
- how to assemble a good team
- install case tools
- learn how to work with SysML

This is an introductory course. Check out our more advanced course Architecting Smart IoT Devices soon if you want to go beyond the basics!",Created by:  EIT Digital ,"['Taught by:\xa0\xa0Martin Timmerman, Prof Dr']",Rated 3.8 out of 5 of 56 ratings,See all 12 reviews,2018-05-30,"['Home', 'Computer Science', 'Computer Security and Networks']",Introduction to Architecting Smart IoT Devices,https://www.coursera.org/learn/iot-devices
,"7 weeks of study, 3-5 hours/week",,Pass all graded assignments to complete the course.,English,Beginner,4.8 starsAverage User Rating 4.8See what learners said,"About this course: This course 'Unethical decision making in organizations : A seminar on the dark side of the force' will teach you how strong organizational contexts push good people towards unethical decisions. You will also learn how to protect yourself and your organization against such forces lurking in the dark.

About the Course

This course teaches how narrow frames and strong contexts can push good people towards unethical decisions and how they can protect themselves and their organization against ethical blindness.

The goal of this course is to empower the participants to analyze the risks of unethical or illegal behavior that might be triggered by powerful contexts. It draws from various disciplines such as management, psychology, sociology, philosophy, and literature, in order to learn what these disciplines contribute to a better understanding of unethical behavior. The course also analyzes some of the most prominent organizational scandals of the recent decades through the lenses of these disciplines.

Whenever we hear about ethical scandals, we tend to believe that unethical or illegal behaviour in organizations is driven by character deficiencies of individual actors. Put differently, we simply assume that bad things are done by bad people. However, numerous corporate scandals have demonstrated that even people with a high level of integrity can break the rules if they are put into a strong context.

A better understanding of why and under what conditions good people make bad ethical decisions will enable us to better protect individuals as well as their respective organizations against the potentially overwhelming power of the context. It will also enable us to cure societies from problems like corruption.

At the end of the course, you are able to:

1.    Explain the impact of social context on individual decision making using various theories (from Management, Sociology, Psychology, and Philosophy) 
2.    Apply these theories to the analysis of some of the most eminent organizational scandals of the recent decades 
3.    Assess risks of ethical blindness in your own organizational context 
4.    Design interventions to reduce such risks for yourself and your organization 


Recommended Background

No background expertise is required. The course is open for interested layperson as well as experts who work on related topics, be it as researchers or practitioners (e.g., compliance managers in corporations).

Why is this course important for me? 

Currently, the understanding of why good people make unethical decisions is rather limited, related research is rather fragmented, and the management of such problems in organizations is overly simplistic, legalistic, and inadequate. Understanding contexts, including the dangers of routines, the mindlessness of our daily decisions, and the healing power of mindful decision-making routines is of increasing importance. In this course, you will learn the latest knowledge and the appropriate tool box for dealing with ethical challenges that you will face throughout your life!

What do I need to follow this course? 

We build bridges between various scientific disciplines and will familiarize you with those disciplines smoothly. You need no expertise, just come and share your own real-world experiences about unethical decisions. After all, we are all experts in making decisions—some more ethically, some less ethically—aren’t we?",Created by:  University of Lausanne,"['Taught by:\xa0\xa0Guido Palazzo, Professor of Business Ethics', 'Taught by:\xa0\xa0Ulrich Hoffrage, Professor of Decision Theory ']",Rated 4.8 out of 5 of 167 ratings,See all 63 reviews,2018-05-30,"['Home', 'Social Sciences', 'Psychology']",Unethical Decision Making in Organizations,https://www.coursera.org/learn/unethical-decision-making
Course 4 of 5 in the Fundamentos Empresariales  Specialization ,"4 weeks of study, 4-7 hours a week",,Pass all graded assignments to complete the course.,"Spanish, Subtitles: English",,4.6 starsAverage User Rating 4.6See what learners said,About this course: Este curso proporciona una breve introducción a los fundamentos de las finanzas. Puedes aplicar estas habilidades en un reto empresarial real como parte de la Programa Especializado de Fundamentos Empresariales de Wharton.,Created by:  University of Pennsylvania,"['Taught by:\xa0\xa0Michael R Roberts, William H. Lawrence Professor of Finance, the Wharton School, University of Pennsylvania']",Rated 4.6 out of 5 of 52 ratings,See all 10 reviews,2018-05-30,"['Home', 'Business', 'Business Strategy']",Introducción a las Finanzas Corporativas,https://www.coursera.org/learn/wharton-finanzas-corporativas
Course 1 of 6 in the Data Structures and Algorithms Specialization ,"5 weeks of study, 4-8 hours/week",,Pass all graded assignments to complete the course.,"English, Subtitles: Spanish",Intermediate,4.6 starsAverage User Rating 4.6See what learners said,"About this course: The course covers basic algorithmic techniques and ideas for computational problems arising frequently in practical applications: sorting and searching, divide and conquer, greedy algorithms, dynamic programming. We will learn a lot of theory: how to sort data and how it helps for searching; how to break a large problem into pieces and solve them recursively; when it makes sense to proceed greedily; how dynamic programming is used in genomic studies. You will practice solving computational problems, designing new algorithms, and implementing solutions efficiently (so that they run in less than a second).","Created by:  University of California San Diego, National Research University Higher School of Economics","['Taught by:\xa0\xa0Alexander S. Kulikov, Visiting Professor', 'Taught by:\xa0\xa0Michael Levin, Lecturer', 'Taught by:\xa0\xa0Neil Rhodes, Adjunct Faculty', 'Taught by:\xa0\xa0Pavel  Pevzner, Professor', 'Taught by:\xa0\xa0Daniel M Kane, Assistant Professor']","Rated 4.6 out of 5 of 3,055 ratings",See all 620 reviews,2018-05-30,"['Home', 'Computer Science', 'Algorithms']",Algorithmic Toolbox,https://www.coursera.org/learn/algorithmic-toolbox
Course 2 of 5 in the Investment Management Specialization ,,,Pass all graded assignments to complete the course.,English,,4.7 starsAverage User Rating 4.7See what learners said,"About this course: In this course, you will dive into the concepts of rationality and irrationality and understand how they impact our investment decisions and what the consequences can be at the market level.

You will first explore the different biases that we, as humans, are subjected to when facing investment decisions and how they may impact the outcomes of these decisions. Moreover, you will see how emotions and ethical concerns such as honesty and trust influence market participants. When they are considered as a group rather than individually, you will discover how rationality and irrationality can drive asset prices to and away from their fair value. Finally, you will be presented with different portfolio construction methodologies and investment styles that make up the landscape of today's portfolio management industry. 

At key points throughout the course, you will benefit from the practical knowledge of experts from our corporate partner, UBS, in how to build and manage clients' portfolios.",Created by:  University of Geneva,"['Taught by:\xa0\xa0University of Geneva- Tony Berrada, SFI Associate Professor of Finance', 'Taught by:\xa0\xa0University of Geneva- Jonas Demaurex, Teaching Assistant', 'Taught by:\xa0\xa0University of Geneva- Rajna Gibson Brandon, SFI Senior Chaired Professor of Finance and Managing Director of the GFRI', 'Taught by:\xa0\xa0University of Geneva- Michel Girardin, Lecturer in Macro-Finance - Project Leader for the ""Investment Management"" specialization', 'Taught by:\xa0\xa0University of Geneva- Kerstin Preuschoff, Associate Professor of Neurofinance and Neuroeconomics', 'Taught by:\xa0\xa0University of Geneva- Olivier Scaillet, SFI Senior Chaired Professor of Finance  and Vice-dean (research) at GSEM', 'Taught by:\xa0\xa0University of Geneva- Philip Valta, SFI Assistant Professor of Finance']",Rated 4.7 out of 5 of 739 ratings,See all 115 reviews,2018-05-30,"['Home', 'Business', 'Finance']",Meeting Investors' Goals,https://www.coursera.org/learn/meeting-investors-goals
,"4 weeks of study, 2-3 hours/week",,Pass all graded assignments to complete the course.,English,Beginner,4.5 starsAverage User Rating 4.5See what learners said,"About this course: This course is a brief introduction to the elements of music theory for those with little or no music theory experience. We will explore pitch, rhythm, meter, notation, scales, keys, key signatures, meter signatures, triads, seventh chords, and basic harmony. If you listen to music or play music by ear, and you want to know more about how music is organized and notated, this course is for you.

By the end of the course, you should know all major and minor keys, how to read and write in treble and bass clef using standard meters and rhythmic values, and how to notate and harmonize a simple melody. This course can serve as a stand-alone basic music theory course, or it can be a springboard to more advanced theory and composition courses.

Your instructor is Bruce Taggart, Associate Professor of Music Theory at Michigan State University, in the College of Music, where he has taught undergraduate and graduate music theory since 1996.",Created by:  Michigan State University,"['Taught by:\xa0\xa0Bruce Taggart, Associate Professor']",Rated 4.5 out of 5 of 114 ratings,See all 34 reviews,2018-05-30,"['Home', 'Arts and Humanities', 'Music and Art']",Getting Started With Music Theory,https://www.coursera.org/learn/music-theory
,,,,,,,,,,,,2018-05-30,,Web Design for Everybody Capstone,https://www.coursera.org/learn/web-design-project
,,,Pass all graded assignments to complete the course.,English,Beginner,5.0 starsAverage User Rating 5.0See what learners said,"About this course: This course will assist you with recreating work that a previous coworker completed, revisiting a project you abandoned some time ago, or simply reproducing a document with a consistent format and workflow. Incomplete information about how the work was done, where the files are, and which is the most recent version can give rise to many complications. This course  focuses on the proper documentation creation process, allowing you and your colleagues to easily reproduce the components of your workflow. Throughout this course, you'll receive helpful demonstrations of RStudio and the R Markdown language and engage in active learning opportunities to help you build a professional online portfolio.",Created by:  Emory University,"['Taught by:\xa0\xa0Melinda Higgins, Associate Research Professor/Senior Biostatistician']",Rated 5 out of 5 of 3 ratings,See all 2 reviews,2018-05-30,"['Home', 'Data Science', 'Data Analysis']",Reproducible Templates for Analysis and Dissemination ,https://www.coursera.org/learn/reproducible-templates-analysis
Course 2 of 4 in the Inspirational Leadership: Leading with Sense Specialization ,,,Pass all graded assignments to complete the course.,"English, Subtitles: French, Vietnamese",,4.6 starsAverage User Rating 4.6See what learners said,"About this course: With this course you will position your own leadership style and grow your resilience

In this course, second course of the ""Inspirational Leadership"" Specialization, you will discover the characteristics of charismatic leadership. 
You’ll personally learn how to embody these traits through the “Savoir-Relier” (art of connecting and leading with sense) methodology, which covers 3Gs: being Genuine, Generous, and Generative. 
You will then choose which style of leadership best fits you, why and when so you can adapt to more complex and difficult situations with resilience. 
In a “Self-Portrait” and “Conversation” with your classmates, you will be able to adjust your own ideas about your leadership styles and strengths, allowing you to increase your self-awareness, improve your relational intelligence, and prepare you to confront crises and resolve conflicts. 
You will also be better prepared to face difficult situations and make better decisions by relying on both your perception and analytical skills. All these skills will help you create sense in your team so you can lead it better.

This course is part of a Specialization on Leadership called “Inspirational Leadership: Leading with Sense”, so you may want to take the course “Building Your Leadership Skills” prior of taking this course.
As where in course 1 “Building Your Leadership Skills” you have mostly worked on your inner-self and on the relation between you and the other, in this course you’ll work on the relationship between you and the group, improving your leadership skills when interacting in a team. 

Leaders from different organizations and participants of the HEC Paris Leadership Certificate, the program from which this course and specialization is inspired, will share with you their insights about what it takes to become a great leader in a group or team and what they are able to achieve now that they apply The Savoir-Relier methodology.",Created by:  HEC Paris,"['Taught by:\xa0\xa0Valérie Gauthier, Associate Professor, HEC Paris ']",Rated 4.6 out of 5 of 246 ratings,See all 50 reviews,2018-05-30,"['Home', 'Business', 'Leadership and Management']",Giving Sense to Your Leadership Experience,https://www.coursera.org/learn/leading-sense
Course 4 of 5 in the Requirements Engineering: Secure Software  Specifications Specialization ,"4 weeks, 1-2 hours per week",,Pass all graded assignments to complete the course.,English,Beginner,,"About this course: Risk Analysis, Assessment, and Prioritization looks at how you can manage conflicts at system levels, but it can also be applied to lower level assessments.   How do you manage and document conflict, along with alternatives?  In analyzing alternatives, you must consider risks.  In this course, we'll look into how to analyze risk, evaluate risk, document risks, and use this information for prioritization of requirements.  Qualitative and Quantitative approaches will be covered.",Created by:  University of Colorado System,"['Taught by:\xa0\xa0Kristen Walcott-Justice, Assistant Professor']",Rated 4.7 out of 5 of 10 ratings,,2018-05-30,"['Home', 'Computer Science', 'Software Development']",Software Requirements Prioritization: Risk Analysis,https://www.coursera.org/learn/software-requirements-prioritization
,"5 weeks of study, 4 hours/week",,Pass all graded assignments to complete the course.,English,Intermediate,,"About this course: The course prepared by one of the best Russian experts in constitutional law will focus on political, economic and cultural dimensions of the Russian constitutional system. Historical background of constitutional reforms and today developments will be discussed, basing on concrete examples of these developments.

The course will both observe the specific of the Russian constitutional system in comparison to the other constitutional systems and penetrate into the key characteristics of the Russian constitution. Since adoption of the current Russian constitution of 1993 this constitutional system made a great evolution. The course will help to understand what ideas and concepts stand behind the Russian politics, both domestic and international, which principles lie in the basement of the legal framework for cultural, political and economic life of the Russian society. Foreigners and Russians see the Russian constitutional system in the «distorting mirror» of mass media; both of them need professional analysis of how the legal, governmental and economic systems are designed in Russia. The course will present this kind of analysis by a Russian scholar, familiar to contemporary development of constitutionalism in the world, who is able to present the view from inside Russia, but to position the Russian constitutional system in the a wide context of the world constitutionalism.

On the finishing this course the students will:

1. make analysis of legislative and judicial acts, taken by Russian state authorities in the context of the Russian constitution, its main values and basic principles
2. to give expert assistance for interaction with the Russian government structures in a wide range of political and economic questions

Know:
1. the specific of the Russian constitution, Russian legal, political and economic system
2. the history of forming and development of the contemporary constitutional system of Russia

Have the capacity to:
1. better understand of political, economic and legal processes in Russia
2. make prognosis of the development of the Russian legislation and judicial practice, the reaction of the Russian state bodies to events in the world and to the decisions made by foreign states and international organizations",Created by:  Saint Petersburg State University,"['Taught by:\xa0\xa0Sergei A. Belov, Associate Professor of Constitutional Law, Candidate of law (PhD)']",Rated 4.5 out of 5 of 11 ratings,,2018-05-30,"['Home', 'Social Sciences', 'Law']",Constitutional Reforms in Russia,https://www.coursera.org/learn/constitutional-reforms-in-russia
Course 5 of 5 in the C# Programming for Unity Game Development Specialization ,"8 weeks of study, 10 hours/week for the first 7 weeks (1-2 hours in the final week)",Development requirements for Windows and Mac at https://unity3d.com/unity/system-requirements,Pass all graded assignments to complete the course.,English,Intermediate,,"About this course: This is the final course in the C# Programming for Unity Game Development specialization. In this course, you'll implement your own small game using C# and Unity from your initial idea to full implementation. You may already have an idea in mind, but if not, I'll provide a number of suggested games for an 8-week course that assumes you've learned the material in the previous 4 courses in the specialization.

Your game won't be commercial-quality; that would be unreasonable after learning about C# programming and Unity game development for a few months. It takes my UCCS students 4 years of courses and experience to get to the point where they can build a commercial-quality game in the senior capstone project. On the other hand, building your own game is the culmination of the material you've learned in the previous courses in the specialization.

That's a great thing to do!

Module 1: Develop a planning document for your game
Module 2: Develop a prototype of your game
Module 3: Implement the menu and difficulty systems in your game
Module 4: Implement Iteration 1 of your game
Module 5: Implement Iteration 2 of your game
Module 6: Finish implementing your game for beta testing
Module 7: Conduct beta testing and modify your game as appropriate
Module 8: Complete final peer review",Created by:  University of Colorado System,"['Taught by:\xa0\xa0Dr. Tim ""Dr. T"" Chamillard, Associate Professor']",Rated 5 out of 5 of 2 ratings,,2018-05-30,"['Home', 'Computer Science', 'Software Development']",C# Programming for Unity Game Development Capstone Project,https://www.coursera.org/learn/programming-unity-game-development-project
Course 1 of 4 in the Strategic Management and Innovation Specialization ,"4 weeks of study, 2-4 hours/week",,Pass all graded assignments to complete the course.,"English, Subtitles: Vietnamese, Portuguese (Brazilian)",,4.7 starsAverage User Rating 4.7See what learners said,"About this course: The world of business strategy is in transition. What used to work doesn't anymore -- not necessarily. 

This course prepares you to think strategically in an age when companies like Apple, Google, and Microsoft have become more valuable (in market cap terms) than companies like Exxon. Today, business value and competitive advantage arise more often from consumer perceptions of what is ""cool"" than from physical assets or economies of scale. 

In this course -- the first of a three-course specialization tailored specifically for the age of creativity and innovation -- you will gear up for the challenges of strategy formulation and implementation in a 21st century business. 

After taking the course, you'll be able to:
- Explain why ""doing"" strategy is considered ""the high point of managerial activity"" (Mintzberg);
- Recognize and avoid the old, tired ideas about strategy that are still out there, so you can adopt fresher, better ideas;
- Point out how doing strategy has changed because of advancing technology and globalization;
- Prepare for the Capstone Project for the Strategic Management and Innovation Specialization",Created by:  Copenhagen Business School,"['Taught by:\xa0\xa0Robert Austin, Professor, Management of Creativity and Innovation']","Rated 4.7 out of 5 of 1,831 ratings",See all 417 reviews,2018-05-30,"['Home', 'Business', 'Business Strategy']",Strategic Management,https://www.coursera.org/learn/strategic-management
