Basic Info,Commitment,Hardware Req,How To Pass,Language,Level,User Ratings,description,institutions,instructors,ratings,reviews,scrape_date,subjects,title,url
Course 2 of 3 in the Excel/VBA for Creative Problem Solving Specialization ,"4 weeks of study, 3-5 hours/week",The Windows version of Microsoft Excel OR running Windows Excel on Mac with Boot Camp or Parallels.,Pass all graded assignments to complete the course.,English,Intermediate,4.9 starsAverage User Rating 4.9See what learners said,"About this course: ""Excel/VBA for Creative Problem Solving, Part 2"" builds off of knowledge and skills obtained in ""Excel/VBA for Creative Problem Solving, Part 1"" and is aimed at learners who are seeking to augment, expand, optimize, and increase the efficiency of their Excel spreadsheet skills by tapping into the powerful programming, automation, and customization capabilities available with Visual Basic for Applications (VBA).

In Part 2 of the course, learners will: 1) learn how to work with arrays and import/export arrays from/to Excel using VBA code; 2) learn how to work with text strings and write data to .txt files and import information from .txt files; 3) automate the import, modification, and consolidation of information from multiple worksheets into a central worksheet as well as the import of information from multiple workbooks to a central workbook; and 4) gain experience with creating professional user forms to interface with the user, perform advanced calculations, and manipulate data on the spreadsheet.

Learners who have a foundational understanding of VBA code and programming structures can jump right into Part 2 of the course without taking Part 1 and use the screencasts in Part 1 as reference.

Each module will introduce foundational and broad problems inspired by situations that you might encounter in the real world.  To pass each module, you'll need to pass a mastery quiz and complete a problem solving assignment.  This course is unique in that the weekly assignments are completed in-application (i.e., on your own computer in Excel), providing you with valuable hands-on training.",Created by:  University of Colorado Boulder,"['Taught by:\xa0\xa0Charlie Nuttelman, Instructor']",Rated 4.9 out of 5 of 40 ratings,See all 8 reviews,2018-05-30,"['Home', 'Computer Science', 'Algorithms']","Excel/VBA for Creative Problem Solving, Part 2",https://www.coursera.org/learn/excel-vba-for-creative-problem-solving-part-2
Course 10 of 10 in the Data Science Specialization ,4-9 hours/week,,Pass all graded assignments to complete the course.,English,,4.5 starsAverage User Rating 4.5See what learners said,"About this course: The capstone project class will allow students to create a usable/public data product that can be used to show your skills to potential employers. Projects will be drawn from real-world problems and will be conducted with industry, government, and academic partners.",Created by:  Johns Hopkins University,"['Taught by:\xa0\xa0Jeff Leek, PhD, Associate Professor, Biostatistics', 'Taught by:\xa0\xa0Roger D. Peng, PhD, Associate Professor, Biostatistics', 'Taught by:\xa0\xa0Brian Caffo, PhD, Professor, Biostatistics']",Rated 4.5 out of 5 of 626 ratings,See all 167 reviews,2018-05-30,"['Home', 'Data Science', 'Data Analysis']",Data Science Capstone,https://www.coursera.org/learn/data-science-project
,,,Pass all graded assignments to complete the course.,English,Intermediate,3.9 starsAverage User Rating 3.9See what learners said,"About this course: Modern engineering research focuses on designing new materials and processes at the molecular level. Statistical thermodynamics provides the formalism for understanding how molecular interactions lead to the observed collective behavior at the macroscale. 

This course will develop a molecular-level understanding of key thermodynamic quantities like heat, work, free energy and entropy. These concepts will be applied in understanding several important engineering and biological applications.",Created by:  Carnegie Mellon University,"['Taught by:\xa0\xa0Venkat Viswanathan, Assistant Professor']",Rated 3.9 out of 5 of 25 ratings,See all 6 reviews,2018-05-30,"['Home', 'Physical Science and Engineering', 'Mechanical Engineering']",Statistical Thermodynamics: Molecules to Machines,https://www.coursera.org/learn/statistical-thermodynamics-cm
,,,Pass all graded assignments to complete the course.,English,Beginner,4.6 starsAverage User Rating 4.6See what learners said,"About this course: Powerful Tools for Teaching and Learning: Digital Storytelling introduces educators to digital storytelling and explores ways to use digital stories to enhance students’ learning experiences. The course is designed to be comprehensive yet fundamental. By comprehensive we mean that the course provides a solid foundation for all of the components of a digital story and illustrates these components with tutorials, example stories, and links to additional readings. The course also provides a hands-on opportunity for learners to create their own digital stories. The course is fundamental because it covers the basic process of creating a digital story starting with just a simple script and as little as one image. 

This course is intended for K-12 teachers in all disciplines, although it is open to anyone with an interest in digital storytelling. Course participants will use WeVideo (https://www.wevideo.com/), a free web-based video editing program, to create a digital story that could be shared both online and with students in the classroom. Teachers in the state of Texas may be eligible to receive Continuing Professional Education units if they complete the major requirements of the course.",Created by:  University of Houston System,"['Taught by:\xa0\xa0Bernard R Robin, Associate Professor', 'Taught by:\xa0\xa0Sara G. McNeil, Associate Professor']",Rated 4.6 out of 5 of 47 ratings,See all 13 reviews,2018-05-30,"['Home', 'Social Sciences', 'Education']",Powerful Tools for Teaching and Learning: Digital Storytelling,https://www.coursera.org/learn/digital-storytelling
,"4 weeks of study, 1-2 hours/week",,Pass all graded assignments to complete the course.,English,,4.7 starsAverage User Rating 4.7See what learners said,"About this course: Copyright questions about different formats (data, images, music and video) can be especially difficult.  Sometimes the law specifically distinguishes between these different formats, and in most cases there are media-specific considerations that impact a copyright analysis.  In this course we will look at four different media, paying special attention to the unique issues for each one and the kinds of information that is important when making copyright decisions for each type of material.  We will work through fair use issues for each multimedia format, look at format-specific exceptions in the law, and consider unique issues for seeking permission for film, music, images and data.

At the end of this course, participants will have a deeper understanding of how to apply our framework for making copyright decisions, and will be more comfortable with assessing multimedia issues.  They will have gained more and more diverse experience for considering fair use.","Created by:  Duke University, Emory University, The University of North Carolina at Chapel Hill","['Taught by:\xa0\xa0Kevin Smith, M.L.S., J.D., Former Director, Copyright and Scholarly Communication', 'Taught by:\xa0\xa0Lisa A. Macklin, J.D.,M.L.S., Director, Scholarly Communications Office', 'Taught by:\xa0\xa0Anne Gilliland, JD, MLS, Scholarly Communications Officer']",Rated 4.7 out of 5 of 176 ratings,See all 44 reviews,2018-05-30,"['Home', 'Arts and Humanities', 'Music and Art']",Copyright for Multimedia,https://www.coursera.org/learn/copyright-for-multimedia
Course 3 of 6 in the Business Technology Management Specialization ,,,Pass all graded assignments to complete the course.,English,Beginner,4.1 starsAverage User Rating 4.1See what learners said,"About this course: This course presents an introduction to the basics of financial accounting and finance for IT professionals. The first part of the course will focus on understanding the most important financial statements, namely, the balance sheet, the income statement, and the statement of cash flows. We will then focus on how we can understand the financial health and performance of the company by examining a number of important financial ratios that are derived from the financial statements of the company. The second part of the course will focus on the basics of finance. This includes the concept of time value of money, discounting cash flows, and capital budgeting. The course will also introduce the idea of real options, how they affect a project’s NPV, and their impact of the decision to accept/reject a project. Lectures on concepts will be supplemented with numerical examples.",Created by:  Indian School of Business,"['Taught by:\xa0\xa0Ramabhadran Thirumalai, Assistant Professor']",Rated 4.1 out of 5 of 55 ratings,See all 18 reviews,2018-05-30,"['Home', 'Business', 'Finance']",Accounting and Finance for IT professionals,https://www.coursera.org/learn/accounting-finance
Course 4 of 5 in the Financial Markets and Investment Strategy Specialization ,"4 weeks of study, 3-4 hours/week",,Pass all graded assignments to complete the course.,English,Intermediate,4.0 starsAverage User Rating 4.0See what learners said,"About this course: Discover the basic concepts of needs analysis, investment policy, asset allocation, product selection, portfolio monitoring and re-balancing. We will look at the types of institutional investors - pension funds and insurance companies. You will learn the client management life cycle and dive into portfolio management as a process. You will learn the basic concepts, principles, and the major styles of investing in alternative assets. Finally, we study the impact of digitization on investment strategies.",Created by:  Indian School of Business,"['Taught by:\xa0\xa0Vikram Kuriyan, Clinical Professor of Finance']",Rated 4 out of 5 of 29 ratings,See all reviews,2018-05-30,"['Home', 'Business', 'Finance']",Investment Strategy,https://www.coursera.org/learn/investment-philosophy
,,,Pass all graded assignments to complete the course.,English,Beginner,4.6 starsAverage User Rating 4.6See what learners said,"About this course: In this introductory, self-paced course, you will learn multiple theories of organizational behavior and apply them to actual cases of organizational change.

Organizations are groups whose members coordinate their behaviors in order to accomplish a shared goal. They can be found nearly everywhere in today’s society: universities, start-ups, classrooms, hospitals, non-profits, government bureaus, corporations, restaurants, grocery stores, and professional associations are some of many examples of organizations.

Organizations are as varied and complex as they are ubiquitous: they differ in size and internal structure; they can entail a multiplicity of goals and tasks (some of which are planned and others unplanned!); they are made up of individuals whose goals and motivations may differ from those of the group; and they must interact with other organizations and deal with environmental constraints in order to be successful. This complexity frequently results in a myriad of problems for organizational participants and the organization’s survival.

In this course, we will use organizational theories to systematically analyze how an organization operates and can best be managed. Organizational theories highlight certain features of an organization’s structure and environment, as well as its processes of negotiation, production, and change. Each provides a lens for interpreting novel organizational situations and developing a sense for how individual and group behaviors are organized. Theories are valuable for the analyst and manager because most organizational problems are unique to the circumstances and cannot be solved by simple rules of thumb. Armed with a toolset of organizational theories, you will be able to systematically identify important features of an organization and the events transforming it; choose a theoretical framework most applicable to the observed mode of organizing; and use that theory to determine which actions will best redirect the organization in desired directions.

In sum, the course has three goals: to become familiar with a series of real-world organizational phenomena; to learn different theoretical perspectives that can elucidate these phenomena; and to apply these different ways of “seeing” and managing organizations to cases. In such a fashion, the course is designed to actively bridge theory and practice, exposing students to a variety of conceptual tools and ways to negotiate novel situations.",Created by:  Stanford University,"['Taught by:\xa0\xa0Daniel A. McFarland, Professor']",Rated 4.6 out of 5 of 357 ratings,See all 113 reviews,2018-05-30,"['Home', 'Business', 'Leadership and Management']",Organizational Analysis ,https://www.coursera.org/learn/organizational-analysis
Course 4 of 5 in the Business and Financial Modeling Specialization ,"4 weeks of study, 1-3 hours/week",,Pass all graded assignments to complete the course.,English,,4.6 starsAverage User Rating 4.6See what learners said,"About this course: This course is designed to show you how use quantitative models to transform data into better business decisions. You’ll learn both how to use models to facilitate decision-making and also how to structure decision-making for optimum results. Two of Wharton’s most acclaimed professors will show you the step-by-step processes of modeling common business and financial scenarios, so you can significantly improve your ability to structure complex problems and derive useful insights about alternatives. Once you’ve created models of existing realities, possible risks, and alternative scenarios, you can determine the best solution for your business or enterprise, using the decision-making tools and techniques you’ve learned in this course.",Created by:  University of Pennsylvania,"['Taught by:\xa0\xa0Richard Lambert, Professor of Accounting', 'Taught by:\xa0\xa0Robert W. Holthausen, Professor']",Rated 4.6 out of 5 of 708 ratings,See all 92 reviews,2018-05-30,"['Home', 'Business', 'Business Essentials']",Decision-Making and Scenarios,https://www.coursera.org/learn/wharton-decision-making-scenarios
,,,Pass all graded assignments to complete the course.,"English, Subtitles: Portuguese (Brazilian)",Beginner,4.5 starsAverage User Rating 4.5See what learners said,"About this course: Are you interested in learning how to program (in Python) within a scientific setting?

This course will cover algorithms for solving various biological problems along with a handful of programming challenges helping you implement these algorithms in Python.  It offers a gently-paced introduction to our Bioinformatics Specialization (https://www.coursera.org/specializations/bioinformatics), preparing learners to take the first course in the Specialization, ""Finding Hidden Messages in DNA"" (https://www.coursera.org/learn/dna-analysis).

Each of the four weeks in the course will consist of two required components.  First, an interactive textbook provides Python programming challenges that arise from real biological problems.  If you haven't programmed in Python before, not to worry! We provide ""Just-in-Time"" exercises from the Codecademy Python track (https://www.codecademy.com/learn/python). And each page in our interactive textbook has its own discussion forum, where you can interact with other learners. Second, each week will culminate in a summary quiz.

Lecture videos are also provided that accompany the material, but these videos are optional.",Created by:  University of California San Diego,"['Taught by:\xa0\xa0Pavel  Pevzner, Professor', 'Taught by:\xa0\xa0Phillip Compeau, Visiting Researcher']",Rated 4.5 out of 5 of 436 ratings,See all 121 reviews,2018-05-30,"['Home', 'Life Sciences', 'Bioinformatics']",Biology Meets Programming: Bioinformatics for Beginners,https://www.coursera.org/learn/bioinformatics
,3 hours / week,,Pass all graded assignments to complete the course.,"English, Subtitles: Chinese (Traditional), Chinese (Simplified)",Beginner,,"About this course: “In the long term we can hope that religion will change the nature of man and reduce conflict. But history is not encouraging in this respect. The bloodiest wars in history have been religious wars.” - Richard M. Nixon

Heaven. Hell. Pure Land. Saṃsāra. 
How did different religions interpret the afterlife situation? What are their requisite standards of behaviours during life? What is religion? How do we define religion? 

‘Truth’ is widely known as the common goal for different religions, yet they compete for being the real and only truth in this world. 

Conflicts and hatred arise between religions. 
Blood has been spilled and wars broke out in the end. 
History has repeated itself. 
Revenge seems to be endless. 

Peace doesn’t seem possible in the future. 
How can human conflicts be resolved? How can religious disputes be reduced? 

The answers to these questions can be found in The Diamond Sutra, the Buddhist scripture.  Join this course to explore the path of religions and world peace.",Created by:  The University of Hong Kong,"['Taught by:\xa0\xa0Cheung Siu Nang Bruce, Senior Programme Director']",,,2018-05-30,"['Home', 'Arts and Humanities', 'Philosophy']",Buddhism: Diamond Sutra and World Peace,https://www.coursera.org/learn/buddhism-and-peace
,2-4 hours/week,,Pass all graded assignments to complete the course.,English,,4.8 starsAverage User Rating 4.8See what learners said,About this course: The aim of the course is to provide you with a comprehensive framework for understanding both the traditional principles of management inside companies today as well as the alternative principles that are becoming increasingly important. It provides both theoretical and practical perspectives on the nature of management in today’s organisations.,"Created by:  University of London, London Business School","['Taught by:\xa0\xa0Julian Birkinshaw, Professor of Strategy & Entrepreneurship']",Rated 4.8 out of 5 of 434 ratings,See all 129 reviews,2018-05-30,"['Home', 'Business', 'Leadership and Management']",Managing the Company of the Future,https://www.coursera.org/learn/company-future-management
,"10 weeks of study, 1-3 hours/week",,Pass all graded assignments to complete the course.,English,Beginner,4.8 starsAverage User Rating 4.8See what learners said,"About this course: Successful decision making is based on three key pillars:  strategy, law and ethics.  After taking this course you will be able to use a practical framework based on these three elements to make successful business, personal and leadership decisions.  

This course opens with an example of a leadership decision:  President Barack Obama’s strategic decision to capture or kill Osama bin Laden.  The course then shows how the three elements can be used to prevent a tragedy when making a personal decision.  

The rest of the course focuses on making successful business decisions.  In essence, to achieve business and career success, you must create value (strategy) and manage risk (law) in a responsible manner (ethics). 

Because the Law Pillar plays a central role in the three pillar model, the course includes practical legal briefings (with many examples) on the key elements of business success.  Specifically, the course shows you how to: 

•	attract the best employees, 
•	develop successful products, 
•	create new business models, 
•	protect intellectual property, 
•	create contracts that achieve business goals, and 
•	use dispute resolution processes that improve business relationships. 

Using a global perspective, the course also provides an introduction to international business culture for learners from the United States, and an introduction to the U.S. business culture for learners from outside the U.S.",Created by:  University of Michigan,"['Taught by:\xa0\xa0George Siedel, Williamson Family Professor of Business Administration and Thurnau Professor of Business Law']",Rated 4.8 out of 5 of 97 ratings,See all 26 reviews,2018-05-30,"['Home', 'Business', 'Business Essentials']","Making Successful Decisions through the Strategy, Law & Ethics Model",https://www.coursera.org/learn/strategy-law-ethics
Course 3 of 4 in the Professional IQ: Preventing and Solving Problems at Work Specialization ,,,Pass all graded assignments to complete the course.,English,Beginner,4.8 starsAverage User Rating 4.8See what learners said,"About this course: The only thing you get to change is yourself, and in the prerequisites to this course we’ve given you real tools to do that. Now, use those tools to influence the course of your future, your team's future, and your organization's future. Make a plan for yourself that will help you help others, and learn skills to make it happen.

Listening and being sure of your values underpins everything that comes with professional influencer and leadership soft skills. We’ll go on to look at self-assessment and leadership planning, negotiation, addressing and resolving conflict, and successfully identifying and promoting circumstances you want.

 After this course, you will be able to:

- state your own mission and plan with confidence
- negotiate and persuade
- deal with difficult people
- contribute to crafting a working environment you want to work in

The prerequisites for this course are Courses One and Two of the Specialization ""Professional IQ: Preventing and Solving Problems at Work"".",Created by:  University of Illinois at Urbana-Champaign,"['Taught by:\xa0\xa0C. K. Gunsalus, Director of the National Center for Professional and Research Ethics (NCPRE), Professor Emerita of Business, and Research Professor at the Coordinated Science Laboratory']",Rated 4.8 out of 5 of 13 ratings,See all 2 reviews,2018-05-30,"['Home', 'Business', 'Leadership and Management']",Leadership and Influence,https://www.coursera.org/learn/leadership-influence
,,,Pass all graded assignments to complete the course.,"English, Subtitles: Spanish",,4.6 starsAverage User Rating 4.6See what learners said,"About this course: This course is for activists, artists, and thinkers who wish to better understand and participate in social change. We will focus on the prolific and exciting overlap between socially engaged art and cultural practices generated by recent social movements around the world. Rather than assess the political efficacy of activities like mourning, listening, organizing, dancing, or partying, the lectures examine such cultural activities next to, and within, contemporary art practice. 

Included in the course are guest presentations by key artists, activists, and scholars, like: Rebecca Gomperts, Chido Govera, Gulf Labor, Hans Haacke, Sharon Hayes, Jolene Rickard, Gregory Sholette, Joshua Wong, and many more. Designed by artist and Duke professor, Pedro Lasch and co-taught by Creative Time artistic director, Nato Thompson, the course challenges learners to treat the MOOC itself as a social and artistic form. This happens mostly through the practical components, local project productions, global exchanges, and critical feedback.

While no prior art making or activist experience is required, projects also offer challenging options for advanced learners.

For other course offerings or language versions in this series, just search 'ART of the MOOC' inside the Coursera course catalogue.","Created by:  Duke University, Creative Time ","['Taught by:\xa0\xa0Nato Thompson, Chief Curator ', 'Taught by:\xa0\xa0Pedro Lasch, Visual Artist and Associate Research Professor']",Rated 4.6 out of 5 of 34 ratings,See all 13 reviews,2018-05-30,"['Home', 'Arts and Humanities', 'Music and Art']",ART of the MOOC: Activism and Social Movements,https://www.coursera.org/learn/activism-social-movements
