Basic Info,Commitment,Hardware Req,How To Pass,Language,Level,User Ratings,description,institutions,instructors,ratings,reviews,scrape_date,subjects,title,url
Course 1 of 4 in the Introduction to Scripting in Python Specialization ,This is a four week class with an expected workload of 5-7 hours per week.,,Pass all graded assignments to complete the course.,English,Beginner,4.7 starsAverage User Rating 4.7See what learners said,"About this course: This course will introduce you to the wonderful world of Python programming!  We'll learn about the essential elements of programming and how to construct basic Python programs. We will cover expressions, variables, functions, logic, and conditionals, which are foundational concepts in computer programming. We will also teach you how to use Python modules, which enable you to benefit from the vast array of functionality that is already a part of the Python language. These concepts and skills will help you to begin to think like a computer programmer and to understand how to go about writing Python programs.

By the end of the course, you will be able to write short Python programs that are able to accomplish real, practical tasks. This course is the foundation for building expertise in Python programming. As the first course in a specialization, it provides the necessary building blocks for you to succeed at learning to write more complex Python programs.

This course uses Python 3.  While many Python programs continue to use Python 2, Python 3 is the future of the Python programming language. This first course will use a Python 3 version of the CodeSkulptor development environment, which is specifically designed to help beginning programmers learn quickly.  CodeSkulptor runs within any modern web browser and does not require you to install any software, allowing you to start writing and running small programs immediately.  In the later courses in this specialization,  we will help you to move to more sophisticated desktop development environments.",Created by:  Rice University,"['Taught by:\xa0\xa0Scott Rixner, Professor', 'Taught by:\xa0\xa0Joe Warren, Professor']",Rated 4.7 out of 5 of 436 ratings,See all 126 reviews,2018-05-30,"['Home', 'Computer Science', 'Software Development']",Python Programming Essentials,https://www.coursera.org/learn/python-programming
,,,Pass all graded assignments to complete the course.,English,Intermediate,4.9 starsAverage User Rating 4.9See what learners said,"About this course: You should complete the VLSI CAD Part I: Logic course before beginning this course.

A modern VLSI chip is a remarkably complex beast:  billions of transistors, millions of logic gates deployed for computation and control, big blocks of memory, embedded blocks of pre-designed functions designed by third parties (called “intellectual property” or IP blocks).  How do people manage to design these complicated chips?  Answer:  a sequence of computer aided design (CAD) tools takes an abstract description of the chip, and refines it step-wise to a final design. This class focuses on the major design tools used in the creation of an Application Specific Integrated Circuit (ASIC) or System on Chip (SoC) design.  Our focus in this part of the course is on the key logical and geometric representations that make it possible to map from logic to layout, and in particular, to place, route, and evaluate the timing of large logic networks. Our goal is for students to understand how the tools themselves work, at the level of their fundamental algorithms and data structures. Topics covered will include: technology mapping, timing analysis, and ASIC placement and routing.

Recommended Background:
Programming experience (C, C++, Java, Python, etc.) and basic knowledge of data structures and algorithms (especially recursive algorithms).  An understanding of basic digital design:  Boolean algebra, Kmaps, gates and flip flops, finite state machine design.  Linear algebra and calculus at the level of a junior or senior in engineering.  Elementary knowledge of RC linear circuits (at the level of an introductory physics class).",Created by:  University of Illinois at Urbana-Champaign,"['Taught by:\xa0\xa0Rob A. Rutenbar, Adjunct Professor']",Rated 4.9 out of 5 of 16 ratings,See all reviews,2018-05-30,"['Home', 'Computer Science', 'Algorithms']",VLSI CAD Part II: Layout,https://www.coursera.org/learn/vlsi-cad-layout
,,,Pass all graded assignments to complete the course.,English,Beginner,4.6 starsAverage User Rating 4.6See what learners said,"About this course: This course will introduce students to the theory of music, providing them with the skills needed to read and write Western music notation, as well as to understand, analyse, and listen informedly. It will cover material such as pitches and scales, intervals, clefs, rhythm, form, meter, phrases and cadences, and basic harmony.

This course covers the fundamentals of Western music theory, from the absolute basics to some more advanced concepts and, as such, is the perfect course for beginners and more experienced musicians alike.

Follow us on twitter 
@musictheorymooc 
#edmusictheory",Created by:  The University of Edinburgh,"['Taught by:\xa0\xa0Dr Michael Edwards', 'Taught by:\xa0\xa0Dr Zack Moir, Teaching Fellow', 'Taught by:\xa0\xa0Richard Worth', 'Taught by:\xa0\xa0Dr Nikki Moran', 'Taught by:\xa0\xa0Dr John Philip Kitchen, MA BMus PhD  FRCO LRAM']",Rated 4.6 out of 5 of 643 ratings,See all 178 reviews,2018-05-30,"['Home', 'Arts and Humanities', 'Music and Art']",Fundamentals of Music Theory,https://www.coursera.org/learn/edinburgh-music-theory
Course 3 of 5 in the Data Visualization with Tableau Specialization ,"4 weeks of study, 5-7 hours/week",,Pass all graded assignments to complete the course.,English,Beginner,4.4 starsAverage User Rating 4.4See what learners said,"About this course: In this third course of the specialization, we’ll drill deeper into the tools Tableau offers in the areas of charting, dates, table calculations and mapping. We’ll explore the best choices for charts, based on the type of data you are using. We’ll look at specific types of charts including scatter plots, Gantt charts, histograms, bullet charts and several others, and we’ll address charting guidelines. We’ll define discrete and continuous dates, and examine when to use each one to explain your data.  You’ll learn how to create custom and quick table calculations and how to create parameters. We’ll also introduce mapping and explore how Tableau can use different types of geographic data, how to connect to multiple data sources and how to create custom maps.","Created by:  University of California, Davis","['Taught by:\xa0\xa0Suk S. Brar, M.B.A., Lead Business Consultant']",Rated 4.4 out of 5 of 454 ratings,See all 101 reviews,2018-05-30,"['Home', 'Data Science', 'Data Analysis']",Visual Analytics with Tableau,https://www.coursera.org/learn/dataviz-visual-analytics
,6-8 hours/week,,Pass all graded assignments to complete the course.,English,,,"About this course: Calculus is one of the grandest achievements of human thought, explaining everything from planetary orbits to the optimal size of a city to the periodicity of a heartbeat. This brisk course covers the core ideas of single-variable Calculus with emphases on conceptual understanding and applications. The course is ideal for students beginning in the engineering, physical, and social sciences. Distinguishing features of the course include: 1) the introduction and use of Taylor series and approximations from the beginning; 2) a novel synthesis of discrete and continuous forms of Calculus; 3) an emphasis on the conceptual over the computational; and 4) a clear, dynamic, unified approach.

In this fifth part--part five of five--we cover a calculus for sequences, numerical methods, series and convergence tests, power and Taylor series, and conclude the course with a final exam.  Learners in this course can earn a certificate in the series by signing up for Coursera's verified certificate program and passing the series' final exam.",Created by:  University of Pennsylvania,"['Taught by:\xa0\xa0Robert Ghrist,  Professor ']",,,2018-05-30,"['Home', 'Math and Logic']",Single Variable Calculus,https://www.coursera.org/learn/discrete-calculus
,,,Pass all graded assignments to complete the course.,English,Intermediate,,"About this course: Do you want to obtain all the necessary skills of a 3D modeler? Do you want to know how an engineer develop a building model in details? The “3D CAD Application” course, the second course of the new specialization, is coming! 
After finishing this course: You will be able to know how to use the SketchUp’s advanced functions by creating 3D building models. You will be able to develop a building as an engineer.
Let’s start the learning journey!",Created by:  National Taiwan University,"['Taught by:\xa0\xa0康仕仲 (Shih-Chung Jessy Kang), 教授 (Professor)']",,,2018-05-30,"['Home', 'Physical Science and Engineering', 'Mechanical Engineering']",3D CAD Application,https://www.coursera.org/learn/3d-cad-application
,,,Pass all graded assignments to complete the course.,English,,4.7 starsAverage User Rating 4.7See what learners said,"About this course: The Foundations of Teaching for Learning programme is designed for teachers and educators of all abilities and backgrounds; from those who are new to the classroom and looking for development, to experienced teachers ready to reboot their skills for modern education. With dynamic lessons taught by established and respected professionals from across the Commonwealth, this eight course programme will see you develop and strengthen your skills in teaching, professionalism, assessment, and more. As you carry on through the programme, you will find yourself strengthening not only your professional skills, but your connection with colleagues across the globe. A professional development opportunity not to be missed. 

There are various techniques which help to assess student learning. This course helps teacher to acquire the skills to develop and use appropriate assessment procedures. 

Enhance your course by joining the Commonwealth teaching community on our website, Facebook and Twitter.",Created by:  Commonwealth Education Trust,"['Taught by:\xa0\xa0Dr  Peter Keegan, Senior Lecturer, Te Puna Wānanga, Faculty of Education', 'Taught by:\xa0\xa0Associate Professor Gavin Brown, Director, Faculty of Education Quantitative Data Analysis and Research Unit', 'Taught by:\xa0\xa0Professor John MacBeath, Professor Emeritus']",Rated 4.7 out of 5 of 75 ratings,See all 21 reviews,2018-05-30,"['Home', 'Social Sciences', 'Education']",Foundations of Teaching for Learning: Introduction to Student Assessment,https://www.coursera.org/learn/learning-assessment
,4-week course requiring 2-4 hours per week by the learner.,,Pass all graded assignments to complete the course.,English,Intermediate,4.4 starsAverage User Rating 4.4See what learners said,"About this course: The goal of this 4-week course is to equip learners to safely care for a patient infected with a pathogen requiring high-level biocontainment.  This can be accomplished in any healthcare facility given the correct approach and protocols.

Please copy and paste the following link into a new tab/browser to view the video overview of our course.  http://bit.ly/2bPZ6Cz 

In this course, we will:
  1.  Discuss the essentials of intake screening.
  2.  Investigate pathogen transmission characteristics and the chain of infection.
  3.  Examine patient placement in a facility, as well as the engineering/ administrative controls. 
  4.  Review personal protective equipment worn by the care providers.
  5.  Evaluate waste management and decontamination protocols.


We look forward to exploring and learning with you!
Dr. Medcalf and University of Nebraska Medical Center Team


This project was funded by the Nebraska Department of Health and Human Services, Division of Public Health",Created by:  University of Nebraska,"['Taught by:\xa0\xa0Sharon Medcalf, PhD, Assistant Professor', 'Taught by:\xa0\xa0Analisa McMillan, MSEd', 'Taught by:\xa0\xa0Marty Magee MSA, MLS, Instructional Design Librarian', 'Taught by:\xa0\xa0Peggy Moore, MSEd, E-Learning Instructional Designer']",Rated 4.4 out of 5 of 13 ratings,See all 5 reviews,2018-05-30,"['Home', 'Life Sciences', 'Medicine and Healthcare']",High Level Biocontainment for Healthcare Facilities,https://www.coursera.org/learn/biocontainment
,2-3 hours per week,,Pass all graded assignments to complete the course.,English,Beginner,4.9 starsAverage User Rating 4.9See what learners said,"About this course: Among all objects of design, our clothes are the most universal and intimate. Like other kinds of design, fashion thrives on productive tensions between form and function, automation and craftsmanship, standardization and customization, universality and self-expression, and pragmatism and utopian vision. It exists in the service of others, and it can have profound consequences—social, political, cultural, economic, and environmental.

Fashion as Design focuses on a selection of more than 70 garments and accessories from around the world, ranging from kente cloth to jeans to 3D-printed dresses. Through these garments, we’re going to look closely at what we wear, why we wear it, how it’s made, and what it means. You’ll hear directly from a range of designers, makers, historians, and others working with clothing every day—and, in some cases, reinventing it for the future. Studio visits, interviews, and other resources introduce the history and development of each garment and their changing uses, meanings, and impact over time. 

Course Learning Objectives:

Develop critical tools to appreciate and contextualize fashion design—from everyday clothing to couture garments—through many different perspectives. 

Trace the history, development, and impact of garments over time, and explore how they may be reinvented.

Investigate garments through multiple lenses including politics, identity, and economics. 

Understand more about the lifecycle of clothing, from its design and production to its marketing, distribution, and consumption. 

Better comprehend the choices you make about fashion with respect to the visual language of dress, individual and collective identities, and issues such as labor practices, sustainability, and body politics.",Created by:  The Museum of Modern Art,"['Taught by:\xa0\xa0Paola Antonelli, Senior Curator, Department of Architecture & Design, and Director, Department of Research & Development ', 'Taught by:\xa0\xa0Michelle Millar Fisher, Curatorial Assistant', 'Taught by:\xa0\xa0Stephanie Kramer, Research Assistant']",Rated 4.9 out of 5 of 305 ratings,See all 73 reviews,2018-05-30,"['Home', 'Arts and Humanities', 'Music and Art']",Fashion as Design,https://www.coursera.org/learn/fashion-design
,"9 weeks of study, 2-3 hours/week ",,Pass all graded assignments to complete the course.,English,Beginner,4.8 starsAverage User Rating 4.8See what learners said,"About this course: Are you ready to take an incredible journey around Planet Earth and beyond? In this course, you will delve into a world of innovative science and learn from a team of Biosphere 2 and University of Arizona researchers. From plants and soils, to oceans and rainforests, the Moon, Mars, and more, this course is an exciting opportunity for anyone interested in science and Earth stewardship. 

Learn how a unique research station in the Arizona desert is used to investigate big ideas, such as how Earth systems interact, the effects of climate change, and what our future holds. Go back in time thousands of years with information locked in ancient trees, and travel into an imagined future where humans become Martians. Collect and analyze your own scientific data, discuss big questions with participants from around the world, and gain novel insights and understanding about our wonderfully unique planet.",Created by:  University of Arizona,"['Taught by:\xa0\xa0Kevin E. Bonine, PhD, Director of Education and Outreach']",Rated 4.8 out of 5 of 12 ratings,See all 7 reviews,2018-05-30,"['Home', 'Physical Science and Engineering', 'Environmental Science and Sustainability']",Biosphere 2 Science for the Future of Our Planet,https://www.coursera.org/learn/biosphere-science-future
,1 hour,,Pass all graded assignments to complete the course.,English,,4.6 starsAverage User Rating 4.6See what learners said,"About this course: Welcome to HPV-Associated Oral and Throat Cancers: What You Need to Know 

This course, offered by the Department of Otolaryngology – Head and Neck Surgery at the Icahn School of Medicine at Mount Sinai, is designed to inform primary care physicians and otolaryngologists (general and head and neck surgeons), as well as medical students, residents, nurses, physician assistants, medical assistants, about HPV-associated oral and throat cancers. It is also applicable to individuals who wish to broaden their knowledge and vernacular about this disease process, especially those who may have been diagnosed with HPV and/or HPV-associated oropharyngeal cancers. The course has been divided into four modules, each of which is followed by multiple choice questions to help attendees further understand this condition: 

Week 1 - CME Information, Accreditation and Introduction (2 min)
Week 2 - Module 1: HPV-associated Throat Cancer: An Epidemic (11 min. + quiz) 
Week 3 - Module 2: HPV Risk Factors and Clinical Presentation (10 min. + quiz) 
Week 4 - Module 3: Management of HPV-associated Oropharyngeal Cancer (13 min. + quiz) 
Week 5 - Module 4: Prevention, Vaccination, and the Horizon (10 min. + quiz) 

The primary objective of this course is to provide physicians with a thorough understanding of how to better diagnose and treat patients who have HPV-related oral and throat cancers. 

Those participating in this course have the option to receive CME credit. Please review the CME Information and Accreditation prior to proceeding with the course modules. 

Release Date: November 15, 2016 
Expiration Date: November 15, 2018 
Estimated Time to Complete: 1 hour 
CME Fee: $30 
CME Credits Offered: 1.0 

CME Reviewer: Marita S. Teng, MD 

How to Receive CME Credit:
For physicians who are interested in earning CME credits and other allied health professions who wish to receive a Verification of Attendance certificate, you must: 

a. Complete Signature Track (details to follow after enrolling in this course) 

b. Complete registration process through the Icahn School of Medicine at Mount Sinai, CME Office using the following link: http://cmetracker.net/MSSMCMEB/Login?formname=RegLoginLive&EventID=201115 (You will be required to pay an additional non-refundable fee of $30.00 in addition to the $49.00 fee for signature track.)

To obtain your CME/CE certificate: Email an attached copy of your Verified Certificate from Coursera to the CME office at the Icahn School of Medicine at cme@mssm.edu and request your CME certificate. Please make sure the subject line reads: Coursera CME 

Course Planners 
Lynette Bobbitt
Lisa Chase
Eric M. Genden, MD 
Jill Gregory
Gale Justin
Paul Lawrence
Carter Lim
Erik Popil",Created by:  Icahn School of Medicine at Mount Sinai,"['Taught by:\xa0\xa0Eric M. Genden, MD, Isidore Friesner Professor and Chairman |  Otolaryngology - Head and Neck Surgery |  Professor of Neurosurgery and Immunology |  Icahn School of Medicine at Mount Sinai |  Chief of the Division of Head and Neck Oncology |  Director of the Head and Neck Institute Mount Sinai Health System ']",Rated 4.6 out of 5 of 61 ratings,See all 15 reviews,2018-05-30,"['Home', 'Life Sciences', 'Biology']",HPV-Associated Oral and Throat Cancer: What You Need to Know,https://www.coursera.org/learn/hpv-oral-throat-cancer
Course 4 of 6 in the Data Structures and Algorithms Specialization ,"4 weeks of study, 4-8 hours/week",,Pass all graded assignments to complete the course.,English,Intermediate,4.5 starsAverage User Rating 4.5See what learners said,"About this course: World and internet is full of textual information. We search for information using textual queries, we read websites, books, e-mails. All those are strings from the point of view of computer science. To make sense of all that information and make search efficient, search engines use many string algorithms. Moreover, the emerging field of personalized medicine uses many search algorithms to find disease-causing mutations in the human genome.","Created by:  University of California San Diego, National Research University Higher School of Economics","['Taught by:\xa0\xa0Alexander S. Kulikov, Visiting Professor', 'Taught by:\xa0\xa0Michael Levin, Lecturer', 'Taught by:\xa0\xa0Pavel  Pevzner, Professor', 'Taught by:\xa0\xa0Neil Rhodes, Adjunct Faculty']",Rated 4.5 out of 5 of 393 ratings,See all 79 reviews,2018-05-30,"['Home', 'Computer Science', 'Algorithms']",Algorithms on Strings,https://www.coursera.org/learn/algorithms-on-strings
,"6 hours of videos, quizzes and peer assessments",,Pass all graded assignments to complete the course.,English,,4.7 starsAverage User Rating 4.7See what learners said,"About this course: Join us as we explore the fundamental principles and early stages of teaching violin and viola through a series of engaging video lectures and lesson demonstrations, including: 1) Master classes with some of the world’s top string pedagogues, 2) Individual lesson demos of teaching violin/viola set up, left and right hand technique and pieces from the early violin/viola repertoire, 3) Group lesson demos of teaching music theory, ear training and fun activities that encourage good playing habits, and 4) A “field trip” to the violin shop, where we will outfit a new beginning student with a proper instrument and bow. You’ll also engage in a series of discussions and reflections with colleagues and peers across the globe. Upon completion of this course, we hope you’ll return to your studio with confidence, a new curriculum, and a renewed approach to sharing with your students the joyful experience of making beautiful music.",Created by:  Northwestern University,"['Taught by:\xa0\xa0Stacia Spencer, Senior Lecturer']",Rated 4.7 out of 5 of 116 ratings,See all 39 reviews,2018-05-30,"['Home', 'Arts and Humanities', 'Music and Art']",Teaching the Violin and Viola: Creating a Healthy Foundation,https://www.coursera.org/learn/teach-violin-lessons
Course 4 of 4 in the Developing Your Musicianship Specialization ,"4 weeks of study, 2-3 hours/week",,Pass all graded assignments to complete the course.,English,Intermediate,4.8 starsAverage User Rating 4.8See what learners said,"About this course: This course will guide you through the final project for the Developing Your Musicianship Specialization. This course will continue to help you apply the musical concepts you learned throughout the specialization, enabling you to create and perform a 36-measure composition. Taught by Berklee College of Music professor George W. Russell, Jr., the course includes four videos in which George models each stage of the project. Through peer feedback and discussion, practice, and applying what you’ve learned, this final project will hone your skills as a musician.",Created by:  Berklee College of Music,"['Taught by:\xa0\xa0George W. Russell, Jr., Professor']",Rated 4.8 out of 5 of 33 ratings,See all 19 reviews,2018-05-30,"['Home', 'Arts and Humanities', 'Music and Art']",Developing Your Musicianship: Final Project,https://www.coursera.org/learn/musicianship-final-project
,4-6 hours/week,,Pass all graded assignments to complete the course.,English,,4.0 starsAverage User Rating 4.0See what learners said,"About this course: This course deals directly with your ability for creativity which is a critical skill in any field. It focuses on divergent thinking, the ability to develop multiple ideas and concepts to solve problems. Through a series of creativity building exercises, short lectures, and readings, learners develop both an understanding of creativity and increase their own ability.

This course will help you understand the role of creativity and innovation in your own work and in other disciplines.  It will challenge you to move outside of your existing comfort zone and to recognize the value of that exploration.  This course will help you understand the importance of diverse ideas, and to convey that understanding to others. 

The principal learning activity in the course is a series of ""differents"" where you are challenged to identify and change your own cultural, habitual, and normal patterns of behavior. Beginning with a prompt, e.g. ""eat something different"", you will begin to recognize your own = limits and to overcome them. In addition, you are encouraged to understand that creativity is based on societal norms, and that by it's nature, it will differ from and be discouraged by society. In this course, the persistence of the creative person is developed through practice. At the same time, these exercises are constrained by concerns of safety, legality, and economics, which are addressed in their creative process.",Created by:  University of Minnesota,"['Taught by:\xa0\xa0Brad Hokanson, PhD, Professor', 'Taught by:\xa0\xa0Jody Nyboer, PhD, Instructor']",Rated 4 out of 5 of 285 ratings,See all 60 reviews,2018-05-30,"['Home', 'Personal Development']",Creative Problem Solving,https://www.coursera.org/learn/creative-problem-solving
