Basic Info,Commitment,Hardware Req,How To Pass,Language,Level,User Ratings,description,institutions,instructors,ratings,reviews,scrape_date,subjects,title,url
Course 1 of 5 in the Deep Learning Specialization ,"4 weeks of study, 3-6 hours a week",,Pass all graded assignments to complete the course.,"English, Subtitles: Chinese (Traditional), Chinese (Simplified), Portuguese (Brazilian), Japanese",Intermediate,4.9 starsAverage User Rating 4.9See what learners said,"About this course: If you want to break into cutting-edge AI, this course will help you do so. Deep learning engineers are highly sought after, and mastering deep learning will give you numerous new career opportunities. Deep learning is also a new ""superpower"" that will let you build AI systems that just weren't possible a few years ago. 

In this course, you will learn the foundations of deep learning. When you finish this class, you will:
- Understand the major technology trends driving Deep Learning
- Be able to build, train and apply fully connected deep neural networks 
- Know how to implement efficient (vectorized) neural networks 
- Understand the key parameters in a neural network's architecture 

This course also teaches you how Deep Learning actually works, rather than presenting only a cursory or surface-level description. So after completing it, you will be able to apply deep learning to a your own applications. If you are looking for a job in AI, after this course you will also be able to answer basic interview questions. 

This is the first course of the Deep Learning Specialization.",Created by:  deeplearning.ai,"['Taught by:\xa0\xa0Andrew Ng, Co-founder, Coursera; Adjunct Professor, Stanford University; formerly head of Baidu AI Group/Google Brain', 'Taught by:\xa0\xa0Head Teaching Assistant - Kian Katanforoosh, Adjunct Lecturer at Stanford University, deeplearning.ai, Ecole Centrale Paris', 'Taught by:\xa0\xa0Teaching Assistant - Younes Bensouda Mourri, Mathematical & Computational Sciences, Stanford University, deeplearning.ai']","Rated 4.9 out of 5 of 29,121 ratings","See all 5,973 reviews",2018-05-30,"['Home', 'Data Science', 'Machine Learning']",Neural Networks and Deep Learning,https://www.coursera.org/learn/neural-networks-deep-learning
,2-4 hours/week,,Pass all graded assignments to complete the course.,"Chinese (Simplified), Subtitles: English",,5.0 starsAverage User Rating 5.0See what learners said,"About this course: 《电磁学下》是《电磁学》的第二学习进程，教学内容含恒磁场、磁介质，电磁感应、交流电和电磁场电磁波。虽然《电磁学下》内容比较多，但是处理场的基本方法大家已经熟悉和适应了，应该说，电磁学的前两章是整个电磁学的基础。建议大家学习了第一进程，通过了结业考试以后再进入第二学习进程《电磁学下》的学习。本课程的课程是按照知识点设置模块，《电磁学下》包含6个模块。每个模块又包含几节课，每个模块结束有一个小测，同学们可以自我测试，没有时间限制，大家可以根据自己的需要和时间安排来自主学习，以免一步跟不上，步步跟不上，这对于学习我们这种理论性比较强的课是有利的，已经明白的可以跳过去，不清楚的可以重点学习。
教学大纲
模块一      恒定磁场的基本规律
模块二      磁力
模块三      磁介质
模块四      电磁感应
模块五      交流电
模块六      电磁场电磁波",Created by:  Peking University,"['Taught by:\xa0\xa0Ms 王稼军   WangJiaJun, 教授   Professor']",Rated 5 out of 5 of 12 ratings,See all 3 reviews,2018-05-30,"['Home', 'Physical Science and Engineering', 'Physics and Astronomy']",电磁学下——恒磁场与时变电磁场,https://www.coursera.org/learn/dianci-2
Course 4 of 6 in the Business Technology Management Specialization ,,,Pass all graded assignments to complete the course.,English,Beginner,4.2 starsAverage User Rating 4.2See what learners said,"About this course: The concepts and use of project management tools, techniques and methodologies are becoming all pervasive. This course addresses project management in the context of IT projects, including software projects. Using the framework of project life cycle, the course covers various aspects pertaining to (i) project initiation, (ii) project planning and scheduling, (iii) project monitoring and control, and (iv) project termination. For planning and scheduling of projects, the use of project network and estimation of time and cost are covered in detail.  Scheduling of projects with resource limitations is covered next.

Risk assessment methods including simulation and risk reduction approaches are also be covered. The students will be required to use the software @risk to simulate project completion times. The use of Earned Value Analysis for Project Monitoring and Control is emphasized. For Software Project Management, the Waterfall Model and Agile Project Management are covered in detail.",Created by:  Indian School of Business,"['Taught by:\xa0\xa0M Rammohan Rao, Professor Emeritus']",Rated 4.2 out of 5 of 128 ratings,See all 37 reviews,2018-05-30,"['Home', 'Business', 'Business Strategy']",IT Project Management,https://www.coursera.org/learn/it-project-management
,"8 weeks, 10-12 hours per week",,Pass all graded assignments to complete the course.,English,Intermediate,4.7 starsAverage User Rating 4.7See what learners said,"About this course: Enumerative combinatorics deals with finite sets and their cardinalities. In other words, a typical problem of enumerative combinatorics is to find the number of ways a certain pattern can be formed. 

In the first part of our course we will be dealing with elementary combinatorial objects and notions: permutations, combinations, compositions, Fibonacci and Catalan numbers etc. In the second part of the course we introduce the notion of generating functions and use it to study recurrence relations and partition numbers. 

The course is mostly self-contained. However, some acquaintance with basic linear algebra and analysis (including Taylor series expansion) may be very helpful.",Created by:  National Research University Higher School of Economics,"['Taught by:\xa0\xa0Evgeny Smirnov, Associate Professor']",Rated 4.7 out of 5 of 46 ratings,See all 18 reviews,2018-05-30,"['Home', 'Math and Logic']",Introduction to Enumerative Combinatorics,https://www.coursera.org/learn/enumerative-combinatorics
,,,,,,,,,,,,2018-05-30,,Sorry,https://www.coursera.org/learn/it-automation
Course 1 of 5 in the Financial Reporting Specialization ,"8 weeks of study, 6-8 hours/week",,Pass all graded assignments to complete the course.,English,Intermediate,4.8 starsAverage User Rating 4.8See what learners said,"About this course: This course is the first course in a five-course Financial Reporting Specialization that covers the collection, processing, and communication of accounting information (via financial reports) about economic entities to interested parties (i.e., managers and external stakeholders such as stockholders and creditors).  To gain the most relevant knowledge from these courses, learners should have taken a basic accounting course prior to this Specialization (which can be done through Coursera courses, such as any accounting course from the Fundamentals of Accounting Specialization: https://www.coursera.org/specializations/accounting-fundamentals). This Specialization focuses on accounting concepts, principles and theory with an emphasis on problems that arise in applying these concepts for external reporting purposes.  Specific emphasis is placed on measurement of assets, liabilities, equities and income, as well as disclosure of additional information that may assist users understand the financial reports.  

After a brief introduction to the course, we will spend time understanding the overall financial accounting structure and standards as well as review the fundamental accounting process used to prepare the financial statements, which will establish a framework for the study of the concepts in the remaining courses in the Financial Reporting Specialization. In this course, we will begin our review of key information included in the Balance Sheet and Income Statement and their related financial disclosures. The Statement of Cash Flows will be introduced briefly with more discussion to follow in later courses of the Specialization.  Also, we will provide a cursory review of key concepts involving time value of money as we will finish this course with focus on revenue recognition, including discussion of the new revenue standard.  We will review the general approach for recognizing revenue, special issues affecting revenue recognition including long-term construction contracts. In addition, we will discuss and review common ratios used in profitability analysis. 

The University of Illinois at Urbana-Champaign, consistently ranked as one of the nation's top three accounting programs, now offers a master’s in accounting at a very affordable tuition rate and is completely online. The iMSA is a full Master of Accountancy program and students graduate with an MS that is highly recognized. Try an open course or two, then apply for admission into the credit-bearing version as you may be eligible to take credit-bearing courses during the application process. If you are missing any prerequisites for the full degree, you can complete Coursera courses to demonstrate readiness and strengthen your application for the iMSA. For more information on this exciting iMSA online program, refer to this link: https://www.coursera.org/degrees/imsa",Created by:  University of Illinois at Urbana-Champaign,"['Taught by:\xa0\xa0Gregory L. Davis, CPA, CMA, CFM, CCM, Lecturer of Accountancy']",Rated 4.8 out of 5 of 39 ratings,See all 8 reviews,2018-05-30,"['Home', 'Business', 'Business Essentials']",Accounting Analysis I: The Role of Accounting as an Information System,https://www.coursera.org/learn/accounting-information-system
Course 2 of 4 in the Fundamentals of Computer Network Security Specialization ,,,Pass all graded assignments to complete the course.,English,Intermediate,3.8 starsAverage User Rating 3.8See what learners said,"About this course: In this MOOC, we will learn the basic concepts and principles of crytography, apply basic cryptoanalysis to decrypt messages encrypted with mono-alphabetic substitution cipher, and discuss the strongest encryption technique of the one-time-pad and related quantum key distribution systems.  We will also learn the efficient symmetric key cryptography algorithms for encrypting data, discuss the DES and AES standards, study the criteria for selecting AES standard, present the block cipher operating modes and discuss how they can prevent and detect the block swapping attacks,  and examine how to defend against replay attacks. We will learn the Diffie-Hellman Symmetric Key Exchange Protocol to generate a symmetric key for two parties to communicate over insecure channel. We will learn  the modular arithmetic and the Euler Totient Theorem to appreciate the RSA Asymmetric Crypto Algorithm,  and use OpenSSL utility to realize the basic operations of RSA Crypto Algorithm. Armed with these knowledge, we learn how to use PHP  Crypto API to write secure programs for encrypting and decrypting documents  and for signing and verify documents. We then apply these techniques to enhance the registration process of a web site which ensures the account created is actually requested by the owner of the email account.",Created by:  University of Colorado System,"['Taught by:\xa0\xa0Edward Chow, Professor']",Rated 3.8 out of 5 of 4 ratings,See all reviews,2018-05-30,"['Home', 'Computer Science', 'Computer Security and Networks']",Basic Cryptography and Programming with Crypto API,https://www.coursera.org/learn/basic-cryptography-and-crypto-api
,3-5 hours/week,,Pass all graded assignments to complete the course.,English,,4.8 starsAverage User Rating 4.8See what learners said,"About this course: The final module of the Power of Markets course begins by further exploring firm behavior in imperfectly competitive market settings: how firms with monopoly power can increase profits through price discrimination; and the price-output combinations we can expect firms to select in cases of monopolistic competition and oligopoly. We will also analyze monopolies from an efficiency perspective and look at the effects of imperfect information on firm and consumer behavior. We will next turn to exploring input markets and what determines the demand for an input by a firm, an industry, and the overall market. We will also look at the factors that affect input supply and how the supply of an input interacts with demand to determinant input prices. We will use input market theory to analyze institutions and government policies such as the NCAA sports cartel, the minimum wage, Social Security, and immigration. Finally, we will address the concept of market efficiency and what government can do to promote it as well as how government intervention may diminish it.",Created by:  University of Rochester,"['Taught by:\xa0\xa0Mark Zupan, Professor of Economics and Public Policy']",Rated 4.8 out of 5 of 20 ratings,See all 3 reviews,2018-05-30,"['Home', 'Business', 'Business Essentials']",The Power of Markets III: Input Markets and Promoting Efficiency,https://www.coursera.org/learn/market-efficiency
,"3 weeks of study, approximately 4 hours per week plus assessments.",Computer or laptop with Internet access. Microphone.,Pass all graded assignments to complete the course.,English,Beginner,4.7 starsAverage User Rating 4.7See what learners said,"About this course: This course is designed to help you create dynamic, interactive online courses through the use of multimedia tools, student collaboration opportunities, and formative assessment and feedback. 

Each week we will focus on a particular topic:

1. Using multimedia for teaching and learning
2. Encouraging student collaboration
3. Formative assessment and feedback

You will have a range of materials to read, videos to watch, topics to research, activities to perform, discussions to participate in, and an assessment to complete. In addition, you will have a random assignment of fellow participants' assessments to mark in order to receive your own mark. While most of the videos and activities are mandatory, we have included a number of ""Take it Further"" activities and longer versions of videos that are voluntary.

At first glance, It may seem like a lot, but you will quickly find that many activities will take just minutes to perform. The emphasis in this MOOC is on gaining a wide range of experience in order to decide for yourself which tools and techniques to explore in more depth.

Although we introduce a few concepts along the way, this is a very practical course. You will be assessed according to what you create and share. We hope you will enjoy the active, hands-on nature of this course and find many ideas to incorporate in your teaching.","Created by:  University of London, Bloomsbury Learning Environment","['Taught by:\xa0\xa0Ms Sarah Sherman', 'Taught by:\xa0\xa0Dr Nancy Weitz, Digital Learning Specialist', 'Taught by:\xa0\xa0Dr Eileen Kennedy, Senior Research Associate']",Rated 4.7 out of 5 of 35 ratings,See all 13 reviews,2018-05-30,"['Home', 'Social Sciences', 'Education']",Get Interactive: Practical Teaching with Technology,https://www.coursera.org/learn/getinmooc
Course 2 of 5 in the Investment and Portfolio Management Specialization ,5 weeks,,Pass all graded assignments to complete the course.,English,,4.7 starsAverage User Rating 4.7See what learners said,"About this course: When an investor is faced with a portfolio choice problem, the number of possible assets and the various combinations and proportions in which each can be held can seem overwhelming. In this course, you’ll learn the basic principles underlying optimal portfolio construction, diversification, and risk management. You’ll start by acquiring the tools to characterize an investor’s risk and return trade-off. You will next analyze how a portfolio choice problem can be structured and learn how to solve for and implement the optimal portfolio solution. Finally, you will learn about the main pricing models for equilibrium asset prices.

Learners will:
•	Develop risk and return measures for portfolio of assets
•	Understand the main insights from modern portfolio theory based on diversification
•	Describe and identify efficient portfolios that manage risk effectively
•	Solve for portfolio with the best risk-return trade-offs
•	Understand how risk preference drive optimal asset allocation decisions
•	Describe and use equilibrium asset pricing models.",Created by:  Rice University,"['Taught by:\xa0\xa0Arzu Ozoguz, Finance Faculty']",Rated 4.7 out of 5 of 177 ratings,See all 25 reviews,2018-05-30,"['Home', 'Business', 'Finance']",Portfolio Selection and Risk Management,https://www.coursera.org/learn/portfolio-selection-risk-management
,,,Pass all graded assignments to complete the course.,English,Beginner,4.5 starsAverage User Rating 4.5See what learners said,"About this course: This course will cover the agricultural and urban water quality issues in Florida, their bases, land and nutrient management strategies, and the science and policy behind the best management practices (BMPs).  Students will learn to evaluate BMP research and analyze its role in determining practices and policies that protect water quality.",Created by:  University of Florida,"['Taught by:\xa0\xa0George J. Hochmuth, Ph.D., Professor']",Rated 4.5 out of 5 of 41 ratings,See all 16 reviews,2018-05-30,"['Home', 'Physical Science and Engineering', 'Environmental Science and Sustainability']",Sustainable Agricultural Land Management,https://www.coursera.org/learn/sustainable-agriculture
