Basic Info,Commitment,Hardware Req,How To Pass,Language,Level,User Ratings,description,institutions,instructors,ratings,reviews,scrape_date,subjects,title,url
Course 2 of 5 in the Methods and Statistics in Social Sciences Specialization ,"8 weeks of study, 4-6 hours/week",,Pass all graded assignments to complete the course.,English,Intermediate,4.5 starsAverage User Rating 4.5See what learners said,"About this course: In this course you will be introduced to the basic ideas behind the qualitative research in social science. You will learn about data collection, description, analysis and interpretation in qualitative research. Qualitative research often involves an iterative process. We will focus on the ingredients required for this process: data collection and analysis.
You won't learn how to use qualitative methods by just watching video's, so we put much stress on collecting data through observation and interviewing and on analysing and interpreting the collected data in other assignments.
Obviously, the most important concepts in qualitative research will be discussed, just as we will discuss quality criteria, good practices, ethics, writing some methods of analysis, and mixing methods.
We hope to take away some prejudice, and enthuse many students for qualitative research.",Created by:  University of Amsterdam,"['Taught by:\xa0\xa0Gerben Moerman, Dr.']",Rated 4.5 out of 5 of 464 ratings,See all 143 reviews,2018-05-30,"['Home', 'Social Sciences', 'Governance and Society']",Qualitative Research Methods,https://www.coursera.org/learn/qualitative-methods
Course 2 of 5 in the Virtual Reality Specialization ," 4 weeks of study, 3-5 hours/week","You will need a virtual reality device, e.g. a smartphone VR device, Oculus Rift or HTC VIVE",Pass all graded assignments to complete the course.,English,Intermediate,4.6 starsAverage User Rating 4.6See what learners said,"About this course: This course will begin your journey to creating Virtual Reality experiences. A Virtual Reality experience is a new world that you step into and are entirely immersed in. Creating a VR experience means creating that world and all the objects in it. 

In this course you will learn the basics of 3D graphics: how we create objects and how to lay them out to create an environment. You will learn techniques like materials and texturing that make your objects appear realistic. You will also learn about audio techniques to ensure that your experiences sound great as well as looking great. In all of these topics we will pay attention to the particular requirements of Virtual Reality, including pitfalls and performance issues: making sure your environment runs fast enough in VR. 

You will learn all of this using the professional game and VR engine, Unity3D. Unity is one of the most used game engine and is a relatively easy, but fully featured, introduction to 3D development. 

The course will culminate in a project in which you will create your own VR scene. VR development is something you can only learn by doing it yourself, so working on your project will be the best way to learn.","Created by:  University of London, Goldsmiths, University of London","['Taught by:\xa0\xa0 Dr Sylvia Xueni Pan,  Lecturer, Department of Computing  ', 'Taught by:\xa0\xa0Dr Marco Gillies, Senior Lecturer']",Rated 4.6 out of 5 of 58 ratings,See all 12 reviews,2018-05-30,"['Home', 'Computer Science', 'Design and Product']",3D Models for Virtual Reality,https://www.coursera.org/learn/3d-models-virtual-reality
,2-4 hours/week,,Pass all graded assignments to complete the course.,"English, Subtitles: Chinese (Simplified)",,4.5 starsAverage User Rating 4.5See what learners said,"About this course: The drive for development of new and novel oral biomaterials has never been more important with many people using oral biomaterials today and seeing their benefits in restoring and improving their oral health for a more enjoyable lifestyle. The unique properties of biomaterials such as titanium (Ti), zirconia (ZrO2) and various polymeric materials have made them materials of choice in oral health: dental implants, oral and maxillofacial surgery, and even regenerative medicine. Oral biomaterials research today is an exciting and intensive multidisciplinary area that encompasses contributions from a wide range of fields from professional dentistry to biology, chemistry, physics, material science, and engineering. 

Materials in Oral Health is a FREE 4-week course open to all interested learners. In the course, you will learn about the special properties and benefits of biomaterials including, titanium and titanium alloys, zirconia and other alloys, ceramics, and modern composites. You will gain insights of the practical use of these biomaterials in different aspects of dentistry and clinical implications. You will realize how contemporary dentistry is about unifying synthetic materials to living tooth and bone tissues. You will get in touch with the crucial roles of digital dentistry and learn about CAD/CAM technology in crown fabrication, 3D printing and digital orthodontics. And lastly, you will be introduced to procedures and testing methods used to test significant mechanical properties of biomaterials in the research laboratory. 

We cordially invite those of you who wish to make a difference in tomorrow’s dental materials and oral health development to join us in the 4-week journey in Materials in Oral Health.

You can get recognition for completion of the course by obtaining a Course Certificate. You can refer to details on: https://learner.coursera.help/hc/en-us/articles/208280196",Created by:  The University of Hong Kong,"['Taught by:\xa0\xa0Jukka Pekka Matinlinna, Professor in Dental Materials Science, Head of Unit', 'Taught by:\xa0\xa0James Kit Hon Tsoi, Assistant Professor in Dental Materials Science, Assistant Dean of Electives and Experiential Learning']",Rated 4.5 out of 5 of 102 ratings,See all 24 reviews,2018-05-30,"['Home', 'Life Sciences', 'Medicine and Healthcare']",Materials in Oral Health,https://www.coursera.org/learn/materials-oral-health
Course 4 of 4 in the Cybersecurity: Developing a Program for Your Business Specialization ,,,Pass all graded assignments to complete the course.,English,Beginner,4.7 starsAverage User Rating 4.7See what learners said,"About this course: This course intends to make the student familiar with information security management. When you have finished with this course you will know more about: 

• Governance: including the mission, roles and responsibilities of the InfoSec governance function, and the strategic planning process and InfoSec’s role in the organization’s strategic planning effort.
• You will understand the various types of InfoSec policies and how effective information security policy is created and used.
• Risk management and the risk management process
• Certain laws and ethical issues impacting information security in the organization. And some common information security management practices such as benchmarking and performance measures.",Created by:  University System of Georgia,"['Taught by:\xa0\xa0Dr. Humayun Zafar, Associate Professor of Information Security and Assurance', 'Taught by:\xa0\xa0Dr. Traci Carte, Associate Professor Chair, Information Systems', 'Taught by:\xa0\xa0Herbert J. Mattord, Ph.D., CISM, CISSP, CDP, Associate Professor in Information Security and Assurance', 'Taught by:\xa0\xa0Mr. Andy Green, Lecturer of Information Security and Assurance', 'Taught by:\xa0\xa0Michael Whitman, Ph.D., CISM, CISSP, Professor of Information Security']",Rated 4.7 out of 5 of 20 ratings,See all 9 reviews,2018-05-30,"['Home', 'Computer Science', 'Computer Security and Networks']",The Business of Cybersecurity Capstone,https://www.coursera.org/learn/business-of-cybersecurity-capstone
,"5 weeks of study, 4-7 hours/week",,Pass all graded assignments to complete the course.,"English, Subtitles: Mongolian",,,"About this course: We make economics decisions every day: what to buy, whether to work or play, what to study. We respond to markets all the time: prices influence our decisions, markets signal where to put effort, they direct firms to produce certain goods over others. Economics is all around us. 

This course is an introduction to the microeconomic theory of markets: why we have them, how they work, what they accomplish. We will start with the concept of scarcity and how specialization according to comparative advantage helps us achieve more than we could alone. Next we model a marked using the tools of Supply and Demand and learn what well working markets accomplish and what their limit are. We end by exploring the impact of government intervention on perfect markets. Examples are taken from everyday life, from goods and services that we all purchase and use. We will apply the theory to current events and policy debates through weekly exercises. These will empower you to be an educated, critical thinker who can understand, analyze and evaluate market outcomes.",Created by:  University of Pennsylvania,"['Taught by:\xa0\xa0Rebecca Stein, Senior Lecturer']",,,2018-05-30,"['Home', 'Social Sciences', 'Economics']",Microeconomics: The Power of Markets,https://www.coursera.org/learn/microeconomics-part1
Course 2 of 4 in the Six Sigma Green Belt Specialization ,,,Pass all graded assignments to complete the course.,English,Intermediate,4.7 starsAverage User Rating 4.7See what learners said,"About this course: This course is for you if you are looking to dive deeper into Six Sigma or strengthen and expand your knowledge of the basic components of green belt level of Six Sigma and Lean. Six Sigma skills are widely sought by employers both nationally and internationally. These skills have been proven to help improve business processes and performance. This course will take you deeper into the principles and tools associated with the ""Design"" and ""Measure"" phases of the DMAIC structure of Six Sigma.

It is highly recommended that you complete the ""Yellow Belt Specialization""  and the course ""Six Sigma and the Organization (Advanced)"" before beginning this course.

In this course, your instructors will introduce you to, and have you apply, some of the tools and metrics that are critical components of Six Sigma. This course will provide you with the advanced knowledge of team dynamics and performance, process analysis, probability, statistics,  statistical distributions, collecting and summarizing data, measurement systems analysis, process and performance capability, and exploratory data analysis associated with Six Sigma and Lean. 

Every module will include readings, videos, and quizzes to help make sure you understand the material and concepts that are studied. 

Registration includes online access to course content, projects, and resources but does not include the companion text The Certified Six Sigma Green Belt Handbook (2nd edition). The companion text is NOT required to complete the assignments. However, the text is a recognized handbook used by professionals in the field. Also, it is a highly-recommended text for those wishing to move forward in Six Sigma and eventually gain certification from professional agencies such as American Society for Quality (ASQ).",Created by:  University System of Georgia,"['Taught by:\xa0\xa0Christina Scherrer, PhD, Professor of Industrial Engineering', 'Taught by:\xa0\xa0Gregory Wiles, PhD, Interim Chair and Assistant Professor', 'Taught by:\xa0\xa0Bill Bailey, PhD, Assistant Professor of Industrial Engineering']",Rated 4.7 out of 5 of 75 ratings,See all 13 reviews,2018-05-30,"['Home', 'Business', 'Leadership and Management']",Six Sigma Advanced Define and Measure Phases,https://www.coursera.org/learn/six-sigma-define-measure-advanced
Course 2 of 4 in the Secure Software Design Specialization ,4 weeks 2-3 hours/week,,Pass all graded assignments to complete the course.,English,Intermediate,4.9 starsAverage User Rating 4.9See what learners said,"About this course: The design step in developing software has some unique characteristics.  First of all, it’s the only step where drawing pictures of things is the norm.  Why is that?  What do pictures do that other representations cannot do?  Pictures have varying levels of detail; pictures have context.  Pictures…paint a picture.  Why are these things important?  In this course, too, we begin looking at other disciplines (building architecture is a favorite one) for lessons on design.",Created by:  University of Colorado System,"['Taught by:\xa0\xa0Albert Glock, Instructor']",Rated 4.9 out of 5 of 14 ratings,See all 7 reviews,2018-05-30,"['Home', 'Computer Science', 'Software Development']",Software Design as an Abstraction,https://www.coursera.org/learn/software-design-abstraction
Course 1 of 5 in the Academic Skills for University Success Specialization ,"6 weeks of study, 2-4 hours/week",,Pass all graded assignments to complete the course.,English,Beginner,4.4 starsAverage User Rating 4.4See what learners said,"About this course: This Specialization is aimed at preparing students for undergraduate study in an English-speaking university. The course equips you for full participation and engagement with your studies by building awareness and understanding of the core values and expectations of academic culture, and providing you with practical strategies to apply to your studies. In this course, you will learn how to develop your Information & Digital Literacy Skills to help you achieve success in your university studies.  After completing this course, you will be able to:

1.	Access and search for information efficiently and effectively using a variety of digital tools. 

2.	Critically evaluate the reliability of sources for an academic context.

3.	Filter, manage and organize information from a wide variety of sources for use in academic study.

4.	Demonstrate awareness of ethical issues related to academic integrity surrounding the access and use of information.

5.	Understand how to use digital tools for referencing and attribution in order to avoid plagiarism.

6.	Understand how to disseminate and communicate information in a professional way, including managing digital identity and building networks for learning and research.",Created by:  The University of Sydney,"['Taught by:\xa0\xa0Katherine Olston, Deputy Director (Digital Learning)']",Rated 4.4 out of 5 of 22 ratings,See all 9 reviews,2018-05-30,"['Home', 'Social Sciences', 'Education']",Information & Digital Literacy for University Success,https://www.coursera.org/learn/digital-literacy
,"6 weeks of study, 3-4 hours / week",,Pass all graded assignments to complete the course.,English,,4.8 starsAverage User Rating 4.8See what learners said,"About this course: Transmedia storytelling is the practice of designing, sharing, and participating in a cohesive story experience across multiple traditional and digital delivery platforms - for entertainment, advertising and marketing, or social change. 

Have you ever read a book, seen a movie, watched a television show, or played a game that centred around different aspects of a larger story or universe? You may be familiar with popular examples of such universes like Star Wars, Marvel, and The Walking Dead (to name a few). 

How do the professionals develop such expansive narratives? How do they ensure that each element stays true to the original story? How do they innovatively use different technologies to share the stories, grow audiences and create an active and involved community of fans? 

More and more, we are also engaging with elements or franchises of larger and more complex stories across a much more diverse range of platforms like interactive web experiences, social media communities, mobile devices, theme parks, and even augmented and virtual reality. A major challenge that current and future storytellers face is being able to engage different audiences in a story that is seamlessly told across all of these different platforms.


WHAT WILL I LEARN?
This course  will help you to design a strategy for developing and telling your own transmedia story. You will learn about what it takes to:
• Shape your ideas into compelling and well structured narratives and complex story worlds
• Identify, understand, and engage different audiences in your stories
• Create cohesive user experiences across different platforms
• Evaluate existing and emerging technologies to share your story with the world, and help your audience participate in the larger storyworld you create

The course provides you with a unique, authentic, and industry relevant learning opportunity. You will have access to current theory, industry examples and advice and undertake learning activities that will equip you with the tools you need to start developing your own ideas.


WHO WILL MY INSTRUCTORS BE?
You will learn effective transmedia design strategies from leading UNSW Australia Art & Design academics. You will also examine case studies that demonstrate how amazing ideas, technology and audience contributions can be brought together to create dynamic storyworlds. You'll see examples of major, successful transmedia storytelling projects involving movies, digital entertainment, gaming, virtual reality and more. In collaboration with our industry partner X Media Lab, the course will give you inside access to the personal stories, insight and advice of the following innovative transmedia storytelling professionals from Hollywood USA, Canada and Australia. 

• Susan Bonds, 42 Entertainment, Los Angeles, USA
• Flint Dille, Screenwriter, Game Designer and Novelist, Los Angeles, USA
• Cindi Drennan, Illuminart, Australia
• Tom Ellard, UNSW Art & Design, Sydney, Australia
• Catherine Fargher, Dr Egg Digital, Sydney, Australia
• Hal Hefner, 3AM Creative, USA
• Brian Seth Hurst, StoryTech,  Los Angeles, USA
• Henry Jenkins, School for Communication and Journalism, University of Southern California, USA
• Mikey Leung, Digital Storytellers, Sydney, Australia
• Alex Lieu, 42 Entertainment, Los Angeles, USA
• Geoffrey Long, Annenberg Innovation Lab, University of Southern California, USA
• John McGhee, UNSW Art & Design, Sydney, Australia
• Joseph Narai, Transmedia Entertainment, Sydney, Australia
• Jeff Nicholas, The Uprising Creative, Los Angeles, USA
• Sergio Paez, Graphic Artist working in animation, TV, video games, and film. Co Founder, StoryboardArt, California, USA
• Steve Peters, No Mimes Media, Los Angeles, USA
• Stuart Samuels, Stuart Samuels Productions, Toronto, Canada
• Charles Santoso, Concept Artist, Sydney, Australia 
• Seth Shapiro, New Amsterdam Media, Los Angeles, USA
• Scott Snibbe, Eyegroove, San Francisco, USA
• Tracey Taylor, The Pulse, Sydney, Australia
• Robert Tercek, Public Speaker, Digital Media Strategist, and Executive Leader for Creative Ventures and Business Innovation, • University of Southern California, USA
• Kevin Williams, Founder & Director of KWP Ltd and DNA Association, UK
• Brent Young, Super 78, Los Angeles, USA
• Maya Zuckerman, Transmedia SF, San Francisco, USA

COURSE CONTENT DEVELOPMENT
Karin Watson, Iman Irannejad, and Dr. Simon McIntyre.",Created by:  UNSW Australia (The University of New South Wales),"['Taught by:\xa0\xa0Associate Professor Simon McIntyre, Associate Dean Education', 'Taught by:\xa0\xa0Dr Ollie Bown, Senior Lecturer', 'Taught by:\xa0\xa0Emma Robertson, Associate Professor', 'Taught by:\xa0\xa0Dr Geoge Khut, Lecturer', 'Taught by:\xa0\xa0Dr Jeffrey Koh, Associate Lecturer']",Rated 4.8 out of 5 of 166 ratings,See all 37 reviews,2018-05-30,"['Home', 'Arts and Humanities', 'Music and Art']","Transmedia Storytelling: Narrative worlds, emerging technologies, and global audiences",https://www.coursera.org/learn/transmedia-storytelling
Course 3 of 5 in the Leading People and Teams Specialization ,,,Pass all graded assignments to complete the course.,"English, Subtitles: Vietnamese",,4.7 starsAverage User Rating 4.7See what learners said,"About this course: This course will improve your ability to influence people in situations where you cannot use formal authority. You will learn about effective ways to build, develop, and sustain a power base in your organization. You will also learn influence tactics that enable you to be more persuasive and influential in working with your superiors, peers, and even subordinates. In addition, you will learn how to build and maintain high-quality relationships to further maximize your informal power and ability to influence others. Importantly, you will distinguish between influence and manipulation and learn how to protect yourself from the unwanted influence of others.

The influence strategies you learn in this course will make you a more confident and influential leader, presenter, and decision-maker. You will more effective in pitching business ideas to your superiors, influencing customers, and building coalitions across stakeholders. This course will not only give you strategic guidance on how to develop and maintain your network for influence and power, but we will also equip you with specific tactics and strategies that are proven to work for gaining power and influencing people.",Created by:  University of Michigan,"['Taught by:\xa0\xa0Scott DeRue, Ph.D., Edward J. Frey Dean at the Ross School of Business', 'Taught by:\xa0\xa0Maxim Sytch, Ph.D., Associate Professor of Management and Organizations Michael R. and Mary Kay Hallman Fellow']","Rated 4.7 out of 5 of 1,733 ratings",See all 357 reviews,2018-05-30,"['Home', 'Business', 'Business Essentials']",Influencing People,https://www.coursera.org/learn/influencing-people
Course 1 of 5 in the Business and Financial Modeling Specialization ,"4 weeks of study, 1-3 hours/week",,Pass all graded assignments to complete the course.,"English, Subtitles: Russian",,4.6 starsAverage User Rating 4.6See what learners said,"About this course: How can you put data to work for you? Specifically, how can numbers in a spreadsheet tell us about present and past business activities, and how can we use them to forecast the future? The answer is in building quantitative models, and this course is designed to help you understand the fundamentals of this critical, foundational, business skill. Through a series of short lectures, demonstrations, and assignments, you’ll learn the key ideas and process of quantitative modeling so that you can begin to create your own models for your own business or enterprise. By the end of this course, you will have seen a variety of practical commonly used quantitative models as well as the building blocks that will allow you to start structuring your own models. These building blocks will be put to use in the other courses in this Specialization.",Created by:  University of Pennsylvania,"['Taught by:\xa0\xa0Richard Waterman, Professor of Statistics']","Rated 4.6 out of 5 of 2,620 ratings",See all 542 reviews,2018-05-30,"['Home', 'Business', 'Business Essentials']",Fundamentals of Quantitative Modeling,https://www.coursera.org/learn/wharton-quantitative-modeling
