Basic Info,Commitment,Hardware Req,How To Pass,Language,Level,User Ratings,description,institutions,instructors,ratings,reviews,scrape_date,subjects,title,url
,"3 weeks of study, 1-2 hours/week",,Pass all graded assignments to complete the course.,"English, Subtitles: Polish, Hebrew, Spanish",,4.8 starsAverage User Rating 4.8See what learners said,"About this course: The Holocaust was an inconceivable historical event, which forever robbed Western culture of its innocence. As civilized human beings, we fail to understand how events of such horror could have taken place, and how an idea so inhumanly warped could have spread like wildfire through an entire continent, instigating the systematic annihilation of millions of Jews.

This free online course was produced jointly by Tel Aviv University and Yad Vashem – the World Holocaust Remembrance Center. The course tracks the history of the Holocaust and has two parts. ""The Holocaust - An Introduction (I): Nazi Germany: Ideology, The Jews and the World"" is the first of the two courses and covers the following themes in its three weeks:

Week 1: From Hatred to Core Ideology
We will try to delve into Nazi ideology and the special place of Jews and Judaism in it. We will also discuss how the National Socialist Party converted the German Democracy of the Weimar Republic into a totalitarian regime within a short period of time, and its meaning for Jews and non-Jewish citizens.

Week 2: The World and the Jews in World War II
We will try to examine the broader contexts of the Holocaust and to place it, as part of World War 2. In this meeting we will also refer to the vital Jewish world to be found under various Nazi occupations and influences.

Week 3: The Isolation Abyss - the Perspective of the Individual
We will try to reveal different aspects of Jewish life in the face of the badge of shame, ghettos and segregation, as well as the formation of individual, societies’ and leader’s reactions in the face of a consistent policy of dispossession and discrimination.

Once you’ve completed this course, you can continue your learning with The Holocaust - An Introduction (II): The Final Solution


This online course is offered in an innovative, multi-level format, comprising:

* Comprehensive lectures by leading researchers from Tel Aviv University and Yad Vashem.
* A wealth of voices and viewpoints presented by guest lecturers.
* Numerous documents, photos, testimonies and works of art from the time of the Holocaust.
* Novel learning experience: Crowd sourcing – involving the learners themselves in the act of collecting and shaping information, via unique, exciting online assignments.

REQUIREMENTS:
This course is designed for anyone with an interest in the Holocaust, including students, teachers, academics and policy-makers.","Created by:  Tel Aviv University, Yad Vashem ","['Taught by:\xa0\xa0Professor Havi Dreifuss, PhD, Professor', ""Taught by:\xa0\xa0Dr Na'ama Bela Shik, PhD, Director, Educational Technology Department, The International School for Holocaust Studies, Yad Vashem""]",Rated 4.8 out of 5 of 462 ratings,See all 117 reviews,2018-05-30,"['Home', 'Arts and Humanities', 'History']","The Holocaust - An Introduction (I): Nazi Germany: Ideology, The Jews and the World",https://www.coursera.org/learn/holocaust-introduction-1
,4 weeks of study; 3-4 hours/week,,Pass all graded assignments to complete the course.,"English, Subtitles: Ukrainian",Beginner,4.7 starsAverage User Rating 4.7See what learners said,"About this course: Most professions these days require more than general intelligence. They require in addition the ability to collect, analyze and think about data. Personal life is enriched when these same skills are applied to problems in everyday life involving judgment and choice. This course presents basic concepts from statistics, probability, scientific methodology, cognitive psychology and cost-benefit theory and shows how they can be applied to everything from picking one product over another to critiquing media accounts of scientific research. Concepts are defined briefly and breezily and then applied to many examples drawn from business, the media and everyday life.

What kinds of things will you learn? Why it’s usually a mistake to interview people for a job. Why it’s highly unlikely that, if your first meal in a new restaurant is excellent, you will find the next meal to be as good. Why economists regularly walk out of movies and leave restaurant food uneaten. Why getting your picture on the cover of Sports Illustrated usually means your next season is going to be a disappointment. Why you might not have a disease even though you’ve tested positive for it. Why you’re never going to know how coffee affects you unless you conduct an experiment in which you flip a coin to determine whether you will have coffee on a given day. Why it might be a mistake to use an office in a building you own as opposed to having your office in someone else’s building. Why you should never keep a stock that’s going down in hopes that it will go back up and prevent you from losing any of your initial investment. Why it is that a great deal of health information presented in the media is misinformation.",Created by:  University of Michigan,"['Taught by:\xa0\xa0Richard E. Nisbett, Theodore M. Newcomb Distinguished University Professor']",Rated 4.7 out of 5 of 207 ratings,See all 47 reviews,2018-05-30,"['Home', 'Social Sciences', 'Psychology']",Mindware: Critical Thinking for the Information Age ,https://www.coursera.org/learn/mindware
Course 2 of 4 in the Learn English: Intermediate Grammar Specialization ,"4 weeks of study, 2-4 hours/week",,Pass all graded assignments to complete the course.,"English, Subtitles: Spanish, Hindi",,4.6 starsAverage User Rating 4.6See what learners said,"About this course: Being able to adeptly use adjective clauses in speaking and writing is useful for upper level English learners. Adjectives and adjective clauses are very common in English, so students need to be able to understand them when they see them or hear them. Students often struggle to bring complexity to their speaking and writing and adjective clauses can be a great way to do this.

Please note that all of the lectures and practice activities are available for free, but taking the quizzes and getting feedback on assignments are only available in the paid version","Created by:  University of California, Irvine","['Taught by:\xa0\xa0Tamy Chapman, Instructor, International Programs', 'Taught by:\xa0\xa0Judy Hu, Instructor, International Programs', 'Taught by:\xa0\xa0Brad Gilpin']",Rated 4.6 out of 5 of 309 ratings,See all 81 reviews,2018-05-30,"['Home', 'Language Learning', 'Learning English']",Adjectives and Adjective Clauses,https://www.coursera.org/learn/adjective-clauses
Course 1 of 6 in the (ISC)² Systems Security Certified Practitioner (SSCP)  Specialization ,,,Pass all graded assignments to complete the course.,English,Beginner,3.7 starsAverage User Rating 3.7See what learners said,"About this course: Welcome to Access Controls!

The Access Controls Course provides information pertaining to specify what users are permitted to do, the resources they are allowed to access, and what operations they are able to perform on a system. Access Controls help managers limit and monitor systems use at a user level or group membership. You will understand the different access control systems and how they should be implemented to protect the system and data using the different levels of confidentiality, integrity, and availability.

The Access Controls course provides information pertaining to specifying what users are permitted to do, the resources they are allowed to access, and what operations they are able to perform on a system. Access Controls help managers limit and monitor systems use at a user level, and is usually predefined based on authority level or group membership. You will understand the different access control systems and how they should be implemented to protect the system and data using the different levels of confidentiality, integrity, and availability.

  Objectives
1. Describe how to implement Authentication mechanisms
2. Identify and operate internetwork trust architectures
3. Describe the process of administering identity management life cycle
4. Implement the different types of access controls (Subject/Object based)",Created by:  (ISC)²,['Taught by:\xa0\xa0(ISC)² Education & Training'],Rated 3.7 out of 5 of 3 ratings,,2018-05-30,"['Home', 'Information Technology', 'Security']",Access Controls ,https://www.coursera.org/learn/access-control-sscp
Course 2 of 4 in the Achieving Personal and Professional Success Specialization ,"4 weeks of study, 2-3 hours per week",,Pass all graded assignments to complete the course.,"English, Subtitles: Chinese (Simplified)",Beginner,4.6 starsAverage User Rating 4.6See what learners said,"About this course: Learn how to communicate more effectively at work and achieve your goals. Taught by award-winning Wharton professor and best-selling author Maurice Schweitzer, Improving Communications Skills is an essential course designed to give you both the tools you need to improve your communication skills, and the most successful strategies for using them to your advantage. You'll learn how to discover if someone is lying (and how to react if they are), how to develop trust, the best method of communication for negotiation, and how to apologize. You'll also learn when to cooperate and when to compete,  how to create persuasive messages, ask thoughtful questions, engage in active listening, and choose the right medium (face-to-face conversation, video conference, phone call, or email) for your messages. By the end of the course, you'll be able to understand what others want, respond strategically to their wants and needs, craft convincing and clear messages, and develop the critical communication skills you need to get ahead in business and in life.",Created by:  University of Pennsylvania,"['Taught by:\xa0\xa0Maurice Schweitzer, Professor of Operations, Information and Decisions']",Rated 4.6 out of 5 of 349 ratings,See all 90 reviews,2018-05-30,"['Home', 'Personal Development']",Improving Communication Skills,https://www.coursera.org/learn/wharton-communication-skills
,,,Pass all graded assignments to complete the course.,English,,4.2 starsAverage User Rating 4.2See what learners said,"About this course: This class provides a series of Python programming exercises intended to explore the use of numerical modeling in the Earth system and climate sciences.  The scientific background for these models is presented in a companion class, Global Warming I: The Science and Modeling of Climate Change.  This class assumes that you are new to Python programming (and this is indeed a great way to learn Python!), but that you will be able to pick up an elementary knowledge of Python syntax from another class or from on-line tutorials.",Created by:  The University of Chicago,"['Taught by:\xa0\xa0David Archer, Professor']",Rated 4.2 out of 5 of 29 ratings,See all 11 reviews,2018-05-30,"['Home', 'Physical Science and Engineering', 'Environmental Science and Sustainability']",Global Warming II: Create Your Own Models in Python,https://www.coursera.org/learn/global-warming-model
Course 3 of 5 in the Virtual Reality Specialization ," 4 weeks of study, 3-5 hours/week","You will need a virtual reality device, e.g. a smartphone VR device, Oculus Rift or HTC VIVE",Pass all graded assignments to complete the course.,English,Intermediate,4.7 starsAverage User Rating 4.7See what learners said,"About this course: This course will teach you about one of the most important aspects of VR, how you interact with a VR world. Virtual Reality is completely different from an on screen app or game. You are completely immersed in a VR world, so it doesn't make sense to interact only through buttons or menus. You will get the most out of VR if you can interact with the world just as you would with the real world: with your natural body movements. You will learn about the basic concepts and technologies of VR Interaction. You will then get hands on, learning about how to move around in VR and how to interact with the objects in your world. The course will finish with some advice from experts on VR interaction design and you will do a project where you will get real experience of developing VR Interaction.","Created by:  University of London, Goldsmiths, University of London","['Taught by:\xa0\xa0 Dr Sylvia Xueni Pan,  Lecturer, Department of Computing  ', 'Taught by:\xa0\xa0Dr Marco Gillies, Senior Lecturer']",Rated 4.7 out of 5 of 23 ratings,See all 3 reviews,2018-05-30,"['Home', 'Computer Science', 'Design and Product']",3D Interaction Design in Virtual Reality,https://www.coursera.org/learn/3d-interaction-design-virtual-reality
,,,Pass all graded assignments to complete the course.,English,,4.8 starsAverage User Rating 4.8See what learners said,"About this course: Sports play a giant role in contemporary society worldwide. But few of us pause to think about the larger questions of money, politics, race, sex, culture, and commercialization that surround sports everywhere. This course draws on the tools of anthropology, sociology, history, and other disciplines to give you new perspectives on the games we watch and play.  It's the new and improved version of Professor Orin Starn's original ""Sports and Society"" for Coursera, which drew more than 40,000 students.  We will focus on both popular sports like soccer (or “football,” as anyone outside America calls it), basketball, and baseball, and also lesser-known ones like mountain-climbing and fishing.  You will never watch or think about sports in the same way again.",Created by:  Duke University,"['Taught by:\xa0\xa0Orin Starn, Professor']",Rated 4.8 out of 5 of 282 ratings,See all 53 reviews,2018-05-30,"['Home', 'Social Sciences', 'Governance and Society']",Sports and Society,https://www.coursera.org/learn/sports-society
