Basic Info,Commitment,Hardware Req,How To Pass,Language,Level,User Ratings,description,institutions,instructors,ratings,reviews,scrape_date,subjects,title,url
,,,Pass all graded assignments to complete the course.,"English, Subtitles: Spanish",Beginner,4.7 starsAverage User Rating 4.7See what learners said,"About this course: The National Consortium for the Study of Terrorism and Responses to Terrorism (START), a Department of Homeland Security Center of Excellence housed at the University of Maryland, offers a course looking at the who, what and how of Terrorism Studies, by introducing students to cutting-edge research from the social and behavioral sciences and the experts investigating these topics.  

The course will begin with a unit looking at widely held myths about terrorism and utilizing empirical data to discuss the realities of broad trends and patterns in terrorist attacks over time. The course will then review the psychological factors at play in individual radicalization and recruitment into terrorism, followed by an analysis of terrorist group dynamics. The course will next look at terrorist group operations, including their attacks and some of the supporting behaviors that allow them to carry out attacks, including use of media, financing, recruitment, and training. The course will conclude by looking at the factors that drive terrorist group persistence or endurance versus terrorist group desistance, and will bring the varied course concepts together through a detailed look at the case of Al-Qa’ida.  

Throughout the course, students will have the opportunity to study and work with the University of Maryland’s Global Terrorism Database (GTD), the largest database of terrorist incidents in the world, learning its capabilities and developing basic skills in searching and displaying terrorism data.","Created by:  University of Maryland, College Park","['Taught by:\xa0\xa0Dr. Gary  LaFree, Director', 'Taught by:\xa0\xa0Bill Braniff, Executive Director', 'Taught by:\xa0\xa0Kate Izsak, Education Director', 'Taught by:\xa0\xa0Joyce Rasing']",Rated 4.7 out of 5 of 146 ratings,See all 40 reviews,2018-05-30,"['Home', 'Social Sciences', 'Governance and Society']",Understanding Terrorism and the Terrorist Threat,https://www.coursera.org/learn/understandingterror
Course 4 of 6 in the Systems Biology and Biotechnology Specialization ,8-10 hours/week,,Pass all graded assignments to complete the course.,English,,4.7 starsAverage User Rating 4.7See what learners said,"About this course: An introduction to dynamical modeling techniques used in contemporary Systems Biology research.

We take a case-based approach to teach contemporary mathematical modeling
techniques. The course is appropriate for advanced undergraduates and beginning graduate students. Lectures provide biological background and describe the development of both classical mathematical models and more recent representations of biological processes. The course will be useful for students who plan to use experimental techniques as their approach in the laboratory and employ computational modeling as a tool to draw deeper understanding of experiments. The course should also be valuable as an introductory overview for students planning to conduct original research in modeling biological systems.

This course focuses on dynamical modeling techniques used in Systems Biology research.  These techniques are based on biological mechanisms, and simulations with these models generate predictions that can subsequently be tested experimentally. These testable predictions frequently provide novel insight into biological processes. The approaches taught here can be grouped into the following categories: 1) ordinary differential equation-based models, 2) partial differential equation-based models, and 3) stochastic models.",Created by:  Icahn School of Medicine at Mount Sinai,"['Taught by:\xa0\xa0Eric Sobie, PhD, Associate Professor']",Rated 4.7 out of 5 of 109 ratings,See all 23 reviews,2018-05-30,"['Home', 'Life Sciences', 'Bioinformatics']",Dynamical Modeling Methods for Systems Biology,https://www.coursera.org/learn/dynamical-modeling
,,,Pass all graded assignments to complete the course.,"English, Subtitles: Spanish",,4.6 starsAverage User Rating 4.6See what learners said,"About this course: The objective of this course is to provide an overview of the culture of ancient Rome beginning about 1000 BCE and ending with the so-called ""Fall of Rome"". We will look at some of the key people who played a role in Rome, from the time of the kings through the Roman Republic and the Roman Empire. We will also focus on the city of Rome itself, as well as Rome's expansion through Italy, the Mediterranean, and beyond.",Created by:  University of Arizona,"['Taught by:\xa0\xa0David Soren, Regents Professor of Classics and Anthropology ']",Rated 4.6 out of 5 of 264 ratings,See all 74 reviews,2018-05-30,"['Home', 'Arts and Humanities', 'History']",Roman Art and Archaeology,https://www.coursera.org/learn/roman-art-archaeology
,"5 weeks of study, 1-2 hours/week",,Pass all graded assignments to complete the course.,English,,4.7 starsAverage User Rating 4.7See what learners said,"About this course: The course deals with the analysis of the private equity and venture capital business. 
Over the course, students will be provided with a deep understanding of the mechanism underpinning the creation and/or development of a firm and the financial support it can get from the financial system through venture capital investment.

The course tries to discover how special financial intermediaries (called private equity investors) finance through equity companies belonging to different stages of their life-cycle, starting from the very beginning (startup and early stage) to a more mature phase (i.e. expansion, mature age, etc.) or also staying into crises and decline. 

Private equity (named venture capital when the company is in the first phases of its life cycle) deals with very different activities, such as scouting, advisory, deal-making, valuation, and financing as financial intermediaries see it. 

COURSE SYLLABUS
The course is made up of four different modules: 
WEEK 1 - Introduction to Private Equity and Venture Capital
WEEK 2 - Discovering Private Equity Investors: Legal Issues and Taxation
WEEK 3 - Management of Private Equity and Venture Capital Funds
WEEK 4 - Company Valuation And Deal Making In Private Equity Settings
WEEK 5 - Final Test
Throughout the course, guest speakers and practitioners will be interviewed to provide some examples of concrete applications of the contents presented.

RECOMMENDED BACKGROUND
An understanding of the basic concepts of corporate financing accounting principles is required, while prior knowledge of private equity and venture capital is not required however it is recommended, as this is a course designed to introduce you to the fundamental concepts in private equity and venture capital.",Created by:  Università Bocconi,"['Taught by:\xa0\xa0Stefano Caselli, Vice Rector for International Affairs']","Rated 4.7 out of 5 of 1,742 ratings",See all 407 reviews,2018-05-30,"['Home', 'Business', 'Finance']",Private Equity and Venture Capital,https://www.coursera.org/learn/private-equity
,"6 weeks of study, 2-4 hours per week",,Pass all graded assignments to complete the course.,English,Beginner,4.7 starsAverage User Rating 4.7See what learners said,"About this course: This course presents critical concepts and practical methods to support planning, collection, storage, and dissemination of data in clinical research.

Understanding and implementing solid data management principles is critical for any scientific domain. Regardless of your current (or anticipated) role in the research enterprise, a strong working knowledge and skill set in data management principles and practice will increase your productivity and improve your science. Our goal is to use these modules to help you learn and practice this skill set. 

This course assumes very little current knowledge of technology other than how to operate a web browser. We will focus on practical lessons, short quizzes, and hands-on exercises as we explore together best practices for data management.",Created by:  Vanderbilt University,"['Taught by:\xa0\xa0Stephany Duda, PhD, Associate Professor', 'Taught by:\xa0\xa0Paul Harris, PhD, Professor']",Rated 4.7 out of 5 of 351 ratings,See all 98 reviews,2018-05-30,"['Home', 'Life Sciences', 'Clinical Science']",Data Management for Clinical Research,https://www.coursera.org/learn/clinical-data-management
"Course 3 of 4 in the TESOL Certificate, Part 1: Teach English Now! Specialization ",,,Pass all graded assignments to complete the course.,"English, Subtitles: Spanish",,4.9 starsAverage User Rating 4.9See what learners said,"About this course: Learners will be introduced to designing lesson plans based on principles and knowledge of learning objectives, assessment plans, methods, materials, and learning activities. Learners will find and prepare appropriate teaching materials through careful analysis, adaptation and creation of professional resources. Learners will also reflect on the cohesion between lesson design and teaching philosophies.",Created by:  Arizona State University,"['Taught by:\xa0\xa0Dr. Shane Dixon, Senior International Educator', 'Taught by:\xa0\xa0Dr. Justin Shewell, Senior International Educator', 'Taught by:\xa0\xa0Jessica Cinco, International Educator']","Rated 4.9 out of 5 of 1,413 ratings",See all 343 reviews,2018-05-30,"['Home', 'Social Sciences', 'Education']",Teach English Now! Lesson Design and Assessment,https://www.coursera.org/learn/lesson-design
,6-8 hours/week,,Pass all graded assignments to complete the course.,"English, Subtitles: Spanish",,,"About this course: Calculus is one of the grandest achievements of human thought, explaining everything from planetary orbits to the optimal size of a city to the periodicity of a heartbeat. This brisk course covers the core ideas of single-variable Calculus with emphases on conceptual understanding and applications. The course is ideal for students beginning in the engineering, physical, and social sciences. Distinguishing features of the course include: 1) the introduction and use of Taylor series and approximations from the beginning; 2) a novel synthesis of discrete and continuous forms of Calculus; 3) an emphasis on the conceptual over the computational; and 4) a clear, dynamic, unified approach.

In this third part--part three of five--we cover integrating differential equations, techniques of integration, the fundamental theorem of integral calculus, and difficult integrals.",Created by:  University of Pennsylvania,"['Taught by:\xa0\xa0Robert Ghrist,  Professor ']",,,2018-05-30,"['Home', 'Math and Logic']",Calculus: Single Variable Part 3 - Integration,https://www.coursera.org/learn/integration-calculus
Course 1 of 4 in the Market Research Specialization ,"4 weeks of study, 2-5 hours/week",,Pass all graded assignments to complete the course.,English,Intermediate,4.5 starsAverage User Rating 4.5See what learners said,"About this course: Market Research is a growing and important field that is used in many industries around the world. Given all the data that is collected whether by organizations, industries, social media, governments, etc., it’s important that someone can review and sift through all the noise to provide valuable insights. And that’s where you come in as a market researcher. This course will only scratch the surface and provide you a foundational understanding of this field.

In this course, you will be able to define market research and identify some tools used in the industry. You will be able to discuss the importance of secondary and internal research in terms of the planning process. You will be able to define what primary research is and identify the various ways to conduct primary research. You will be able to focus on an actual research plan or proposal for your peer review project. You will be able to compose a response to a request for a proposal or research plan and be able to address the various components of the proposal and package it in a professional manner.","Created by:  University of California, Davis","['Taught by:\xa0\xa0Jim Fong, Director, UPCEA Center for Research and Marketing Strategy']",Rated 4.5 out of 5 of 53 ratings,See all 7 reviews,2018-05-30,"['Home', 'Business', 'Marketing']",Research Proposal: Initiating Research,https://www.coursera.org/learn/research-proposal-initiating-research
,,,Pass all graded assignments to complete the course.,English,Intermediate,,"About this course: This course will teach you how to perform data analysis using MongoDB's powerful Aggregation Framework.

You'll begin this course by building a foundation of essential aggregation knowledge. By understanding these features of the Aggregation Framework you will learn how to ask complex questions of your data. This will lay the groundwork for the remainder of the course where you'll dive deep and learn about schema design, relational data migrations, and machine learning with 
MongoDB.

By the end of this course you'll understand how to best use MongoDB and its Aggregation Framework in your own data science workflow.",Created by:  MongoDB Inc.,"['Taught by:\xa0\xa0Nathan Leniz, Curriculum Engineer', 'Taught by:\xa0\xa0Kirby Kohlmorgen, Senior Curriculum Engineer']",Rated 4.7 out of 5 of 3 ratings,,2018-05-30,"['Home', 'Data Science', 'Data Analysis']",MongoDB Aggregation Framework,https://www.coursera.org/learn/mongodb-aggregation-framework
,,,Pass all graded assignments to complete the course.,"English, Subtitles: Arabic, Portuguese (Brazilian), Hebrew, Romanian",Intermediate,4.7 starsAverage User Rating 4.7See what learners said,"About this course: This class is aimed at people interested in understanding the basic science of plant biology. In this four lecture series, we'll first learn about the structure-function of plants and of plant cells. Then we'll try to understand how plants grow and develop, making such complex structures as flowers. Once we know how plants grow and develop, we'll then delve into understanding photosynthesis - how plants take carbon dioxide from the air and water from soil, and turn this into oxygen for us to breathe
and sugars for us to eat.  In the last lecture we'll learn about the fascinating, important and controversial science behind genetic engineering in agriculture.

If you haven't taken it already, you may also be interested in my other course - What A Plant Knows, which examines how plants see, smell, hear and feel their environment: https://www.coursera.org/learn/plantknows.

In order to receive academic credit for this course you must successfully pass the academic exam on campus. For information on how to register for the academic exam – https://tauonline.tau.ac.il/registration

Additionally, you can apply to certain degrees using the grades you received on the courses. Read more on this here – 
https://go.tau.ac.il/b.a/mooc-acceptance

Teachers interested in teaching this course in their class rooms are invited to explore our Academic High school program here – https://tauonline.tau.ac.il/online-highschool",Created by:  Tel Aviv University,"['Taught by:\xa0\xa0Professor Daniel Chamovitz, Ph.D., Dean, George S. Wise Faculty of Life Sciences']",Rated 4.7 out of 5 of 293 ratings,See all 89 reviews,2018-05-30,"['Home', 'Life Sciences', 'Biology']",Understanding Plants - Part II: Fundamentals of Plant Biology,https://www.coursera.org/learn/plant-biology
