Basic Info,Commitment,Hardware Req,How To Pass,Language,Level,User Ratings,description,institutions,instructors,ratings,reviews,scrape_date,subjects,title,url
,"6 weeks of study, 4-5 hours/week",,Pass all graded assignments to complete the course.,English,,4.7 starsAverage User Rating 4.7See what learners said,"About this course: This MOOC identifies and explores a number of challenges to the finance professional arising from the ever changing business environment. Increasingly, financial decisions must take account of strategic consequences. 

The first module, Exploring Strategic Position, Choice and Action helps in doing that – setting a strategic context for planning for, monitoring and controlling projects and activities. An on-going set of challenges is found in the evolution of International Reporting Standards. 

The second module focuses on some recent changes in Standards, identifying the drivers for changes, and examining evolution in controversial areas such as leasing and goodwill. 

The third and final module, Corporate Governance, examines issues which are causing people to re-assess the nature, purpose and scope of corporate governance, and challenges to making governance function effectively. Key issues here are the move to include a broader range of stakeholders, the perennial challenge of agency theory issues, shareholder activism, changing Board structures, and challenges to internal control to better manage risk. 

This MOOC will be right for you if you are interested in engaging with some of the challenges facing finance professionals, even if you are not one yourself. If you are thinking about returning to study this will provide a taster of academic endeavours through reading articles, critiquing ideas, and blending theory with reality",Created by:  University of London,"['Taught by:\xa0\xa0Dr Sarah Warnes, Teaching Fellow', 'Taught by:\xa0\xa0Dr Alan Parkinson, Deputy Director (Education), School of Management', 'Taught by:\xa0\xa0Mr Suman Saha, Visiting Academic ']",Rated 4.7 out of 5 of 189 ratings,See all 54 reviews,2018-05-30,"['Home', 'Business', 'Finance']",Keeping up with Change: Issues for the Finance Professional,https://www.coursera.org/learn/change-for-the-finance-professional
,,,Pass all graded assignments to complete the course.,English,Beginner,5.0 starsAverage User Rating 5.0See what learners said,"About this course: Chemerinsky on Constitutional Law: Individual Rights and Liberties will highlight the construction and interpretation of the U.S. Constitution through the centuries with an emphasis on protections of individual liberties and the evolution of equal protection. You'll learn the history behind the Constitution, cases that formed important precedent, and how changes in interpretation have been dependent on shifts in cultural and political climate as well as the composition of the Supreme Court.

In this course we will investigate the protection of individual rights and liberties and take a look at what rights are and are not protected and investigate several important shifts in jurisprudence. We'll begin by examining the structure of the Constitution's protection of individual rights. We'll then examine the circumstances under which, various rights and liberties can be regulated by the federal, state, and local government. We'll examine when the government can permissibly treat people unequally and when it can't. In our final two lectures, we'll take a close look at what is probably the most famous amendment to the Constitution, the First Amendment.

Join me as we look at the questions both raised and answered by the Constitution and those that interpret it!

By the end of this course, you should be able to:

- Describe the individual liberties protected by the Constitution and account for the history and structure of their protection

- Illustrate compromises found in the Constitution by citing examples and historic background

- Articulate the importance of key cases such as Brown v. Board, Lemon v. Kurtzman, and Lochner v. New York

- Explain how the outcome of cases is often dependent upon the current cultural and political climate as well as the composition of the court by citing particular cases and important shifts in the court's jurisprudence

- Assess the relative suitability of various approaches to constitutional interpretation and analysis","Created by:  University of California, Irvine","['Taught by:\xa0\xa0Erwin Chemerinsky, Dean and Distinguished Professor of Law, and Raymond Pryke Professor of First Amendment Law']",Rated 5 out of 5 of 29 ratings,See all 12 reviews,2018-05-30,"['Home', 'Social Sciences', 'Law']",Chemerinsky on Constitutional Law – Individual Rights and Liberties,https://www.coursera.org/learn/chemerinsky-individual-rights
,4-6 hours/week,,Pass all graded assignments to complete the course.,"English, Subtitles: Russian",,4.4 starsAverage User Rating 4.4See what learners said,"About this course: This course explores the brain bases of bilingualism by discussing literature relevant to differences in age of initial learning, proficiency, and control in the nonverbal, single language and dual-language literature.  Participants will learn about the latest research related to how humans learn one or two languages and other cognitive skills.",Created by:  University of Houston System,"['Taught by:\xa0\xa0Arturo E.  Hernandez, Professor']",Rated 4.4 out of 5 of 123 ratings,See all 26 reviews,2018-05-30,"['Home', 'Social Sciences', 'Psychology']",The Bilingual Brain,https://www.coursera.org/learn/bilingual
Course 5 of 7 in the Survey Data Collection and Analytics  Specialization ,"4 weeks of study, 1-2 hours/week",,Pass all graded assignments to complete the course.,English,,3.8 starsAverage User Rating 3.8See what learners said,"About this course: This course will cover the steps used in weighting sample surveys, including methods for adjusting for nonresponse and using data external to the survey for calibration.  Among the techniques discussed are adjustments using estimated response propensities, poststratification, raking, and general regression estimation.  Alternative techniques for imputing values for missing items will be discussed.  For both weighting and imputation, the capabilities of different statistical software packages will be covered, including R®, Stata®, and SAS®.","Created by:  University of Maryland, College Park","['Taught by:\xa0\xa0Richard Valliant, Ph.D., Research Professor']",Rated 3.8 out of 5 of 63 ratings,See all 13 reviews,2018-05-30,"['Home', 'Data Science', 'Data Analysis']",Dealing With Missing Data,https://www.coursera.org/learn/missing-data
Course 3 of 3 in the Social Entrepreneurship Specialization ,,,Pass all graded assignments to complete the course.,English,Beginner,4.6 starsAverage User Rating 4.6See what learners said,"About this course: In Course 3 of this Specialization you will first of all learn about  Social Impact Assessment. Hence you will be able to develop a method to evaluate the social mission that you achieve while implementing your business plan. Next you will outline an appropriate communication strategy for your social enterprise and will demonstrate how to market your products and services to beneficiaries and other customers. Here you will employ an adaptable communication strategy as you move from early adopters to a broader market share. 

Furthermore you will determine growth strategies and how you can scale or replicate your business plan internationally in order to reach a larger number of beneficiaries. In particular you will discuss organic growth, social franchising, and an open source approach. Finally, you will evaluate exit strategies. Thus you will review options social enterprises have when they need to finance their growth but the original funders can not or do not want to finance the expansion. 

Course 3 will be completed by your Capstone project, which will ask you to submit the final business plan of your social venture.

Note: It is highly recommended to have completed Course 1 & 2 of the Social Entrepreneurship Specialization before starting this Course!",Created by:  Copenhagen Business School,['Taught by:\xa0\xa0Kai  Hockerts'],Rated 4.6 out of 5 of 18 ratings,See all 2 reviews,2018-05-30,"['Home', 'Business', 'Entrepreneurship']",Unleashing the Impact of your Social Enterprise,https://www.coursera.org/learn/social-impact-growth
,7 weeks of content (+ 1 week of revision and exam) and 4-5 hours/week,,Pass all graded assignments to complete the course.,"English, Subtitles: French, Chinese (Simplified)",Intermediate,4.8 starsAverage User Rating 4.8See what learners said,"About this course: The University of Geneva, Institute Pasteur, University of Montreal and Centre Virchow-Villermé/University Paris Descartes welcome you to this MOOC on ""Global Health at the Human-Animal-Ecosystem Interface""!

Over the next 7 weeks, you will explore and learn about some of the major and current Global Health Challenges at the Human-Animal-Ecosystem Interface: zoonotic emerging infections (e.g. Ebola, Nipah, MERS, Avian Influenza), antimicrobial resistance, neglected tropical diseases (e.g. rabies, leishmaniasis, zoonotic TB), snakebite and other human-animal conflicts etc. You will learn new concepts from the field of epidemiology, social anthropology, disease ecology, veterinary sciences, global health policy etc. and approaches such as One Health, Eco-Health and Planetary Health. Also, you will learn about innovative tools and frameworks used to study and tackle some of these Global Health challenges of the Sustainable Development Goals era.
 
This MOOC proposes you a dynamic, international and interdisciplinary programme based on the One Heath approach (human-animal-environmental dimensions) and involving more than 30 top experts from more than 20 academic and research institutions and international organisations based in Geneva, Paris, Montreal and the world. Policy makers from the World Health Organisation, clinicians from the University Hospitals of Geneva, epidemiologists from Institut Pasteur etc. will share with you their knowledge and experiences all along this MOOC. Video-lectures have been filmed in different parts of the world and settings (from the field to the lab and office) and will be combined with the latest open readings and interactive activities in the discussion forum, video-conferences etc.

This MOOC keeps evolving and enriching actively over time and two new sections on ""Health Benefits at the Human-Animal-Ecosystem Interface"" and ""Management of Ecosystems under Global Changes: Implication for Human Health"" have been added in May 2018. This latter section was developed in close collaboration with experts from World Health Organisation and the Convention on Biological Diversity and is introduced by Dr. Tedros Adhanom Ghebreyesus, WHO Director-General. 

The development of this MOOC was led by Dr. Rafael Ruiz de Castañeda, Dr. Isabelle Bolon and Prof. Antoine Flahault from the Institute of Global Health of the University of Geneva. The list of instructors is completed by Prof. Arnaud Fontanet (Institut Pasteur) and Prof. André Ravel (Faculty of Veterinary Medicine, University of Montreal). 

Watch our teaser here and let’s get started!
https://youtu.be/WT7-cC21uLU?list=PLnZ     (with subtitles in French and in Chinese)",Created by:  University of Geneva,"['Taught by:\xa0\xa0Rafael Ruiz De Castañeda, Institute of Global Health - Faculty of Medicine', 'Taught by:\xa0\xa0Isabelle Bolon, Institute of Global Health - Faculty of Medicine', 'Taught by:\xa0\xa0Antoine Flahault, Professor of Public Health and Director of the Institute of Global Health (Faculty of Medicine, University of Geneva)  and co-Director of Centre Virchow-Villermé (Université Paris Descartes)', 'Taught by:\xa0\xa0Arnaud Fontanet (in Partnership with UNIGE), Director Center for Global Health – Head of Emerging Diseases Epidemiology Unit', 'Taught by:\xa0\xa0André Ravel (in Partnership with UNIGE), Faculté de médecine vétérinaire ']",Rated 4.8 out of 5 of 66 ratings,See all 28 reviews,2018-05-30,"['Home', 'Life Sciences', 'Medicine and Healthcare']",Global Health at the Human-Animal-Ecosystem Interface,https://www.coursera.org/learn/global-health-human-animal-ecosystem
,"6 weeks of study, 2-3 hours/week",,Pass all graded assignments to complete the course.,English,Beginner,4.8 starsAverage User Rating 4.8See what learners said,"About this course: Steel, ever-evolving material, has been the most preeminent of all materials since it can provide wide range of properties that can meet ever-changing requirements. In this course, we explore both fundamental and technical issues related to steels, including iron and steelmaking, microstructure and phase transformation, and their properties and applications.",Created by:  Pohang University of Science and Technology,"['Taught by:\xa0\xa0Kim, Nack Joon, Professor', 'Taught by:\xa0\xa0Suh, Dong Woo, Associate Professor', 'Taught by:\xa0\xa0Kang, Youn-Bae, Professor', 'Taught by:\xa0\xa0Sung-Mo Jung , Professor', 'Taught by:\xa0\xa0Kim, Sung-Joon, Professor']",Rated 4.8 out of 5 of 12 ratings,See all 3 reviews,2018-05-30,"['Home', 'Physical Science and Engineering', 'Electrical Engineering']",Ferrous Technology I,https://www.coursera.org/learn/ferrous-technology-1
,"7 weeks of study, 2-4 hours/week",,Pass all graded assignments to complete the course.,English,Advanced,4.9 starsAverage User Rating 4.9See what learners said,"About this course: An updated version of this course will be available in spring of 2018. 

Thoracic malignancies are major, global health problems.  Lung cancer is the most common cancer and cause of cancer death in the world, with more than 1.5 million deaths per year.  More Americans will die from lung cancer each year (approximately 159,480) than from colon, breast, pancreatic, and prostate cancer combined (approximately 158,630), the next most common causes of cancer death.  Esophageal cancer is the 6th most common cause of cancer deaths worldwide, and the 4th most common cause in developing nations.

This course will provide a comprehensive, multidisciplinary introduction to state of the art approaches in the care of patients with thoracic malignancies, including various types of lung cancers and esophageal cancers.  Didactic material will cover epidemiology, screening and diagnosis, staging, imaging, radiation therapy, systemic therapy, surgery, psychiatry, and patient support topics.  

This is an on-demand course with integrated learning units that are focused on specific topics.  Each unit contains several video lectures with interactive questions and is followed by a short quiz.

Prerequisites: None required although basic medical training in some field related to thoracic oncology would be helpful.",Created by:  University of Michigan,"['Taught by:\xa0\xa0Dr. Leslie Eisenbud Quint, Course Co-director, Professor of Radiology and Professor of Surgery, Section of Thoracic Surgery', 'Taught by:\xa0\xa0Dr. Rishindra Reddy, Course Co-director, Assistant Professor of Surgery, Section of Thoracic Surgery', 'Taught by:\xa0\xa0Thoracic Oncology team at the University of Michigan']",Rated 4.9 out of 5 of 88 ratings,See all 21 reviews,2018-05-30,"['Home', 'Life Sciences', 'Medicine and Healthcare']",Thoracic Oncology,https://www.coursera.org/learn/thoracic-oncology
,"6 weeks of study, 10-15 hours/week",,Pass all graded assignments to complete the course.,English,,4.7 starsAverage User Rating 4.7See what learners said,"About this course: This six-week course titled Doing Business in Europe is the second in a series of three exploring some of the main business aspects of European Union law. Besides providing learners with a sound knowledge base of European laws and regulations relevant to establishing and managing a company within the European Union, the course also explores business considerations within a broader perspective by including inputs from leading law practitioners in the field. More specifically, the course discusses strategic and financial considerations within Company law, as well as Labour law issues such as restructuring enterprises, working conditions and handling crises situations. The course also examines other legal areas such as Tax law, Environmental law and Private International law, and how they tie in to doing business in Europe.

At the end of this course, you will have a basic understanding of how to:

· Understand the relevant regulations governing the internal European Union market

· Establish and run a company within the European Union

· Employ staff and recognize workers’ rights and obligations

· Comply with tax regulations and environmental standards

· Set up agreements and resolve cross-border disputes

· Successfully analyse EU case law and draft case reports


About the Series

The Lund series in European Business Law ranges from considering the basic structures and principles of the European Union to focusing on specialized areas of European Union law. The first course, Understanding the Fundamentals, examines the core structures and principles of the European Union. The third and final course, Competing in Europe, goes into depth concerning how to compete on the internal market and protect your brand, product or invention. All three courses can be taken independently or in sequence depending on your needs and preferences.

To keep up to speed on the course series, visit our Facebook page at:

https://www.facebook.com/eblmooc/


Syllabus and Format

Each course consists of a number of modules where one module represents about one week of work. A module includes a number of lectures and readings, and finishes with an assessment – a quiz or a peer graded assignment. The assessments are intended to encourage learning and ensure that you understand the material of the course. Participating in forum discussions is voluntary. 

Course I - Understanding the Fundamentals

Module 1.	Introduction 
Module 2.	Legal Method and Sources 
Module 3.	Constitutional Freedoms and Fundamental principles 
Module 4.	Freedom of Movement 
Module 5.	The External Dimension 

Course II - Doing Business in Europe 

Module 1. 	Making Business Transactions
Module 2. 	Establishing a Company
Module 3. 	Employing and Working in Europe
Module 4. 	Paying Taxes and Complying with Environmental Standards 
Module 5. 	Case Clinic
Module 6. 	Resolving Cross-border Disputes 

Course III - Competing in Europe

Module 1. 	Trademarks as essential Assets
Module 2. 	Defending Patents 
Module 3. 	Competition: Illegal Agreements 
Module 4. 	Competition: Abuse of Dominance and Mergers 
Module 5. 	Legal Writing and Argumentation
Module 6. 	Selling to the State and State Aid 


Lund University

Lund University was founded in 1666 and has for a number of years been ranked among the world’s top 100 universities. The University has 47 700 students and 7 500 staff based in Lund, Sweden. Lund University unites tradition with a modern, dynamic, and highly international profile. With eight different faculties and numerous research centers and specialized institutes, Lund is the strongest research university in Sweden and one of Scandinavia's largest institutions for education and research. The university annually attracts a large number of international students and offers a wide range of courses and programmes taught in English. 

The Faulty of Law is one of Lund University’s four original faculties, dating back to 1666. It is a modern faculty with an international profile, welcoming both international and Swedish students. Education, research and interaction with the surrounding community are the main focus of the Faculty’s work. The connection between the three is particularly apparent in the programmes and courses offered by the university, including the university’s MOOC course in European Business Law. The students get the chance to engross themselves in traditional legal studies, while interacting with both researchers and professionally active lawyers with qualifications and experience from various areas of law.
The faculty offers three international Masters: two 2-year Master’s programmes in International Human Rights Law and European Business Law, and a 1-year Master’s in European and International Tax Law. Students from around 40 countries take part in the programmes which offer a unique subject specialization within each field, with highly qualified researchers and professional legal practitioners engaged in the teaching. 

The Master’s programme in European Business Law provides an in-depth understanding of both the practical and the theoretical aspects of business law within the European Union. The programme provides both general and specific knowledge of the European Union legal framework, which is necessary for students intending to work as legal advisors or business decision-makers. The programme is delivered in English and is open to students with at least a three year degree in Law (Bachelor, LL.B, or equivalent) who want to specialise in European economic and business law.
The MOOC course in European Business Law is a great course to start with for students intending to apply for the Master’s programme in European Business Law. Even though the MOOC course does not grant credits previous knowledge of the subject is considered upon admission to the master’s programme. For more information about the Master’s programme in European Business Law see https://www.law.lu.se/#!meb",Created by:  Lund University,"['Taught by:\xa0\xa0Julian Nowag, Senior Lecturer', 'Taught by:\xa0\xa0Hans Henrik Lidgard, Senior Professor ', 'Taught by:\xa0\xa0Xavier Groussot, Pro Dean and Professor', 'Taught by:\xa0\xa0Mia Rönnmar , Dean and Professor', 'Taught by:\xa0\xa0Cécile Brokelind, Professor', 'Taught by:\xa0\xa0Sanja Bogojevic, Associate Professor', 'Taught by:\xa0\xa0Michael Bogdan, Senior Professor', 'Taught by:\xa0\xa0Niklas Arvidsson']",Rated 4.7 out of 5 of 177 ratings,See all 30 reviews,2018-05-30,"['Home', 'Business', 'Business Essentials']",European Business Law: Doing Business in Europe,https://www.coursera.org/learn/eu-law-doing-business
,,,Pass all graded assignments to complete the course.,English,Beginner,4.6 starsAverage User Rating 4.6See what learners said,"About this course: The central question of this course: “why study wood?” If “why study wood” is the question, one answer would be that it is the only raw material available to us that is truly renewable in human life span terms. Wood is as important to society today as it ever was, despite the development of many man-made substitute materials, changing resource availability, and the changing needs of society.  Some items on the list of wood products stay the same (lumber, plywood and veneer for building construction, furniture, shipping pallets & crates and other containers & packaging materials, railroad ties, utility poles, chemical feed stocks, etc), but the list also keeps changing to meet new needs and challenges as the resource changes.

In short, wood is a far more diverse, green, and renewable resource than you might have imagined. Join us to learn about the important role of wood in human history, civilization, and our future.

By the end of the course, learners will be able to:
- describe wood as a raw material and its critical importance to the world economy, and the lives of the people that make that economy work.  
- identify the projected trend for wood consumption to continue to grow in the coming years, despite the image of wood as a ""low tech"" material.  
- identify the ways in which wood's properties can lead to its efficient and sustainable use.
-identify wood's positive role in boosting the world economy and ability to lead to unexpected vocations.",Created by:  West Virginia University,"['Taught by:\xa0\xa0Lawrence Osborn, Research Associate', 'Taught by:\xa0\xa0Jeffrey Slahor, Research Instructor']",Rated 4.6 out of 5 of 74 ratings,See all 23 reviews,2018-05-30,"['Home', 'Physical Science and Engineering', 'Environmental Science and Sustainability']",Wood Science: Beyond Building,https://www.coursera.org/learn/wood-science
