Basic Info,Commitment,Hardware Req,How To Pass,Language,Level,User Ratings,description,institutions,instructors,ratings,reviews,scrape_date,subjects,title,url
Course 2 of 4 in the Strategic Business Analytics Specialization ,,,Pass all graded assignments to complete the course.,English,,4.5 starsAverage User Rating 4.5See what learners said,"About this course: Who is this course for?  
This course is designed for students, business analysts, and data scientists who want to apply statistical knowledge and techniques to business contexts. For example, it may be suited to experienced statisticians, analysts, engineers who want to move more into a business role, in particular in marketing.

You will find this course exciting and rewarding if you already have a background in statistics, can use R or another programming language and are familiar with databases and data analysis techniques such as regression, classification, and clustering.
However, it contains a number of recitals and R Studio tutorials which will consolidate your competences, enable you to play more freely with data and explore new features and statistical functions in R.

Business Analytics, Big Data and Data Science are very hot topics today, and for good reasons. Companies are sitting on a treasure trove of data, but usually lack the skills and people to analyze and exploit that data efficiently. Those companies who develop the skills and hire the right people to analyze and exploit that data will have a clear competitive advantage.

It's especially true in one domain: marketing. About 90% of the data collected by companies today are related to customer actions and marketing activities.The domain of Marketing Analytics is absolutely huge, and may cover fancy topics such as text mining, social network analysis, sentiment analysis, real-time bidding, online campaign optimization, and so on.

But at the heart of marketing lie a few basic questions that often remain unanswered: (1) who are my customers, (2) which customers should I target and spend most of my marketing budget on, and (3) what's the future value of my customers so I can concentrate on those who will be worth the most to the company in the future.

That's exactly what this course will cover: segmentation is all about understanding your customers, scorings models are about targeting the right ones, and customer lifetime value is about anticipating their future value. These are the foundations of Marketing Analytics. And that's what you'll learn to do in this course.",Created by:  ESSEC Business School,"['Taught by:\xa0\xa0Arnaud De Bruyn, Professor at ESSEC Business School']",Rated 4.5 out of 5 of 361 ratings,See all 102 reviews,2018-05-30,"['Home', 'Business', 'Marketing']",Foundations of marketing analytics,https://www.coursera.org/learn/foundations-marketing-analytics
Course 5 of 5 in the Advanced Business Analytics Specialization ,,,Pass all graded assignments to complete the course.,"English, Subtitles: Korean",,4.3 starsAverage User Rating 4.3See what learners said,"About this course: The analytics process is a collection of interrelated activities that lead to better decisions and to a higher business performance. The capstone of this specialization is designed with the goal of allowing you to experience this process. The capstone project will take you from data to analysis and models, and ultimately to presentation of insights. 

In this capstone project, you will analyze the data on financial loans to help with the investment decisions of an investment company. You will go through all typical steps of a data analytics project, including data understanding and cleanup, data analysis, and presentation of analytical results. 
For the first week, the goal is to understand the data and prepare the data for analysis. As we discussed  in this specialization, data preprocessing and cleanup is often the first step in data analytics projects. Needless to say, this step is crucial for the success of this project.  

In the second week, you will perform some predictive analytics tasks, including classifying loans and predicting losses from defaulted loans. You will try a variety of tools and techniques  this week, as the predictive accuracy of different tools can vary quite a bit. It is rarely the case that the default model produced by ASP is the best model possible. Therefore, it is important for you to tune the different models in order to improve the performance.

Beginning in the third week, we turn our attention to prescriptive analytics, where you will provide some concrete suggestions on how to allocate investment funds using analytics tools, including clustering and simulation based optimization. You will see that allocating funds wisely is crucial for the financial return of the investment portfolio.

In the last week, you are expected to present your analytics results to your clients. Since you will obtain many results in your project, it is important for you to judiciously choose what to include in your presentation. You are also expected to follow the principles we covered in the courses in preparing your presentation.",Created by:  University of Colorado Boulder,"['Taught by:\xa0\xa0Manuel Laguna, Professor', 'Taught by:\xa0\xa0Dan Zhang, Professor', 'Taught by:\xa0\xa0David Torgerson, Instructor']",Rated 4.3 out of 5 of 11 ratings,,2018-05-30,"['Home', 'Data Science', 'Data Analysis']",Advanced Business Analytics Capstone,https://www.coursera.org/learn/data-analytics-business-capstone
"Course 2 of 4 in the Effective Communication: Writing, Design, and Presentation Specialization ",,"You'll need some presentation software, such as Microsoft PowerPoint or Apple's Keynote. ",Pass all graded assignments to complete the course.,"English, Subtitles: Italian",Beginner,4.7 starsAverage User Rating 4.7See what learners said,"About this course: Visual communication is as critical to professional success as written or oral communication. Graphic design skills will help you ensure that your visual business assets convey a clear and compelling message - and learning the essentials of good design is surprisingly easy.

This course introduces you to a straightforward design process that emphasizes planning, clarity, and focus. You’ll learn to use contrast, repetition, proximity, and tension to create design that is both credible and visually appealing, and you’ll emulate best practices as you work with examples from a wide range of media. When you complete the course, you’ll have the skills you need to design clear and compelling presentation slides, professional reports, business websites, and more.

All of the course assignments can be completed with basic presentation software such as Microsoft PowerPoint or Apple Keynote. You’ll have opportunities to work with and explore more sophisticated tools, such as Adobe Photoshop, Illustrator, and InDesign, as well.",Created by:  University of Colorado Boulder,"['Taught by:\xa0\xa0David Underwood, Design and Media Teaching Consultant']",Rated 4.7 out of 5 of 318 ratings,See all 90 reviews,2018-05-30,"['Home', 'Business', 'Business Essentials']",Graphic Design,https://www.coursera.org/learn/presentation-design
Course 6 of 6 in the Responsive Website Development and Design Specialization ,"6 weeks, 3-5 hours/week",,Pass all graded assignments to complete the course.,English,,4.8 starsAverage User Rating 4.8See what learners said,"About this course: For your Responsive Website Development and Design Specialization Capstone Project, you will create a complete, responsive, multi-user, data-driven website which aims to solve a particular problem. We encourage you to create a website addressing a problem that you are interested in!  However, if you don’t have an idea of your own, we have several that we will suggest in the course.  

In the capstone project, you will:
1. Develop a complete website using the full range of skills learned during the specialisation
2. Work through a structured process from idea generation to product delivery
3. Document and receive feedback on the development of your project from an idea to a fully functional piece of software in a series of structured assignments including peer interactions

Participation in or completion of this online course will not confer academic credit for University of London programmes","Created by:  University of London, Goldsmiths, University of London","['Taught by:\xa0\xa0Dr Matthew Yee-King, Lecturer', 'Taught by:\xa0\xa0Dr James Ohene-Djan, Senior Lecturer and Assistant Pro Warden']",Rated 4.8 out of 5 of 36 ratings,See all 8 reviews,2018-05-30,"['Home', 'Computer Science', 'Mobile and Web Development']",Responsive Website Development and Design Capstone ,https://www.coursera.org/learn/responsive-web-design-capstone
,,,Pass all graded assignments to complete the course.,English,,,"About this course: Ever wondered why some things become popular, and other don't? Why some products becomes hits while others flop?  Why some ideas take off while others languish? What are the key ideas behind viral marketing? This course explains how things catch on and helps you apply these ideas to be more effective at marketing your ideas, brands, or products. You'll learn how to make ideas stick, how to increase your influence, how to generate more word of mouth, and how to use the power of social networks to spread information and influence. Drawing on principles from his best-selling book, ""Contagious: Why Things Catch On,"" Professor Jonah Berger illustrates successful strategies for you to use buzz to create virality so that your campaigns become more shareable on social media and elsewhere. By the end of this course, you'll have a better understanding of how to craft contagious content, build stickier messages, and get  any product, idea, or behavior to catch on.",Created by:  University of Pennsylvania,"['Taught by:\xa0\xa0Jonah Berger, Associate Professor of Marketing']",,,2018-05-30,"['Home', 'Business', 'Marketing']",Viral Marketing and How to Craft Contagious Content,https://www.coursera.org/learn/wharton-contagious-viral-marketing
,,,Pass all graded assignments to complete the course.,English,Beginner,5.0 starsAverage User Rating 5.0See what learners said,"About this course: This course is the first in the Customer Insights and New Product Development (CIPD) specialization. It will introduce learners to the tools and process of gathering customer insights for identifying and developing new product opportunities. Through an integrated set of five modules and hands-on project experiences, learners will acquire the knowledge and skills to turn their ideas gained from understanding customer needs into innovative new products.",Created by:  University of Illinois at Urbana-Champaign,"['Taught by:\xa0\xa0William Qualls, Professor Emeritus of Marketing']",Rated 5 out of 5 of 2 ratings,See all reviews,2018-05-30,"['Home', 'Business', 'Marketing']",Customer Insights: New Product Development Orientation,https://www.coursera.org/learn/customer-insights-orientation
,"6 weeks of study, 4-7 hours/week",,Pass all graded assignments to complete the course.,"English, Subtitles: Spanish, Romanian",,4.7 starsAverage User Rating 4.7See what learners said,"About this course: With its walls razed to ground by Babylon’s armies, Jerusalem joined a long line of ancient vanquished cities—from Ur and Nineveh and Persepolis to Babylon itself. While some recovered from the destruction, others did not.  But none responded to political catastrophe by fashioning the kind of elaborate and enduring monument to their own downfall that we find in the Bible. Most conquered populations viewed their subjugation as a source of shame. They consigned it to oblivion, opting instead to extol the golden ages of the past.  The biblical authors in contrast reacted to loss by composing extensive writings that acknowledge collective failure, reflect deeply upon its causes, and discover thereby a ground for collective hope.  
 
Working through colorful biblical and ancient Near Eastern texts, and drawing on an array of comparative examples, the course illustrates the thoroughgoing manner with which biblical authors responded to defeat by advancing a demotic agenda that places the community at the center. The aim of the biblical authors was to create a nation, and they sought to realize this goal via a shared text, which includes stories and songs, wisdom and laws. This corpus of writings belongs, without a doubt, to humanity’s greatest achievements. Whereas the great civilizations of the Near East invested their energies and resources into monuments of stone that could be destroyed by invading armies, the biblical authors left a literary legacy that has been intensively studied until the present day. More important, these authors’ visionary response to defeat brought to light a radical new wisdom:  the notion that a people is greater than the state which governs it, and that a community can survive collapse when all of its members can claim a piece of the pie and therefore have a reason to take an active part in its collective life.",Created by:  Emory University,"['Taught by:\xa0\xa0Dr. Jacob L. Wright, Associate Professor of Hebrew Bible']",Rated 4.7 out of 5 of 119 ratings,See all 34 reviews,2018-05-30,"['Home', 'Arts and Humanities', 'History']","The Bible's Prehistory, Purpose, and Political Future",https://www.coursera.org/learn/bible-history
,,,Pass all graded assignments to complete the course.,English,,4.8 starsAverage User Rating 4.8See what learners said,"About this course: Urban school reform in the United States is characterized by contentious, politicized debate. This course explores a set of critical issues in the education and educational reform space, with a focus on aspects of the field that have sparked controversy and polarized views. We will dig into these debates, situating them within the larger history of public education and school reform, and considering the viewpoints, the evidence, and translation of issues into educational policy. 
 
We will consider three broad topics in this course:
1.  Federal Strategies in School Reform: How has the federal government legislated and incented public school reform? 
2.  School Choice: How does school choice aim to improve schools? 
3.  Accountability: What is the history of accountability in American public schooling? What are the policies and practices associated with accountability? 

Learning Goals
This course will enable participants to:
1. develop an informed historical perspective about public schooling in the United States;
2. understand the unique contextual elements of the American approach to public schooling;
3. analyze and assess divergent viewpoints about American public school history and school reform policy.

Teachers may be able to receive continuing education credit for successful completion of this course. To earn continuing education credits students must purchase and earn the Course Certificate, which they can then submit to the credit-issuing agency in their state.  Students should also fill out the requisite paperwork stating that the affiliated provider is the Graham School at the University of Chicago, and that average time for certificate-level course completion is 18 hours. Students outside of Illinois should contact their state’s accreditation board to determine whether this course is eligible for continuing education credit. Note that it is up to the schools or districts that employ teachers to decide whether this course meet their requirements.",Created by:  The University of Chicago,"['Taught by:\xa0\xa0Sara Ray Stoelinga, Sara Liston Spurlark Director and Clinical Professor']",Rated 4.8 out of 5 of 35 ratings,See all 10 reviews,2018-05-30,"['Home', 'Social Sciences', 'Education']",Critical Issues in Urban Education,https://www.coursera.org/learn/urban-education
,12 hours of lectures and assignments,,Pass all graded assignments to complete the course.,English,,4.6 starsAverage User Rating 4.6See what learners said,"About this course: In this course students learn the basic concepts of acoustics and electronics and how they can applied to understand musical sound and make music with electronic instruments.  Topics include: sound waves, musical sound, basic electronics, and applications of these basic principles in amplifiers and speaker design.",Created by:  University of Rochester,"['Taught by:\xa0\xa0Robert  Clark, Provost and Senior Vice President for Research and Professor', 'Taught by:\xa0\xa0Mark  Bocko, Distinguished Professor and Chair']",Rated 4.6 out of 5 of 269 ratings,See all 73 reviews,2018-05-30,"['Home', 'Physical Science and Engineering', 'Electrical Engineering']",Fundamentals of Audio and Music Engineering: Part 1 Musical Sound & Electronics,https://www.coursera.org/learn/audio-engineering
Course 1 of 6 in the Search Engine Optimization (SEO) Specialization ,,,Pass all graded assignments to complete the course.,"English, Subtitles: Greek",,4.6 starsAverage User Rating 4.6See what learners said,"About this course: Ever wonder how major search engines such as Google, Bing and Yahoo rank your website within their searches? Or how content such as videos or local listings are shown and ranked based on what the search engine considers most relevant to users? Welcome to the world of Search Engine Optimization (SEO). This course is the first within the SEO Specialization and it is intended to give you a taste of SEO. 

You will be introduced to the foundational elements of how search engines work, how the SEO landscape has changed and what you can expect in the future. You discuss core SEO strategies and tactics used to drive more organic search results to a specific website or set of websites, as well as tactics to avoid to prevent penalization from search engines. You will also discover how to position yourself for a successful career in SEO should this subject prove interesting to you. We hope this taste of SEO, will entice you to continue through the Specialization.","Created by:  University of California, Davis","['Taught by:\xa0\xa0Rebekah May, SEO Manager & Lead SEO Instructor']","Rated 4.6 out of 5 of 2,037 ratings",See all 574 reviews,2018-05-30,"['Home', 'Business', 'Marketing']",Introduction to Search Engine Optimization,https://www.coursera.org/learn/search-engine-optimization
Course 3 of 6 in the How to Start Your Own Business Specialization ,"6 weeks of study, 2-4 hours/week",,Pass all graded assignments to complete the course.,English,,4.2 starsAverage User Rating 4.2See what learners said,"About this course: According to Steven Blank a business startup, or any new venture startup is essentially a proto-type. Thus the startup process essentially becomes a learning process to refine that business proto-type into a scalable, replicable finished 'product'.

At the end of this course learners will be able to:
   -complete a business model summarizing assumptions about what value they will offer to whom, and how they will make 
    money.
   - systematically test and validate these assumptions within the constraints of their available resources, and
   - use these validated assumptions to generate financial projections that are based on actual resources and efforts expended.

The days of the 40 page business plan have certainly passed, but the role of planning in the business creation process is one of extreme importance. In this course we will explore the important components that you need to explore in detail prior to business creation. Action without planning is a recipe for disaster and we will make sure you have a rock solid foundation for future actions.

The planning here is focused on learning. It is unrealistic for anyone to document in detail all of the actions they should take to make a new venture or activity successful when they (and often no one else) has any experience with the new venture and the conditions which it is likely to face. Thus the business plan based largely on assumptions and aggregate, non-applicable data is replaced with the business model which organizes the key assumptions determining what value the business will offer to whom, and how it will make money. The course will guide learners through the process of systematically testing and validating these assumptions, and obtaining specific, applicable data. It will then show learners how to use these validated assumptions to generate pro-forma financial statements directly tied to actions and resources based on this business model.",Created by:  Michigan State University,"['Taught by:\xa0\xa0Ken Szymusiak, Managing Director, Burgess Institute for Entrepreneurship & Innovation', 'Taught by:\xa0\xa0Forrest S. Carter, Associate Professor, Faculty Director of Institute of Entrepreneurship and Innovation', 'Taught by:\xa0\xa0David Wheeler, Creative Research Faculty, The Hub for Innovation']",Rated 4.2 out of 5 of 17 ratings,See all 3 reviews,2018-05-30,"['Home', 'Business', 'Entrepreneurship']","Planning: Principled, Proposing, Proofing, and Practicing to a Success Plan",https://www.coursera.org/learn/business-planning
