Basic Info,Commitment,Hardware Req,How To Pass,Language,Level,User Ratings,description,institutions,instructors,ratings,reviews,scrape_date,subjects,title,url
Course 2 of 4 in the Business English Specialization ,"6 weeks of study, 1-2 hours per week",,Pass all graded assignments to complete the course.,"English, Subtitles: Spanish",Intermediate,4.5 starsAverage User Rating 4.5See what learners said,"About this course: Do you work in finance or interact with finance professionals? Is it necessary to speak, write or understand English in your career? Follow the authentic characters in this course as they work through common business situations in finance and economics. Learn from your successes and failure, and think critically about your own communication options. After taking this course, you will be able to read and create efficient e-mails, reports, and impactful presentations with words and phrases commonly used in finance and economics. Communicate clearly under pressure utilizing recently learned strategies, and obtain immediate feedback about the efficiency of your business communication skills in English from other finance professionals around the world! Gain the English communication skills that you desire and that global managers expect.",Created by:  Arizona State University,"['Taught by:\xa0\xa0Andrea Mürau Haraway, International Educator', 'Taught by:\xa0\xa0Wanda Huber, International Educator', 'Taught by:\xa0\xa0Jenny Young, International Educator', 'Taught by:\xa0\xa0Beatriz Fuentes-Anderson, International Educator']",Rated 4.5 out of 5 of 62 ratings,See all 21 reviews,2018-05-30,"['Home', 'Language Learning', 'Learning English']",Business English: Finance and Economics,https://www.coursera.org/learn/finance-economics-english
,"5 weeks of study, 2-3 hours/week",,Pass all graded assignments to complete the course.,English,,4.5 starsAverage User Rating 4.5See what learners said,"About this course: This is the first course in a Coursera Specialization track involving Web Application Architectures.  This course will give you the basic background, terminology and fundamental concepts that you need to understand in order to build modern full stack web applications. A full stack web developer is familiar with each ""layer""  of the software technologies involved in a web application, including data modeling and database technologies, the web server environment and middleware components, network protocols, the user interface and basic visual design and user interaction concepts. 

In this course we will learn by doing.  We will start by learning the major components of web application architectures, along with the fundamental design patterns and philosophies that are used to organize them.  You will build and continually refine a fully functional full-stack web application as we progress through the modules in this course.  Along the way you will be exposed to agile software development practices, numerous tools that software engineers are expected to know how to use, and a modern web application development framework.

This course is also available in Spanish. To join the Spanish version, visit this page: https://www.coursera.org/learn/apliweb.",Created by:  University of New Mexico,"['Taught by:\xa0\xa0Greg Heileman, Professor and Associate Provost', 'Taught by:\xa0\xa0Manel Martínez-Ramón, Professor']",Rated 4.5 out of 5 of 110 ratings,See all 37 reviews,2018-05-30,"['Home', 'Computer Science', 'Mobile and Web Development']",Web Application Development: Basic Concepts,https://www.coursera.org/learn/web-app
Course 1 of 6 in the Architecting with Google Cloud Platform Specialization ,"1 week of study, 6-10 hours/week",You'll need a web browser (Google Chrome is suggested) and access to the Internet.,Pass all graded assignments to complete the course.,English,Intermediate,4.6 starsAverage User Rating 4.6See what learners said,"About this course: <<< ATTENTION >>>
Learners interested in Google Cloud Platform can continue to learn in either of our latest GCP infrastructure specializations.

Option 1: The Developing Applications with Google Cloud Platform Specialization is available on Coursera. This brand-new Specialization teaches you to build secure, scalable, and intelligent cloud-native applications. Visit https://www.coursera.org/specializations/developing-apps-gcp for more details.

Option 2: The Architecting with Google Cloud Platform Specialization is also available. This Specialization has updated, improved content  that will help you if you are preparing for the Google Certified Professional - Cloud Architect exam. Head to https://www.coursera.org/specializations/gcp-architecture to explore the updated content.

Google Cloud Platform Fundamentals: Core Infrastructure covers the fundamentals of Google Cloud Platform and is the first course in both specializations. 

This course introduces you to important concepts and terminology for working with Google Cloud Platform (GCP). You learn about, and compare, many of the computing and storage services available in Google Cloud Platform, including Google App Engine, Google Compute Engine, and Google Container Engine.

Notes:
• You'll need a Google/Gmail account and a credit card or bank account to sign up for the Google Cloud Platform free trial (Google services are currently unavailable in China).
• If you are a Google Cloud Platform customer with European Union (EU) and Russian billing addresses, read the VAT Overview documentation at: https://cloud.google.com/billing/docs/resources/vat-overview
• More Google Cloud Platform free trial FAQs are available at: https://cloud.google.com/free-trial/",Created by:  Google Cloud,,"Rated 4.6 out of 5 of 3,490 ratings",See all 713 reviews,2018-05-30,"['Home', 'Information Technology', 'Cloud Computing']",Google Cloud Platform Fundamentals: Core Infrastructure,https://www.coursera.org/learn/gcp-fundamentals
,"5 weeks of study, 1-3 hours/week",,Pass all graded assignments to complete the course.,"English, Subtitles: Arabic, Hebrew",,4.6 starsAverage User Rating 4.6See what learners said,"About this course: If you really care about the big questions in the economies and societies of the 21st century, such as distributive justice - namely, inequality of income or wealth, and its correlation with economic growth - this course is meant for you. The knowledge you will gain can truly change your outlook on our world.

""Economic Growth and Distributive Justice -  Maximizing Social Wellbeing"" is the second part of a two part course and it includes the following five lectures: 
(1) The excess burden of taxation
(2) Tax incidence: who bears the economic burden of tax?
(3) Progressivity: definition and ways to achieve
(4) Low Income, Low Ability and the Optimal Income Tax Model
(5) Designing the Tax and Transfer System that Maximizes Social Wellbeing
If you haven't done that already, we strongly recommend that you register for the first part of the course: ""Economic Growth and Distributive Justice - the Role of the State"". Taking both parts of the course would enable you to obtain a fuller and more comprehensive knowledge about Economic Growth and Distributed Justice.

The course is founded upon the elemental idea that the role of the state is to maximize the well-being - or simply the happiness - of its residents. In 9 fascinating, edifying lessons, using only simple words and decoding professional terminologies that sometimes baffle the intelligent layman, the course expounds many truths – both intuitive and unintuitive. Often using examples from the US and Europe, it does not however focus on policies in any particular region of the world, and is directly applicable to all countries around the globe.

The course touches upon the essence of important concepts like efficiency and equity, inequality and poverty, gross domestic product, tax evasion and tax planning; it presents the work of Nobel Laureate James Mirrlees and his followers - promoting a coherent system that integrates tax and government expenditures to maximize social welfare; and illuminates a range of high-profile issues from their economic angle:
• Climate change: the atmosphere and oceans as public goods, and how smart (Pigovian) taxation can be used to combat the rapidly increasing threats to our planet;
• Technology as the engine of economic growth;
• Taxing the rich: How can we mitigate the growing inequality problem? Should we   impose a global tax on capital?

The curriculum includes interviews with major figures in the fields of law and of economics:  Harvard's Elhanan Helpman, Dan Shaviro from NYU and Richard Epstein from the University of Chicago and NYU.

After successfully completing this course, you can expect to be able to:
• better understand economic issues presented in the media
• form an informed opinion on the strengths and weaknesses of presented social economic policies
• define and measure inequality and poverty
• define the connection between inequality (income, wealth) and economic growth
• explain the foundations of economic growth
• design a tax and transfer system to maximize the happiness of individuals

All these will allow you to better understand the policies being developed around you, and to play a larger, more informed role in their development, as a conscientious citizen.


In order to receive academic credit for this course you must successfully pass the academic exam on campus. For information on how to register for the academic exam – https://tauonline.tau.ac.il/registration

Additionally, you can apply to certain degrees using the grades you received on the courses. Read more on this here – 
https://go.tau.ac.il/b.a/mooc-acceptance

Teachers interested in teaching this course in their class rooms are invited to explore our Academic High school program here – https://tauonline.tau.ac.il/online-highschool",Created by:  Tel Aviv University,"['Taught by:\xa0\xa0Professor Yoram  Y. Margalioth, Professor']",Rated 4.6 out of 5 of 52 ratings,See all 11 reviews,2018-05-30,"['Home', 'Social Sciences', 'Law']",Economic Growth and Distributive Justice Part II - Maximize Social Wellbeing,https://www.coursera.org/learn/economic-growth-part-2
"Course 3 of 4 in the Creatividad, diseño e innovación: Técnicas y herramientas Specialization ","6 semanas de estudio, 1-3 horas/semana",,Pass all graded assignments to complete the course.,"Spanish, Subtitles: English",,4.7 starsAverage User Rating 4.7See what learners said,"About this course: ¿Qué es el diseño? ¿Qué hacen los diseñadores para practicar su arte y que crean? ¿Qué importancia tiene el diseño de las corporaciones en la sociedad y la cultura? ¿Quiénes son algunos de los diseñadores más importantes de nuestra época y que han hecho? ¿Cómo uno puede convertirse en diseñador? Estas son algunas de las preguntas que exploraremos en este cuso introductorio de diseño. Con frecuencia se ha descrito el diseño como solución de problemas, el proceso de convertir las ideas en realidad o los medios, mediante los cuales podemos hacer que el mundo sea un lugar mejor. En este curso, hablaremos de una variedad de definiciones de diseño, la naturaleza del proceso de diseño y formas de práctica de diseño como el diseño de productos, diseño de experiencia de usuario, diseño gráfico, diseño interior y diseño de modas. Hablaremos de estos temas mediante los análisis de casos de varias cosas icónicas y cotidianas que nos rodean. 

Este curso le ayudará a entender tales conceptos como el pensamiento creativo, estrategia de diseño, investigación de diseño, y el proceso del diseño para que  los aplique a su propio trabajo.",Created by:  Arizona State University,"['Taught by:\xa0\xa0Prasad Boradkar, Professor']",Rated 4.7 out of 5 of 174 ratings,See all 62 reviews,2018-05-30,"['Home', 'Business', 'Business Essentials']",Entender el diseño,https://www.coursera.org/learn/entender-diseno
,,,Pass all graded assignments to complete the course.,"English, Subtitles: Danish, German",Beginner,4.7 starsAverage User Rating 4.7See what learners said,"About this course: Across the world more than 420 million people are living with diabetes. Two thirds of these have not yet been diagnosed. When discovered late or managed incorrectly, diabetes can damage your heart, blood vessels, eyes, kidneys, and nerves, leading to disability and premature death. In fact, more people are dying of diabetes related diseases than of diseases as HIV/AIDS, malaria and tuberculosis combined.

This course will provide you with an introduction to the most recent research in the field of prevention and treatment of diabetes as well as a broader understanding of the situation in different communities, rich and poor, across the world, where diabetes threatens public health.
 
What kind of disease is diabetes, who has it, and who is at risk of getting it? And what are the roles of medicine, exercise and nutrition when trying to prevent, delay or treat diabetes? 

During the course you will meet researchers and experts from Imperial College London, Emory University in Atlanta, Steno Diabetes Center in Copenhagen as well as the School of Global Health and the Center for Basic Metabolic Research at the University of Copenhagen.

They work with very different aspects of diabetes, from microbiology to global public health, but what ties them together is the belief that it is a global responsibility to combat diabetes, and this fight can only be won through new knowledge and global collaboration. 

We hope you will join us in the course and equip yourself to take part in the ongoing discussions of this truly global and individual health challenge.

This course is also part of the EIT Health programme.",Created by:  University of Copenhagen,"['Taught by:\xa0\xa0Nicolai Jacob Wewer Albrechtsen, MD, GCSRT, PhD student', 'Taught by:\xa0\xa0Signe Sørensen Torekov, Associate Professor, MSc, PhD', 'Taught by:\xa0\xa0Jens Juul Holst, Professor, MD, DMSc']",Rated 4.7 out of 5 of 201 ratings,See all 45 reviews,2018-05-30,"['Home', 'Life Sciences', 'Medicine and Healthcare']",Diabetes – the Essential Facts,https://www.coursera.org/learn/diabetes-essential-facts
,,,Pass all graded assignments to complete the course.,English,,4.9 starsAverage User Rating 4.9See what learners said,"About this course: Welcome to an Introduction to Breast Cancer!  In this course, we’ll learn a bit about the leading cause of cancer in women worldwide – from the basic biology of the disease, to risk factors and prevention, to treatment modalities to survivorship.  We’ll talk to leading experts, explore some of the milestone studies that have pushed this field forward, and have interactive discussions on discussion boards and social media.  You’ll even have an opportunity to let us know what topics you want to cover on tweetchats, so we can try to make the content fit your interests.  

There is something in this course for everyone – if you’re a breast cancer survivor or the friend/family member of someone with this disease, this course will help you to better understand this disease, and give you ideas for questions you may want to ask your doctor.  Maybe you’re a healthcare provider or studying to be the same, this course is a great refresher on where the state of the science is.  If you’re a healthcare administrator wondering about how the interdisciplinary components of breast cancer care fit together, or an entrepreneur thinking about unmet needs in this space, or someone in public health interested in prevention, this course is also for you!

Are you ready to learn a lot, and have some fun while we’re at it?  If so, I hope you’ll join us!  Let’s get started!!!",Created by:  Yale University,"['Taught by:\xa0\xa0Anees B. Chagpar, MD, MSc, MPH, MA, MBA, FRCS(C), FACS, Associate Professor, Department of Surgery Director, The Breast Center -- Smilow Cancer Hospital at Yale-New Haven Assistant Director -- Global Oncology, Yale Comprehensive Cancer Center']",Rated 4.9 out of 5 of 326 ratings,See all 96 reviews,2018-05-30,"['Home', 'Life Sciences', 'Medicine and Healthcare']",Introduction to Breast Cancer,https://www.coursera.org/learn/breast-cancer-causes-prevention
,3-5 hours/week,,Pass all graded assignments to complete the course.,English,,4.6 starsAverage User Rating 4.6See what learners said,"About this course: Through art projects—including visual arts, dance, writing, and music—along with spiritual practices and guided imagery, Healing With the Arts gives you the tools to heal what you need to heal in your life: physical, mental, emotional, and spiritual.",Created by:  University of Florida,"['Taught by:\xa0\xa0Mary Rockwood Lane, PhD, RN, FAAN, Associate Professor', 'Taught by:\xa0\xa0Michael Samuels, MD']",Rated 4.6 out of 5 of 95 ratings,See all 31 reviews,2018-05-30,"['Home', 'Personal Development']",Healing with the Arts,https://www.coursera.org/learn/healing-with-the-arts
