affiliation,category,instructors,nanodegree,skill_level,skills,summary,title,url
Collaboration WithGeorgia Institute of Technology,School of Artificial Intelligence,['Thad Starner'],Artificial Intelligence,intermediate,"['Artificial Intelligence, ', 'Probability, ', 'Bayesian Networks, ', 'Logic and Planning, ', 'Machine Learning']","Learn about the fundamentals of Artificial Intelligence in this introductory graduate-level course. It provides a survey of various topics in the field along with in-depth discussion of foundational concepts such as classical search, probability, machine learning, logic and planning.",Artificial Intelligence,https://www.udacity.com/course/artificial-intelligence--ud954
,School of Development,['Richard Kalehoff'],Front-End Web Developer,intermediate,"['Object Oriented Javascript, ', 'Object-oriented programming, ', 'Data and functionality, ', 'Prototypal inheritance']","This course is designed to teach web developers how to utilize the various object-oriented programming features within JavaScript. Object-oriented programming allows developers to build applications with reusable and maintainable blocks of code, which leads to efficiency and simplified software design., With object-oriented JavaScript, you'll be able to build classes to construct objects that encapsulate both data and functionality. You'll also learn how to leverage prototypal inheritance to maintain DRY code, allowing you to pass behaviors down to objects. You'll also learn how to keep data safe and secure by creating private state with closures and immediately-invoked function expressions.",Object-Oriented JavaScript,https://www.udacity.com/course/object-oriented-javascript--ud711
Collaboration WithGeorgia Institute of Technology,School of Artificial Intelligence,"['Charles Isbell', 'Michael Littman', 'Pushkar Kolhe']",Artificial Intelligence,intermediate,"['Randomized Optimization, ', 'Clustering, ', 'Feature Selection, ', 'Feature Transformation, ', 'Information Theory']","This is the second course in the 3-course Machine Learning Series and is offered at Georgia Tech as CS7641. Taking this class here does not earn Georgia Tech credit., Ever wonder how Netflix can predict what movies you'll like? Or how Amazon knows what you want to buy before you do? The answer can be found in Unsupervised Learning!, Closely related to pattern recognition, Unsupervised Learning is about analyzing data and looking for patterns. It is an extremely powerful tool for identifying structure in data. This course focuses on how you can use Unsupervised Learning approaches -- including randomized optimization, clustering, and feature selection and transformation -- to find structure in unlabeled data. , Series Information: Machine Learning is a graduate-level series of 3 courses, covering the area of Artificial Intelligence concerned with computer programs that modify and improve their performance through experiences. , The entire series is taught as an engaging dialogue between two eminent Machine Learning professors and friends: Professor Charles Isbell (Georgia Tech) and Professor Michael Littman (Brown University).",Machine Learning: Unsupervised Learning,https://www.udacity.com/course/machine-learning-unsupervised-learning--ud741
Collaboration WithAlteryx,School of Business,['Maureen Wolfson'],Business Analyst,beginner,"['Data Issues, ', 'Data Formatting, ', 'Data Blending']","The Creating an Analytical Dataset course provides students with foundational knowledge to input, clean, blend, and format data in preparation for analysis. You will learn:
The common sources and types of data
 To identify and correct common issues with data 
To format data in useful ways for analysis
 To blend data from multiple sources together, Throughout this course you’ll also learn the techniques to apply your knowledge in a data analytics program called Alteryx. At the end of the course, you’ll complete a project based on the principles in the course.., This course is part of the Business Analyst Nanodegree.",Creating an Analytical Dataset,https://www.udacity.com/course/creating-an-analytical-dataset--ud977
,School of Development,['Richard Kalehoff'],Front-End Web Developer,intermediate,"['Asynchronous Data Retrieval, ', 'Ajax with XHR, ', 'Ajax with jQuery, ', 'Ajax with Fetch']","This course covers everything a developer needs to know to asynchronously send and receive data in their web applications. You'll dive into how asynchronous requests work by using the XHR object to create and send asynchronous requests for image and news article data. Then, you'll see how you can perform async requests more easily using third-party libraries and APIs like jQuery's Ajax and the Fetch API.",Asynchronous JavaScript Requests,https://www.udacity.com/course/asynchronous-javascript-requests--ud109
Collaboration WithGoogle,School of Development,"['Christina Hayek', 'Svein Hermansen']",Android Developer,beginner,"['Localization, ', 'Google Translator Toolkit, ', 'Localization at Google']","Localization is the art of adapting a product linguistically and culturally for international users. Although the industry has been around since the 1980s, it has become increasingly important over the past few years as more and more users are getting online and the vast majority of these users are non-English speakers., Localization Essentials will take you through the linguistic, cultural and technical aspects of launching a product globally. Whether you’re a developer, product owner, localization professional or translation student, this is where you’ll learn the basics of Localization – directly from the experts at Google., Already thousands of students around the world have taken the course since its launch and the following universities are using it in their curricula to teach students about Localization: University of Bologna, University of Trieste, University of Strasbourg, Suleyman Demirel University of Almaty., Join us, and get to know the world of Localization inside out.",Localization Essentials,https://www.udacity.com/course/localization-essentials--ud610
Collaboration WithGoogle,School of Business,"['Jay Harman', 'Carl Sziebert']",Become an iOS Developer,intermediate,"['Prototyping, ', 'User Research, ', 'inVision']","Prototyping allows you to spend ten minutes — instead of ten hours — finding an amazing design for your product.  This course will guide you through the iterative process of prototyping an app and conducting user research. You will start by making a low fidelity paper prototype, conducting research with users, and using that research to inform your next iteration. Together with InVision we’ll guide you through creating interactive prototypes. This means you don’t have to code an app before putting it in front of users! Along the way, you’ll learn how and where prototyping fits into your app design process and how you can use prototyping to become a better entrepreneur.",Rapid Prototyping,https://www.udacity.com/course/rapid-prototyping--ud723
Collaboration WithGoogle,School of Development,"['Magnus Hyttsten', 'Jocelyn Becker', 'Gundega Dekena']",Artificial Intelligence,advanced,"['Android, ', 'Java, ', 'Google App Engine, ', 'Data Storage and Retrieval']","You will learn about challenges of building applications that can serve hundreds of thousands of users, and how you can prepare for them as a developer. And more importantly - you will learn how to harness the power of App Engine - Platform as a Service, run by Google, so you can focus on your application's features, not on managing infrastructure that runs your app. Let Google run and scale the infrastructure and do what you do best - write code! , However, to use App Engine effectively, you have to learn how it works, and this is exactly what this course will teach! You will also learn the best practices of using Cloud Endpoints that allow you to easily create RESTful services and make them accessible to iOS, Android and Javascript clients. They allow you to automatically generate client libraries to make wiring up the frontend easy. And there are some nifty built-in features, like denial-of-service protection and OAuth 2.0 support.",Developing Scalable Apps in Java,https://www.udacity.com/course/developing-scalable-apps-in-java--ud859
,School of Development,['Gabrielle Miller-Messner'],Become an iOS Developer,intermediate,"['Variables and Constants, ', 'Control Flow, ', 'Functions, ', 'Optionals, ', 'OOP']","Swift is a language created by Apple specifically for iOS and OS X development. It’s fast, concise, and comes with tools  which make it easier than ever to visualize one's code. , This course focuses on the syntax of the Swift programming language. By the end of the course, students should be able to apply Swift essentials to building iOS apps and employ Swift's more unique elements, like optional types and switch statements, with confidence.",Learn Swift Programming Syntax,https://www.udacity.com/course/learn-swift-programming-syntax--ud902
Collaboration WithAT&T,School of Artificial Intelligence,"['Don Dini', 'Rishi Pravahan']",Flying Cars & Autonomous Flight,advanced,"['Questioning, ', 'Modeling, ', 'Validation, ', 'Data Analysis, ', 'QMV Process']","This course will teach you how to start from scratch in answering questions about the real world using data. Machine learning happens to be a small part of this process. The model building process involves setting up ways of collecting data, understanding and paying attention to what is important in the data to answer the questions you are asking, finding a statistical, mathematical or a simulation model to gain understanding and make predictions. , All of these things are equally important and model building is a crucial skill to acquire in every field of science. The process stays true to the scientific method, making what you learn through your models useful for gaining an understanding of whatever you are investigating as well as make predictions that hold true to test. , We will take you on a journey through building various models. This process involves asking questions, gathering and manipulating data, building models, and ultimately testing and evaluating them.",Model Building and Validation,https://www.udacity.com/course/model-building-and-validation--ud919
,School of Development,['Richard Kalehoff'],Front-End Web Developer,intermediate,,"JavaScript is an extremely powerful programming language. One place where its power truly shines is using it to control a web page. Through this course, you'll learn about the Document Object Model (DOM), how it's created, and what capabilities it provides. Then you'll use JavaScript and the DOM to add, delete, or alter page content; control page styling, and respond to user actions.",JavaScript and the DOM,https://www.udacity.com/course/javascript-and-the-dom--ud117
Collaboration WithGeorgia Institute of Technology,School of Development,"['Santosh Pande', 'Catherine Gamboa']",Flying Cars & Autonomous Flight,,"['Compilers, ', 'Semantic Analysis, ', 'Syntax Directed Translation, ', 'Control Flow Analysis']",The objective of this course is to learn the theory and practice behind building automatic translators (compilers) for higher level programming languages and to engineer and build key phases of a compiler in Java or C++ for a small language.,Compilers: Theory and Practice,https://www.udacity.com/course/compilers-theory-and-practice--ud168
Collaboration WithGoogle,,"['Karl Krueger', 'Gundega Dekena', 'Magnus Hyttsten']",Full Stack Web Developer,advanced,"['App Engine, ', 'Cloud Endpoints, ', 'API services, ', 'Client libraries']","You will learn about challenges of building applications that can serve hundreds of thousands of users, and how you can prepare for them as a developer. And more importantly - you will learn how to harness the power of App Engine - Platform as a Service, run by Google, so you can focus on your application's features, not on managing infrastructure that runs your app. Let Google run and scale the infrastructure and do what you do best - write code! , However, to use App Engine effectively, you have to learn how it works, and this is exactly what this course will teach! You will also learn the best practices of using Cloud Endpoints that allow you to easily create API services and make them accessible to iOS, Android and Javascript clients. They allow you to automatically generate client libraries to make wiring up the frontend easy. And there are some nifty built-in features, like denial-of-service protection and OAuth 2.0 support.",Developing Scalable Apps in Python,https://www.udacity.com/course/developing-scalable-apps-in-python--ud858
,School of Development,"['Jeff Hilnbrand', 'Nick Leggett', 'Gabrielle Miller-Messner']",Android Developer,intermediate,"['Android, ', 'Mobile Design, ', 'Usability']","Featuring Facebook's experts in User Research and Product Design, this course walks you through the steps to design a new mobile product that puts users first. You'll learn how to use data collected from users to guide prototyping, and conduct user testing with a production app to guide a future redesign., This course is also available for iOS",Mobile Design and Usability for Android,https://www.udacity.com/course/mobile-design-and-usability-for-android--ud358
,School of Development,"['Andreas Zeller', 'Gundega Dekena']",Machine Learning Engineer,intermediate,"['Debugging, ', 'Python, ', 'Automated Debugging']","In this class you will learn how to debug programs systematically, how to automate the debugging process and build several automated debugging tools in Python.",Software Debugging,https://www.udacity.com/course/software-debugging--cs259
Collaboration WithFacebook for Developers,School of Development,"['Gabrielle Miller-Messner', 'Sam Chordas']",Natural Language Processing,intermediate,"['Android, ', 'Passwordless Login, ', 'Account Kit']","For an app developer, providing a seamless user experience is critical for building engagement and growing a user base. Passwordless login solutions provide your users with a simple, secure, and positive first experience., In this course, you'll learn two frameworks for sign-up and authentication: Account Kit, which uses a phone number and code, and Facebook Login for Android. You’ll learn how to configure both types of authentication side by side in a sample app, test the flow on a series of common use cases, and wrap things up with an introduction to Facebook’s Graph API, a window into an incredible wealth of data for creating a more engaging experience for your users.",Passwordless Login Solutions for Android,https://www.udacity.com/course/passwordless-login-solutions-for-android--ud357
Collaboration WithAmazon Appstore for Android,School of Development,"['Peter Heinrich', 'Jeremy Silver']",Android Developer,intermediate,"['LibGDX, ', 'Game Development, ', '2D']","This course explores how to use LibGDX to build 2D games that run anywhere, from web browsers to mobile devices. We start with simple drawings, and then turn to simple animations, physics, and user input handling. Finally, we create a full game, called Icicles, where icicles rain down from the top of the screen, and the player must dodge them using the arrow keys or by tilting their phone.",2D Game Development with libGDX,https://www.udacity.com/course/2d-game-development-with-libgdx--ud405
Collaboration WithGeorgia Institute of Technology,School of Artificial Intelligence,"['Jimeng Sun', 'David Joyner']",Flying Cars & Autonomous Flight,,"['Data Analytics, ', 'Health Care Applications, ', 'Algorithms']","Data science plays an important role in many industries. In facing massive amount of heterogeneous data, scalable machine learning and data mining algorithms and systems become extremely important for data scientists. The growth of volume, complexity and speed in data drives the need for scalable data analytic algorithms and systems. In this course, we study such algorithms and systems in the context of healthcare applications., In healthcare, large amounts of heterogeneous medical data have become available in various healthcare organizations (payers, providers, pharmaceuticals). This data could be an enabling resource for deriving insights for improving care delivery and reducing waste. The enormity and complexity of these datasets present great challenges in analyses and subsequent applications to a practical clinical environment.",Big Data Analytics in Healthcare,https://www.udacity.com/course/big-data-analytics-in-healthcare--ud758
,School of Business,['Patrick Nussbaumer'],Business Analyst,intermediate,"['A/B Randomized Design Tests, ', 'A/B Matched Pair Design Tests']","The A/B Testing course provides students with the foundational knowledge to design and analyze A/B tests to create business insights and support decision making. You will learn:, Throughout this course you’ll also learn the techniques to apply your knowledge in a data analytics program called Alteryx., This course is part of the Business Analyst Nanodegree.",A/B Testing for Business Analysts,https://www.udacity.com/course/ab-testing--ud979
,School of Development,['Jarrod Parkes'],Become an iOS Developer,advanced,"['Networking, ', 'URLSession, ', 'JSON Parsing']","In this course, you’ll learn how to incorporate networking into your apps, so they can access data from around the world. You’ll learn how to harness the power of APIs to display images and retrieve movie data. At the end of the course, you’ll build the “On the Map” app which allows you to share interesting links, projects, or other information with fellow Udacity students.",iOS Networking with Swift,https://www.udacity.com/course/ios-networking-with-swift--ud421
Collaboration WithGoogle,School of Development,"['Ido Green', 'Cameron Pittman']",Front-End Web Developer,intermediate,"['Research HTML5 input types, ', 'Datalist input, ', 'User input validation with HTML5 attributes, ', 'Validate user input using JavaScript, ', 'Optimizing forms']","Any meaningful experience on the web has a form. Whether it's a form made of text boxes, toggles, buttons, checkboxes, or touchable widgets, web developers need to be purposeful about forms to make users happy and increase conversions., In this course, you'll learn best practices for modern forms as taught by Google's Ido Green and Udacity's Cameron Pittman. You'll practice your skills along the way with a few self-directed projects, including an e-commerce checkout and an event planner app!, As a special treat, you'll also watch a series of interviews with Luke Wroblewski, Google Product Director and author of Web Form Design, to get his take on interactions for the modern web.",Building High Conversion Web Forms,https://www.udacity.com/course/building-high-conversion-web-forms--ud890
,School of Development,['Gabrielle Miller-Messner'],Become an iOS Developer,intermediate,"['AutoLayout, ', 'Navigation, ', 'Table Views, ', 'Collection Views']","In this course, you will build a series of simple apps to become more comfortable with the UIKit framework and master its most widely used components. This framework constitutes the building blocks of the user interface for all iOS apps, and is crucial for any iOS Developer to be intimately familiar with.",UIKit Fundamentals,https://www.udacity.com/course/uikit-fundamentals--ud788
Collaboration WithAlteryx,School of Business,['Ben Burkholder'],Business Analyst,intermediate,"['Binary Classication Models, ', 'Non-Binary Classification Models']","The Classification Models course provides students with the foundational knowledge to use classification models to create business insights. You will learn:
How classification modeling differs from modeling with numeric data
 To use binary classification models to make predictions of binary outcomes
 To use non-binary classification models to make predictions of non-binary outcomes, Throughout this course you’ll also learn the techniques to apply your knowledge in a data analytics program called Alteryx. At the end of the course, you’ll complete a project based on the principles in the course., This course is part of the Business Analyst Nanodegree.",Classification Models,https://www.udacity.com/course/classification-models--ud978
Collaboration WithGoogle,School of Development,"['Steve Ganem', 'Todd Kerpelman', 'Jessica Lin', 'Daniel Mai']",Android Developer,intermediate,"['Firebase, ', 'Analytics']","In this course, you’ll learn how to grow an app's user base using Firebase Analytics, a free and unlimited analytics solution. You'll be able to learn who your users are and how they interact with your app. You can then use this information to make informed decisions to improve your app, such as how difficult to make a level in a game, where to place an advertisement, or what products to stock., We'll begin by covering the basics of digital analytics focusing on an app that is live in the App Store and Google Play Store as an example. You'll then explore the app's actual usage data using the Firebase console. After that, you'll learn how easy it is to add Firebase Analytics to an app and quickly gain insights. Finally, you'll learn how to use Firebase Crash Reporting, Firebase Remote Config, and Firebase Dynamic Links integrated with Firebase Analytics to improve your app and grow your user base., By the end of this course you'll have an app that records how users interact with it, and you'll know how use that data to improve performance. You'll have the foundation needed to apply Firebase Analytics to your own apps.",Firebase Analytics: Android,https://www.udacity.com/course/firebase-analytics-android--ud354
Collaboration WithGoogle VR,,"['Austin McCasland', 'Chris Birke', 'Vasanth Mohan', 'Matt Sonic']",VR Developer,beginner,"['VR development, ', 'Unity, ', 'Google VR SDK for Unity, ', 'C#, ', 'UI interfaces and interaction']","This course is designed to teach you how to make your VR experience more dynamic and responsive to your users. You will be exposed to C# programming and be using it in the Unity interface. Upon completing this course, you will have learned basic programming constructs such as methods, loops, and variables. You will also be able to use events and know how to apply them in a VR environment.",VR Software Development,https://www.udacity.com/course/vr-software-development--ud1014
Collaboration WithGeorgia Institute of Technology,School of Artificial Intelligence,"['Ashok Goel', 'David Joyner']",Flying Cars & Autonomous Flight,advanced,"['Semantic Networks, ', 'Common-Sense Reasoning, ', 'Logic & Planning, ', 'Analogical Reasoning, ', 'Visuospatial Reasoning']","This class is offered as CS7637 at Georgia Tech where it is a part of the Online Masters Degree (OMS). Taking this course here will not earn credit towards the OMS degree., This is a core course in artificial intelligence. It is designed to be a challenging course, involving significant independent work, readings, assignments, and projects. It covers structured knowledge representations, as well as knowledge-based methods of problem solving, planning, decision-making, and learning., The class is organized around three primary learning goals. First, this class teaches the concepts, methods, and prominent issues in knowledge-based artificial intelligence. Second, it teaches the specific skills and abilities needed to apply those concepts to the design of knowledge-based AI agents. Third, it teaches the relationship between knowledge-based artificial intelligence and the study of human cognition.",Knowledge-Based AI: Cognitive Systems,https://www.udacity.com/course/knowledge-based-ai-cognitive-systems--ud409
,School of Autonomous Systems,"['Jörn Loviscach', 'Miriam Swords Kalk']",Machine Learning Engineer,intermediate,"['Math, ', 'Differential Equations']","In this course, you'll hone your problem-solving skills through learning to find numerical solutions to systems of differential equations. You'll write code in Python to fight forest fires, rescue the Apollo 13 astronauts, stop the spread of epidemics, and resolve other real-world dilemmas.",Differential Equations in Action,https://www.udacity.com/course/differential-equations-in-action--cs222
Collaboration WithGeorgia Institute of Technology,,"['Irfan Essa', 'David Joyner', 'Arpan Chakraborty']",Artificial Intelligence,intermediate,"['Digital Imaging, ', 'Panorama & Morphing, ', 'Light Field, ', 'High Dynamic Range, ', 'Video Stabilization']","This class explores how computation impacts the entire workflow of photography, which is traditionally aimed at capturing light from a 3D scene to form a 2D image. A detailed study of the perceptual, technical and computational aspects of forming pictures, and more precisely the capture and depiction of reality on a (mostly 2D) medium of images is undertaken over the entire term. The scientific, perceptual, and artistic principles behind image-making will be emphasized, especially as impacted and changed by computation., Topics include the relationship between pictorial techniques and the human visual system; intrinsic limitations of 2D representations and their possible compensations; and technical issues involving capturing light to form images. Technical aspects of image capture and rendering, and exploration of how such a medium can be used to its maximum potential, will be examined. New forms of cameras and imaging paradigms will be introduced.",Computational Photography,https://www.udacity.com/course/computational-photography--ud955
