affiliation,category,instructors,nanodegree,skill_level,skills,summary,title,url
Collaboration WithGrow With Google,Career Advancement,,Become a Professional React Developer,beginner,"['Resume writing, ', 'Company targeting, ', 'Storytelling']","Your resume is the first step in the job search. Through this course, you will identify the companies you want to work for, and showcase your key achievements to align with their roles. With our proven industry framework, you will build a tech-focused resume that will help you get noticed and land the interview.",Refresh Your Resume,https://www.udacity.com/course/refresh-your-resume--ud243
,Career Advancement,,Predictive Analytics for Business,beginner,"['Creating a narrative, ', 'Targeting your pitch, ', 'Communicating value']","Introduce yourself with a memorable cover letter. In this short course, you'll use proven writing techniques to show why you are the best person for the job. You’ll learn how to research company values, target your pitch, and craft an authentic story that connects with their mission. We give you the research and writing tools you need to show why you're the best person for the job!",Craft Your Cover Letter,https://www.udacity.com/course/craft-your-cover-letter--ud244
Collaboration WithGrow With Google,Career Advancement,,Self-Driving Car Engineer Nanodegree,beginner,"['GitHub, ', 'Version Control, ', 'Repositories']","GitHub is the preferred platform for showcasing your programming projects. Some technical recruiters and hiring managers even use GitHub to find candidates. In this course, you'll learn GitHub best practices from technical experts. You'll compare different styles for committing changes, forking repos, and merging pull requests. You'll also understand how to organize your code to showcase your technical projects. And you'll learn how to collaborate with other engineers on GitHub. Technical hiring managers will share GitHub profile tips that generate more job opportunities. Gain the confidence you need to establish your presence in the open source community.",Optimize Your GitHub,https://www.udacity.com/course/optimize-your-github--ud247
Collaboration WithGrow With Google,Career Advancement,,Become a Digital Marketer,beginner,"['Personal branding, ', 'LinkedIn, ', 'Networking']","Networking is an essential job search skill. In this course, you'll learn strategies and tactics for effective networking. You'll learn to make personal connections in-person and online. You'll discover how to establish rapport with recruiters, employers, and industry professionals. You'll learn how to craft a professional narrative and elevator pitch. You'll get tips to optimize your LinkedIn profile and write emails that get replies. We give you the confidence you need to make personal connections and improve your job search.",Strengthen Your LinkedIn Network & Brand,https://www.udacity.com/course/strengthen-your-linkedin-network-and-brand--ud242
,Career Advancement,,Become an iOS Developer,intermediate,"['Interview practice, ', 'Swift, ', 'Data structures']","Technical interviews follow a pattern. If you know the pattern, you’ll be a step ahead of the competition. This course will introduce you to common data structures and algorithms in Swift. You'll review frequently-asked technical interview questions and learn how to structure your responses.You will answer practice problems and quizzes to test your abilities. Then you'll practice mock interviews to get specific recommendations for improvement. Be ready for anything the technical interviewer throws at you.",Data Structures & Algorithms in Swift,https://www.udacity.com/course/data-structures-and-algorithms-in-swift--ud1011
,Career Advancement,,Data Analyst Nanodegree,intermediate,"['Interview practice, ', 'Common Data Questions, ', 'Data Structures']","Data science job interviews  can be daunting. Technical interviewers often ask you to design an experiment or model. You may need to solve problems using Python and SQL. You will likely need to show how you connect data skills to business decisions and strategy.In this course, you'll review the common questions asked in data science, data analyst, and machine learning interviews. You'll learn how to answer machine learning questions about predictions, underfitting and overfitting. You'll walk through typical data analyst questions about statistics and probability. Then, you'll dive deeper into the data structures and algorithms you need to know. You'll also learn tips for answering questions like, ""Tell me about one of your recent projects."" At the end of the course, you'll have a chance to practice what you've learned. You'll receive a link for unlimited mock interviews on Pramp. Practice the skills you need to show up for your data science interview with confidence!",Data Science Interview Prep,https://www.udacity.com/course/data-science-interview-prep--ud944
,Career Advancement,,Become a Front End Developer,intermediate,"['Interview questions, ', 'Common FE Questions, ', 'Whiteboarding']","This course takes you through a mock interview, and offers detailed analysis on how to field key industry questions. Your will review common Front-End Web Developer interview topics ranging from palindrome functions to closures, and learn best practices for behavioral questions and whiteboard problems. Upon completing this course, you’ll be ready to successfully  showcase your skills during a Front-End Web Developer interview!",Front-End Interview Prep,https://www.udacity.com/course/front-end-interview-prep--ud250
Collaboration WithGrow With Google,Career Advancement,,Become an Android Developer,intermediate,"['Interview practice, ', 'Common Android Questions, ', 'Whiteboarding']","This course is an excellent way to prepare for technical interviews. You’ll experience a mock interview, and review detailed analysis on how to field key industry questions. You’ll work through common Android Developer interview topics ranging from explicit and implicit intents to designing a min stack, and you’ll learn best practices for behavioral questions and whiteboard problems. Upon completing the course, you’ll be ready to showcase your skills during the Android Developer interview!",Android Interview Prep,https://www.udacity.com/course/android-interview-prep--ud241
Collaboration WithGrow With Google,Career Advancement,,VR Developer Nanodegree,intermediate,"['Interview practice, ', 'Common VR Questions, ', 'Whiteboarding']","This course is an excellent way to prepare for technical interviews. You’ll experience a mock interview, and review detailed analysis on how to field key industry questions. You'll review common VR Developer interview topics, including 3D graphics and scene optimization. You'll also learn best practices for answering behavioral questions and solving whiteboard problems. Upon completing this course, you’ll be ready to showcase your skills during your VR Developer interview!",VR Interview Prep,https://www.udacity.com/course/vr-interview-prep--ud251
,Career Advancement,,Become a Professional Full Stack Developer,intermediate,"['Interview practice, ', 'Common FS Questions, ', 'Whiteboarding']","This course is an excellent way to prepare for technical interviews. You’ll experience a mock interview, and review detailed analysis on how to field key industry questions. You’ll review common Full Stack Web Developer interview topics like palindrome functions and data structures. You’ll also learn best practices for behavioral questions and whiteboard problems. Upon completing this course, you’ll be ready to showcase your skills during your Full Stack Web Developer interview!",Full-Stack Interview Prep,https://www.udacity.com/course/full-stack-interview-prep--ud252
,Career Advancement,,Become an iOS Developer,intermediate,"['Interview practice, ', 'Common iOS Questions, ', 'Whiteboarding']","This course is an excellent way to prepare for technical interviews. You’ll experience a mock interview, and review detailed analysis on how to field key industry questions. You’ll review common iOS Developer interview topics ranging from notifications and delegates to the model view controller, and learn best practices for behavioral questions and whiteboard problems. You'll learn how to discuss your interests in iOS development. Senior mobile developers will share their tips for addressing common data issues. When you complete this course, you’ll be ready to showcase your skills during the iOS Developer interview!",iOS Interview Prep,https://www.udacity.com/course/ios-interview-prep--ud240
Collaboration WithGoogle,School of Development,"['Dan Galpin', 'Lyla Fujiwara', 'Reto Meier', 'Asser Samak', 'James Williams', 'Cezanne Camacho', 'Jose Nieto', 'Jocelyn Becker']",Android Developer,intermediate,"['Android, ', 'Layouts, ', 'Intents, ', 'UI']","As the first course in the Android Developer Nanodegree,  Developing Android Apps is the foundation of our advanced Android curriculum. This course blends theory and practice to help you build great apps the right way. In this course, you'll work with instructors step-by-step to build a cloud-connected Android app, and learn best practices of mobile development, and Android development in particular.",Developing Android Apps,https://www.udacity.com/course/new-android-fundamentals--ud851
Collaboration WithGoogle,School of Development,"['Katherine Kuan', 'Kunal Chawla']",Android Basics,beginner,"['XML Markup Language, ', 'Building Layouts, ', 'Android Studio, ', 'Views and ViewGroups, ', 'Styling']","Learn the basics of Android and Java programming, and take the first step on your journey to becoming an Android developer!, This course is designed for students who are new to programming, and want to learn how to build Android apps. You don’t need any programming experience to take this course. If you’ve been using a smartphone to surf the web and chat with friends, then you’re our perfect target student!, Learning anything new can be tough. We will walk you through the process of making Android apps, but to get the most out of this course, you must bring your enthusiasm for learning, and budget time on your calendar to learn with us., By the end of this course, you will have learned how to build an app’s layout and then practiced those skills by making a birthday card app., If you’re curious about the road even farther ahead, these are the free courses that make up the Android Basics Nanodegree, in order: ",Android Basics: User Interface,https://www.udacity.com/course/android-basics-user-interface--ud834
,School of Development,['Dave Evans'],Data Analyst,beginner,"['Python, ', 'Managing Data, ', 'Responding to Queries, ', 'How programs run']","In this introduction to computer programming course, you’ll learn and practice key computer science concepts by building your own versions of popular web applications. You’ll learn Python, a powerful, easy-to-learn, and widely used programming language, and you’ll explore computer science basics, as you build your own search engine and social network.",Intro to Computer Science,https://www.udacity.com/course/intro-to-computer-science--cs101
Collaboration WithGoogle,School of Artificial Intelligence,"['Vincent Vanhoucke', 'Arpan Chakraborty']",Deep Learning,intermediate,"['Neural Networks, ', 'Convolutional Neural Networks, ', 'Computer Vision, ', 'Natural Language Processing, ', 'TensorFlow']","Machine learning is one of the fastest-growing and most exciting fields out there, and deep learning represents its true bleeding edge. In this course, you’ll get an overview of what deep learning is all about., Partnering with Vincent Vanhoucke, Principal Scientist at Google, and technical lead in the Google Brain team, we’ll teach you how deep learning builds on machine learning. Then you’ll get a chance to learn more about deep neural networks and advanced architectures such as convolutional networks and recurrent networks., And if you’d like to dive even deeper into this cutting-edge field, we recommend that you continue your studies with our full-fledged Deep Learning Nanodegree program to get more hands-on experience.",Deep Learning,https://www.udacity.com/course/deep-learning--ud730
,School of Development,"['Julia Van Cleve', 'James Parkes']",Front-End Web Developer,beginner,"['JavaScript, ', 'Conditionals, ', 'Loops, ', 'Data Types & Variables']","Learn the fundamentals of JavaScript, the most popular programming language in web development.",Intro to JavaScript,https://www.udacity.com/course/intro-to-javascript--ud803
,School of Artificial Intelligence,"['Katie Malone', 'Sebastian Thrun']",Machine Learning Engineer,intermediate,"['Machine Learning, ', 'Supervised Learning, ', 'Unsupervised Learning, ', 'Evaluation Metrics, ', 'Data Manipulation']","Machine Learning is a first-class ticket to the most exciting careers in data analysis today. As data sources proliferate along with the computing power to process them, going straight to the data is one of the most straightforward ways to quickly gain insights and make predictions.  , Machine learning brings together computer science and statistics to harness that predictive power. It’s a must-have skill for all aspiring data analysts and data scientists, or anyone else who wants to wrestle all that raw data into refined trends and predictions., This is a class that will teach you the end-to-end process of investigating data through a machine learning lens. It will teach you how to extract and identify useful features that best represent your data, a few of the most important machine learning algorithms, and how to evaluate the performance of your machine learning algorithms., This course is also a part of our Data Analyst Nanodegree.",Intro to Machine Learning,https://www.udacity.com/course/intro-to-machine-learning--ud120
,School of Development,"['Cameron Pittman', 'James Parkes']",Front-End Web Developer,beginner,"['HTML, ', 'CSS, ', 'CSS Syntax, ', 'HTML Syntax Problem Set']","Throughout this course, you'll learn about the underlying structure of the web - HTML. You'll learn how to use this tree-like structure to create websites. You'll also learn how to apply styling to a website through CSS. You'll learn about CSS syntax, selectors, and units. Along the way, you'll also learn about code editors and a browser's Developer Tools.",Intro to HTML and CSS,https://www.udacity.com/course/intro-to-html-and-css--ud001
,School of Development,"['Cezanne Camacho', 'Asser Samak']",Android Basics,beginner,"['Java Programming, ', 'Java Syntax, ', 'Java Functions, ', 'Loops']","Taking this course will provide you with a basic foundation in Java syntax, which is the first step towards becoming a successful Java developer. You’ll learn how computers make decisions and how Java keeps track of information through variables and data types. You’ll learn to create conditional statements, functions, and loops to process information and solve problems. You’ll even learn to use IntelliJ, a Java IDE (Integrated Development Environment) that professional developers use, to build, compile, and debug your code. These are foundational programming skills, and mastering them is a must for all aspiring programmers. This course is the first in our Java Programming course series. After you complete this course, you'll be ready to take Object Oriented Programming in Java.",Java Programming Basics,https://www.udacity.com/course/java-programming-basics--ud282
,School of Development,"['Caroline Buckey', 'Sarah Spikes']",Become an iOS Developer,beginner,"['GitHub, ', 'Version Control, ', 'Repositories']","Effective use of version control is an important and useful skill for any developer working on long-lived (or even medium-lived) projects, especially if more than one developer is involved. This course, built with input from GitHub, will introduce the basics of using version control by focusing on a particular version control system called Git and a collaboration platform called GitHub., This course is part of the  Front End and  Full Stack Nanodegrees..",How to Use Git and GitHub,https://www.udacity.com/course/how-to-use-git-and-github--ud775
,School of Development,['Kunal Chawla'],Full Stack Web Developer,beginner,"['Python, ', 'Functions, ', 'Classes, ', 'Create a Class']","In this introductory programming class, you’ll learn Object-Oriented Programming, a must-have technique for software engineers that will allow you to reuse and share code easily. You’ll learn by doing, and will build byte-sized (ha!) mini projects in each lesson to learn and practice programming concepts. , We’ve heard that programming can be intimidating for newcomers, and we’ve created this course to make sure that you have a great learning experience! You’ll learn actively with our mini projects (see the awesome list below), which you’ll be able to share proudly with your friends. You’ll also learn important programming concepts one by one, with no surprises or leaps of logic along the way. , You’ll pick up some great tools for your programming toolkit in this course! You will: , This introductory course is for you if you want to be a software engineer, or if you want to collaborate with programmers. Mastering Object-Oriented Programming will propel your career in tech forward, and it’s also a great way to learn how software engineers think about solving problems., This course is also a part of our Full Stack Web Developer Nanodegree.",Programming Foundations with Python,https://www.udacity.com/course/programming-foundations-with-python--ud036
,School of Artificial Intelligence,"['Peter Norvig', 'Sebastian Thrun']",Deep Learning,intermediate,"['Artificial Intelligence, ', 'Machine Learning, ', 'Probability, ', 'Logic and Planning, ', 'Markov models']","Artificial Intelligence (AI) is a field that has a long history but is still constantly and actively growing and changing. In this course, you’ll learn the basics of modern AI as well as some of the representative applications of AI. Along the way, we also hope to excite you about the numerous applications and huge possibilities in the field of AI, which continues to expand human capability beyond our imagination., Note: Parts of this course are featured in the Machine Learning Engineer Nanodegree and the Data Analyst Nanodegree programs. If you are interested in AI, be sure to check out those programs as well!",Intro to Artificial Intelligence,https://www.udacity.com/course/intro-to-artificial-intelligence--cs271
,School of Artificial Intelligence,"['Ronald Rogers', 'Katie Kormanik', 'Sean Laraway']",Artificial Intelligence,beginner,"['Descriptive Statistics, ', 'Estimation, ', 'Central Limit Theorem']","Statistics is an important field of math that is used to analyze, interpret, and predict outcomes from data. Descriptive statistics will teach you the basic concepts used to describe data. This is a great beginner course for those interested in Data Science, Economics, Psychology, Machine Learning, Sports analytics and just about any other field.",Intro to Descriptive Statistics,https://www.udacity.com/course/intro-to-descriptive-statistics--ud827
Collaboration WithGoogle,School of Development,"['Mary Xia', 'Matt Sullivan', 'James Williams']",Android Developer,intermediate,,"In this course, you'll learn how to use Flutter to quickly develop high-quality, interactive mobile applications for iOS and Android devices. Whether you’re just getting started with mobile app development, or experienced with other mobile app frameworks, you’ll enjoy the high-velocity development and quality apps that Flutter enables. , Work with Google instructors step-by-step to build an app in one codebase that compiles down to native ARM code and has high performance on both iOS and Android. Learn how to develop fast by making use of Flutter's reactive framework, stateful Hot Reload, and integrated tooling. Customize your app with rich, composable widgets, built-in animations, and a layered, extensible architecture.",Build Native Mobile Apps with Flutter,https://www.udacity.com/course/build-native-mobile-apps-with-flutter--ud905
,School of Data Science,['Caroline Buckey'],Data Analyst,beginner,"['Data Analysis, ', 'Python, ', 'numpy, ', 'pandas']","This course will introduce you to the world of data analysis. You'll learn how to go through the entire data analysis process, which includes:, You'll also learn how to use the Python libraries NumPy, Pandas, and Matplotlib to write code that's cleaner, more concise, and runs faster., This course is part of the Data Analyst Nanodegree.",Intro to Data Analysis,https://www.udacity.com/course/intro-to-data-analysis--ud170
Collaboration WithGoogle,School of Development,"['Katherine Kuan', 'Kunal Chawla', 'Lyla Fujiwara']",Android Basics,beginner,"['Java, ', 'Object Oriented Programming, ', 'Conditional Code, ', 'Methods, ', 'Variables']","Learn the basics of Android and Java programming, and take the first step on your journey to becoming an Android developer!
This course is designed for students who are new to programming, and want to learn how to build Android apps. You don’t need any programming experience to take this course. If you’ve been using a smartphone to surf the web and chat with friends, then you’re our perfect target student!, Learning anything new can be tough. We will walk you through the process of making Android apps, but to get the most out of this course, you must bring your enthusiasm for learning, and budget time on your calendar to learn with us., By the end of this course, you will have learned how to make your app interactive using buttons and changing text. You will have practiced those skills by making a basketball scores app, and you will have built a full coffee-ordering app., If you’re curious about the road even farther ahead, these are the free courses that make up the Android Basics Nanodegree, in order: ",Android Basics: User Input,https://www.udacity.com/course/android-basics-user-input--ud836
,School of Business,"['Steve Blank', 'Kathleen Mullaney']",Business Analyst,intermediate,"['Entrepreneurship, ', 'Value Proposition, ', 'Revenue Models, ', 'Customer Segments']","In an introduction to the basics of the famous Customer Development Process, Steve Blank provides insight into the key steps needed to build a successful startup. , The main idea in this course is learning how to rapidly develop and test ideas by gathering massive amounts of customer and marketplace feedback. Many startups fail by not validating their ideas early on with real-life customers. In order to mitigate that, students will learn how to get out of the building and search for the real pain points and unmet needs of customers. Only with these can the entrepreneur find a proper solution and establish a suitable business model., Building a startup is not simply building an execution plan for a business model that the entrepreneur thinks will work, but rather, a search for the actual business model itself.",How to Build a Startup,https://www.udacity.com/course/how-to-build-a-startup--ep245
,School of Development,['Sebastian Thrun'],Artificial Intelligence,beginner,"['Probability, ', 'Descriptive Statistics, ', 'Inferential Statistics']","Statistics is about extracting meaning from data. In this class, we will introduce techniques for visualizing relationships in data and systematic techniques for understanding the relationships using mathematics.",Intro to Statistics,https://www.udacity.com/course/intro-to-statistics--st101
,School of Data Science,"['Dave Holtz', 'Cheng-Han Lee']",Data Analyst,intermediate,"['Data Analysis Process, ', 'pandas (Python package), ', 'MapReduce paradigm']","The Introduction to Data Science class will survey the foundational topics in data science, namely:, The class will focus on breadth and present the topics briefly instead of focusing on a single topic in depth. This will give you the opportunity to sample and apply the basic techniques of data science., This course is also a part of our Data Analyst Nanodegree.",Intro to Data Science,https://www.udacity.com/course/intro-to-data-science--ud359
Collaboration WithGoogle,School of Development,"['Lyla Fujiwara', 'Cezanne Camacho', 'Asser Samak', 'Nikita Gamolsky', 'Jessica Lin', 'Dan Galpin']",Android Developer,advanced,"['Android, ', 'Fragments, ', 'Libraries, ', 'Firebase, ', 'Espresso']","Ready to level-up your skills as an Android developer? In this course, you will learn how to make your app production-ready by developing a variety of different sample apps, each designed to showcase advanced capabilities of the Android platform, including fragments, widgets, media playback, and testing. You’ll learn how to create UI tests using the Espresso framework, to leverage third-party libraries and services like ExoPlayer and Firebase Cloud Messaging, and use Google APIs to make your app aware of its location. By the end of the course, you’ll know how to publish your own app to the Google Play Store, where you can reach and engage users across the globe.",Advanced Android App Development,https://www.udacity.com/course/advanced-android-app-development--ud855
